Name,Spec
더본코리아 백종원의 만능 마라소스 120g,소스/드레싱/시럽/소스/중식소스/보관방법: 실온보관
더본코리아 백종원의 만능 장아찌 간장소스 1.5L,"소스/드레싱/시럽/소스/기타소스/보관방법: 실온보관/탈지대두(외국산), 정제소금(국내산)"
더본코리아 백종원의 만능 장아찌 간장소스 1.8L,"소스/드레싱/시럽/소스/기타소스/보관방법: 실온보관/탈지대두(외국산), 정제소금(국내산)"
더본코리아 백종원의 소불고기양념 160g,소스/드레싱/시럽/소스/고기양념
더본코리아 빽쿡 백종원 떡볶이양념 155g,소스/드레싱/시럽/소스
더본코리아 빽쿡 백종원 만능볶음요리소스 340g,소스/드레싱/시럽/소스
더본코리아 빽쿡 백종원의 만능 마라소스 120g,드레싱
데체코 바질페스토 190g,소스/드레싱/시럽/소스/기타소스/보관방법: 실온보관
데체코 슈고 알라 나포레타나 400g,소스/드레싱/시럽/소스/파스타소스/보관방법: 실온보관
데체코 폴파 콜포사 690g,소스/드레싱/시럽/소스/파스타소스/보관방법: 실온보관
데체코 폴파 파인 400g,소스/드레싱/시럽/소스/파스타소스/보관방법: 실온보관
델리타이 J-Lek 스리라차 마요소스 235ml,소스/드레싱/시럽/소스/칠리 소스/보관방법: 실온보관
델리타이 J-Lek 스리라차 소스 235ml 1개,드레싱
델리타이 J-Lek 스리라차 소스 235ml 3개,소스/드레싱/시럽/소스/드레싱
동방푸드마스타 단짠 디핑소스 50g,소스/드레싱/시럽/소스/기타소스
동방푸드마스타 맵단 디핑소스 50g,소스/드레싱/시럽/소스/기타소스
동방푸드마스타 제일제당 이마트 삽겹살 소스 오리지널 245g,소스/드레싱/시럽/소스/고기양념
동방푸드마스타 할라피뇨 마요소스 50g,소스/드레싱/시럽/소스
동보식품 우동다시 우동 소스 2kg,소스/드레싱/시럽/소스/플라스틱/대용량(업소용)
동아식품 참소당 다용도 불닭 소스 2kg,소스/드레싱/시럽/소스/불닭소스/보관방법: 실온보관/고춧가루(외국산)
동아식품 참소당 다용도 찌개 소스 10kg,소스/드레싱/시럽/소스/찌개양념/보관방법: 냉동보관/대용량(업소용)/고춧가루(중국산)
동아식품 참소당 다용도 찌개 소스 2kg,소스/드레싱/시럽/소스/찌개양념/보관방법: 냉동보관/고춧가루(중국산)
동아식품 참소당 닭갈비 소스 10kg,소스/드레싱/시럽/소스/고기양념/보관방법: 냉장보관/레몬식초(이스라엘산)
동아식품 참소당 닭갈비 소스 2kg,소스/드레싱/시럽/소스/고기양념/보관방법: 냉장보관/레몬식초(이스라엘산)
동아식품 참소당 데리야끼 소스 2kg,소스/드레싱/시럽/소스/일식소스/보관방법: 실온보관/탈지대두(외국산)
동아식품 참소당 맛내기 소스 1.8L,소스/드레싱/시럽/소스/기타소스/보관방법: 실온보관/정제소금(국내산)
동아식품 참소당 매운 갈비찜 소스 10kg,소스/드레싱/시럽/소스/고기양념/보관방법: 냉동보관/대용량(업소용)/고춧가루(중국산)
동아식품 참소당 매운 갈비찜 소스 2kg,소스/드레싱/시럽/소스/고기양념/보관방법: 냉동보관/고춧가루(중국산)
동아식품 참소당 매운탕 양념 2kg,소스/드레싱/시럽/소스/기타소스/보관방법: 냉동보관/청양고추분(중국산)
동아식품 참소당 샤브샤브 소스 1.8L,소스/드레싱/시럽/소스/기타소스/보관방법: 실온보관/가다랑어(필리핀산)
동아식품 참소당 스파이스 양식 돈까스 소스 2kg,소스/드레싱/시럽/소스/돈까스 소스/보관방법: 실온보관/토마토페이스트(외국산)
동아식품 참소당 양식 돈까스 소스 1.8L,소스/드레싱/시럽/소스/돈까스 소스/보관방법: 냉장보관/토마토페이스트(외국산)
동아식품 참소당 오므라이스 소스 900ml,소스/드레싱/시럽/소스/기타소스/보관방법: 냉장보관/토마토페이스트(외국산)
동아식품 참소당 유자폰쯔유 900ml,소스/드레싱/시럽/소스/기타소스/보관방법: 실온보관/탈지대두(외국산)
동아식품 참소당 정통 양식 돈까스 소스 2kg,소스/드레싱/시럽/소스/돈까스 소스/보관방법: 냉장보관/대용량(업소용)/토마토페이스트(외국산)
동원F&B 매콤달콤 닭강정 소스 2.1kg,소스/드레싱/시럽/소스/기타소스/보관방법: 실온보관/대용량(업소용)
동원F&B 사워크림소스 1kg,소스/드레싱/시럽/소스/기타소스/스파우트팩
동원F&B 양념치킨 매운맛소스 2.1kg,소스/드레싱/시럽/소스/기타소스/보관방법: 실온보관/대용량(업소용)
동원홈푸드 간장치킨소스 30g,소스/드레싱/시럽/소스/일회용/대용량(업소용)
동원홈푸드 갈릭 디핑소스 15g,소스/드레싱/시럽/소스/기타소스/일회용/대용량(업소용)
동원홈푸드 갈릭 디핑소스 2kg,소스/드레싱/시럽/소스/기타소스/스파우트팩/대용량(업소용)
동원홈푸드 갈릭 디핑소스 30g,소스/드레싱/시럽/소스/기타소스/일회용/플라스틱
동원홈푸드 굽네 볼케이노 소스 290g,"소스/드레싱/시럽/소스/고춧가루(중국산, 베트남산), 마늘(중국산, 국내산)"
동원홈푸드 나쵸치즈소스 1kg,소스/드레싱/시럽/소스/대용량(업소용)
동원홈푸드 더맛있는 국물떡볶이 분말 500g,소스/드레싱/시럽/소스/떡볶이 소스/보관방법: 실온보관/대용량(업소용)
동원홈푸드 동원 프리미엄 피자소스 3kg,소스/드레싱/시럽/소스/대용량(업소용)
동원홈푸드 맥코믹 갈릭 디핑소스 920g,소스/드레싱/시럽/소스
동원홈푸드 비비드키친 발사믹드레싱 220g,소스/드레싱/시럽/드레싱/보관방법: 냉장보관
동원홈푸드 비비드키친 비건마요 소스 250g,소스/드레싱/시럽/소스/마요네즈/보관방법: 실온보관
동원홈푸드 비비드키친 어니언크림드레싱 200g,소스/드레싱/시럽/드레싱/보관방법: 냉장보관
동원홈푸드 비비드키친 오리엔탈드레싱 215g,소스/드레싱/시럽/드레싱/보관방법: 냉장보관
동원홈푸드 비비드키친 저당 굴소스 310g,소스/드레싱/시럽/소스/굴소스/보관방법: 실온보관
동원홈푸드 비비드키친 저당 돈까스 소스 285g,소스/드레싱/시럽/소스/돈까스 소스/튜브형
동원홈푸드 비비드키친 저당 마라소스 280g,소스/드레싱/시럽/소스/중식소스/보관방법: 실온보관
동원홈푸드 비비드키친 저당 시저드레싱 205g,소스/드레싱/시럽/드레싱
동원홈푸드 비비드키친 저당 양파절임소스 220g,소스/드레싱/시럽/소스/기타소스/튜브형
동원홈푸드 비비드키친 저당 오리엔탈드레싱 210g,소스/드레싱/시럽/드레싱
동원홈푸드 비비드키친 저당 짜장소스 300g,소스/드레싱/시럽/소스/중식소스/튜브형
동원홈푸드 비비드키친 저당 짬뽕소스 280g,소스/드레싱/시럽/소스/튜브형
동원홈푸드 비비드키친 저당 참깨소이 드레싱 200g,소스/드레싱/시럽/드레싱/플라스틱
동원홈푸드 비비드키친 저칼로리 데리야끼 소스 285g,소스/드레싱/시럽/소스/일식소스/튜브형
동원홈푸드 비비드키친 저칼로리 데리야끼소스 285g,소스/드레싱/시럽/소스/일식소스/보관방법: 실온보관
동원홈푸드 비비드키친 저칼로리 레몬 칠리 드레싱 220g,소스/드레싱/시럽/소스/칠리 소스/보관방법: 실온보관
동원홈푸드 비비드키친 저칼로리 머스타드소스 280g,소스/드레싱/시럽/소스/머스타드 소스/보관방법: 실온보관
동원홈푸드 비비드키친 저칼로리 바베큐소스 280g,소스/드레싱/시럽/소스/바베큐 소스/보관방법: 실온보관
동원홈푸드 비비드키친 저칼로리 바비큐소스 320g,소스/드레싱/시럽/소스/바베큐 소스/튜브형
동원홈푸드 비비드키친 저칼로리 숯불매콤소스 290g,소스/드레싱/시럽/소스/기타소스/보관방법: 실온보관
동원홈푸드 비비드키친 저칼로리 스위트칠리 소스 280g,소스/드레싱/시럽/소스/칠리 소스/튜브형
동원홈푸드 비비드키친 저칼로리 스위트칠리소스 280g,소스/드레싱/시럽/소스/칠리 소스/보관방법: 실온보관
동원홈푸드 비비드키친 저칼로리 양념치킨소스 290g,소스/드레싱/시럽/소스/기타소스/보관방법: 실온보관
동원홈푸드 비비드키친 저칼로리 토마토케첩 280g,소스/드레싱/시럽/소스/케찹/보관방법: 실온보관
동원홈푸드 비비드키친 저칼로리 할라피뇨 케첩 280g,소스/드레싱/시럽/소스/케찹/튜브형
동원홈푸드 비비드키친 참깨소이드레싱 210g,소스/드레싱/시럽/드레싱/보관방법: 냉장보관
동원홈푸드 비셰프 갈릭디핑소스 2kg,"소스/드레싱/시럽/소스/기타소스/보관방법: 냉장보관/대용량(업소용)/건마늘후레이크(중국산), 갈릭오일(멕시코산), 계란(국내산) 등"
동원홈푸드 비셰프 갈릭디핑소스 골드 1kg,"소스/드레싱/시럽/소스/기타소스/보관방법: 냉장보관/대용량(업소용)/건마늘후레이크(중국산), 갈릭오일(멕시코산), 계란(국내산) 등"
동원홈푸드 비셰프 나쵸치즈소스 1kg,소스/드레싱/시럽/소스/기타소스/보관방법: 냉장보관/대용량(업소용)
동원홈푸드 비셰프 돈까스소스-골드 2kg,소스/드레싱/시럽/소스/돈까스 소스/보관방법: 냉장보관/대용량(업소용)
동원홈푸드 비셰프 스파게티 미트소스 3kg,"소스/드레싱/시럽/소스/파스타소스/보관방법: 냉장보관/대용량(업소용)/토마토페이스트(미국산), 쇠고기(호주산), 돼지고기(국내산)"
동원홈푸드 비셰프 오니언드레싱 2kg,"소스/드레싱/시럽/드레싱/보관방법: 냉장보관/대용량(업소용)/양파(국내산), 대두유(외국산), 계란(국내산)"
동원홈푸드 비셰프 짬뽕소스 2kg,소스/드레싱/시럽/소스/스파우트팩/대용량(업소용)
동원홈푸드 비셰프 프리미엄 피자소스 3kg,"소스/드레싱/시럽/소스/기타소스/보관방법: 냉장보관/대용량(업소용)/토마토페이스트(중국산), 크러쉬드토마토(미국산), 양파(중국산) 등"
동원홈푸드 비셰프 핫 스파게티 비프소스 3kg,소스/드레싱/시럽/소스/파스타소스/보관방법: 냉장보관/대용량(업소용)
동원홈푸드 비셰프 화이트소스 2kg,"소스/드레싱/시럽/소스/파스타소스/보관방법: 냉장보관/대용량(업소용)/휘핑크림(미국산), 양파(국내산)"
동원홈푸드 사워 크림 소스 1kg,소스/드레싱/시럽/소스/기타소스/보관방법: 실온보관/대용량(업소용)
동원홈푸드 사워크림소스 1kg,소스/드레싱/시럽/소스/기타소스/보관방법: 냉장보관/대용량(업소용)
동원홈푸드 숯불 매운치킨 소스 30g,소스/드레싱/시럽/소스/일회용/대용량(업소용)
동원홈푸드 스위트칠리소스 30g,소스/드레싱/시럽/소스/일회용/대용량(업소용)
동원홈푸드 스파게티 미트 소스 3kg,소스/드레싱/시럽/소스/파스타소스/보관방법: 냉장보관/대용량(업소용)
동원홈푸드 양념치킨소스 30g,소스/드레싱/시럽/소스/일회용/대용량(업소용)
동원홈푸드 와사비 마요소스 30g,소스/드레싱/시럽/소스/일회용/대용량(업소용)
동원홈푸드 일식돈까스소스 2kg,소스/드레싱/시럽/소스/대용량(업소용)
동원홈푸드 진돗개 핫소스 190ml,소스/드레싱/시럽/소스/핫소스
동원홈푸드 청양간장 마요소스 30g,소스/드레싱/시럽/소스/기타소스
동원홈푸드 커틀렛소스 20g,소스/드레싱/시럽/소스/돈까스 소스/보관방법: 실온보관/일회용
동원홈푸드 토마토소스 엘 3kg,소스/드레싱/시럽/소스
동원홈푸드 토마토소스-엘 3kg,"소스/드레싱/시럽/소스/대용량(업소용)/홀토마토(이탈리아산), 토마토페이스트(미국산)"
동원홈푸드 할라페노 치즈소스 2kg,"소스/드레싱/시럽/소스/기타소스/보관방법: 냉장보관/대용량(업소용)/체다치즈(호주산), 잘라페노페퍼(멕시코산), 유당(미국산)"
두레생협연합 돈가스소스 330g,소스/드레싱/시럽/소스/돈까스 소스/보관방법: 실온보관
두원식품 간장 불고기 양념 분말 100g,소스/드레싱/시럽/소스/고기양념/보관방법: 실온보관
두원식품 고추장 불고기 양념 분말 100g,소스/드레싱/시럽/소스/고기양념/보관방법: 실온보관
두원식품 고추장 불고기 양념 분말 1kg,소스/드레싱/시럽/소스/고기양념/보관방법: 실온보관
두원식품 궁중 떡볶이 소스 분말 100g,소스/드레싱/시럽/소스/떡볶이 소스/보관방법: 실온보관/마늘분(중국산)
두원식품 궁중 떡볶이 소스 분말 1kg,소스/드레싱/시럽/소스/떡볶이 소스/보관방법: 실온보관/마늘분(중국산)
두원식품 궁중 떡볶이 소스 분말 500g,소스/드레싱/시럽/소스/떡볶이 소스/보관방법: 실온보관/마늘분(중국산)
두원식품 기름 떡볶이 소스 분말 레드 100g,소스/드레싱/시럽/소스/떡볶이 소스/보관방법: 실온보관
두원식품 기름 떡볶이 소스 분말 레드 1kg,소스/드레싱/시럽/소스/떡볶이 소스/보관방법: 실온보관
두원식품 기름 떡볶이 소스(레드) 500g,소스/드레싱/시럽/소스/떡볶이 소스/파우치
두원식품 기름 떡볶이 소스(블랙) 100g,소스/드레싱/시럽/소스/떡볶이 소스
두원식품 기름 떡볶이 소스(블랙) 1kg,소스/드레싱/시럽/소스/떡볶이 소스
두원식품 기름 떡볶이 소스(블랙) 500g,소스/드레싱/시럽/소스/떡볶이 소스/파우치
두원식품 김치찌개 육수 분말 100g,소스/드레싱/시럽/소스/찌개양념
두원식품 김치찌개 육수 분말 1kg,소스/드레싱/시럽/소스/찌개양념
두원식품 김치찌개 육수 분말 500g,소스/드레싱/시럽/소스/찌개양념
두원식품 까르보나라 떡볶이 소스 100g,소스/드레싱/시럽/소스/떡볶이 소스
두원식품 까르보나라 떡볶이 소스 1kg,소스/드레싱/시럽/소스/떡볶이 소스
두원식품 까르보나라 떡볶이 소스 500g,소스/드레싱/시럽/소스/떡볶이 소스/파우치
두원식품 까르보나라 떡볶이 소스 분말 100g,소스/드레싱/시럽/소스/떡볶이 소스/보관방법: 실온보관/전분(외국산)
두원식품 까르보나라 소스 1kg,소스/드레싱/시럽/소스/파스타소스/보관방법: 실온보관
두원식품 까르보나라 스파게티 소스 1kg,소스/드레싱/시럽/소스/파스타소스
두원식품 닭갈비 양념 분말 100g,소스/드레싱/시럽/소스/고기양념/보관방법: 실온보관
두원식품 떡만두국 분말 1kg,소스/드레싱/시럽/소스/기타소스/보관방법: 실온보관
두원식품 레드 까르보나라 떡볶이 소스 100g,소스/드레싱/시럽/소스/떡볶이 소스
두원식품 레드 까르보나라 떡볶이 소스 1kg,소스/드레싱/시럽/소스/떡볶이 소스
두원식품 레드 까르보나라 떡볶이 소스 500g,소스/드레싱/시럽/소스/떡볶이 소스/파우치
두원식품 레드 까르보나라 떡볶이 소스 분말 100g,소스/드레싱/시럽/소스/떡볶이 소스/보관방법: 실온보관/옥수수전분(외국산)
두원식품 레드 까르보나라 떡볶이 소스 분말 1kg,소스/드레싱/시럽/소스/떡볶이 소스/보관방법: 실온보관/옥수수전분(외국산)
두원식품 로제 떡볶이 소스 100g,소스/드레싱/시럽/소스/떡볶이 소스/보관방법: 실온보관
두원식품 마늘 떡볶이 소스 1kg,소스/드레싱/시럽/소스/떡볶이 소스
두원식품 마라 떡볶이 소스 100g,소스/드레싱/시럽/소스/떡볶이 소스/보관방법: 실온보관
두원식품 마라 떡볶이 소스 1kg,소스/드레싱/시럽/소스/떡볶이 소스/보관방법: 실온보관
두원식품 마라 샹궈 소스 1kg,소스/드레싱/시럽/소스/중식소스/파우치
두원식품 마라 샹궈 소스 500g,소스/드레싱/시럽/소스/중식소스/파우치
두원식품 마라 샹궈 소스 분말 100g,소스/드레싱/시럽/소스/중식소스/보관방법: 실온보관
두원식품 마라탕 소스 분말 100g,소스/드레싱/시럽/소스/중식소스/보관방법: 실온보관
두원식품 마라탕 소스 분말 1kg,소스/드레싱/시럽/소스/중식소스/보관방법: 실온보관
두원식품 마라탕 소스 분말 30g,소스/드레싱/시럽/소스/중식소스/파우치
두원식품 마라탕 소스 분말 500g,소스/드레싱/시럽/소스/중식소스/보관방법: 실온보관
두원식품 맛있는 떡볶이 소스 (매운맛) 500g,소스/드레싱/시럽/소스/떡볶이 소스/파우치
두원식품 맛있는 떡볶이 소스 (순한맛) 100g,소스/드레싱/시럽/소스/떡볶이 소스/파우치
두원식품 맛있는 떡볶이 소스 (순한맛) 1kg,소스/드레싱/시럽/소스/떡볶이 소스
두원식품 맛있는 떡볶이 소스 (순한맛) 500g,소스/드레싱/시럽/소스/떡볶이 소스/파우치
두원식품 맛있는 떡볶이 소스 (아주매운맛) 500g,소스/드레싱/시럽/소스/떡볶이 소스/파우치
두원식품 맛있는 떡볶이 소스 (아주순한맛) 100g,소스/드레싱/시럽/소스/떡볶이 소스/파우치
두원식품 맛있는 떡볶이 소스 매운맛 100g,소스/드레싱/시럽/소스/떡볶이 소스/보관방법: 실온보관
두원식품 맛있는 떡볶이 소스 매운맛 1kg,소스/드레싱/시럽/소스/떡볶이 소스/보관방법: 실온보관
두원식품 맛있는 떡볶이 소스 아주매운맛 100g,소스/드레싱/시럽/소스/떡볶이 소스/보관방법: 실온보관
두원식품 맛있는 떡볶이 소스 약간매운맛 100g,소스/드레싱/시럽/소스/떡볶이 소스/보관방법: 실온보관
두원식품 맛있는 떡볶이 소스 약간매운맛 1kg,소스/드레싱/시럽/소스/떡볶이 소스/보관방법: 실온보관
두원식품 맛있는 떡볶이 소스 약간매운맛 500g,소스/드레싱/시럽/소스/떡볶이 소스/보관방법: 실온보관
두원식품 맛있는 마늘 떡볶이 소스 100g,소스/드레싱/시럽/소스/떡볶이 소스/보관방법: 실온보관
두원식품 맛있는 후추 떡볶이 소스 100g,소스/드레싱/시럽/소스/떡볶이 소스/보관방법: 실온보관
두원식품 매운 갈비찜 양념 분말 100g,소스/드레싱/시럽/소스/고기양념
두원식품 매운 갈비찜 양념 분말 1kg,소스/드레싱/시럽/소스/고기양념
두원식품 매운탕 양념 분말 100g,소스/드레싱/시럽/소스/기타소스/보관방법: 실온보관
두원식품 매운탕 양념 분말 500g,소스/드레싱/시럽/소스/기타소스/보관방법: 실온보관
두원식품 매콤 볶음 양념 분말 100g,소스/드레싱/시럽/소스/기타소스/보관방법: 실온보관
두원식품 모밀 소스(액상 소스) 2kg,소스/드레싱/시럽/소스/일식소스
두원식품 부대찌개 양념 분말 100g,소스/드레싱/시럽/소스/찌개양념/보관방법: 실온보관
두원식품 부대찌개 양념 분말 1kg,소스/드레싱/시럽/소스/찌개양념/보관방법: 실온보관
두원식품 불닭발 양념 분말 1kg,소스/드레싱/시럽/소스/불닭소스/보관방법: 실온보관
두원식품 순두부찌개 양념 분말 100g,소스/드레싱/시럽/소스/찌개양념/보관방법: 실온보관
두원식품 순두부찌개 양념 분말 1kg,소스/드레싱/시럽/소스/찌개양념/보관방법: 실온보관
두원식품 순두부찌개 양념 분말 500g,소스/드레싱/시럽/소스/찌개양념/보관방법: 실온보관
두원식품 숯불 닭발 양념 분말 100g,소스/드레싱/시럽/소스/기타소스
두원식품 짜장 떡볶이 소스 (순한맛) 100g,소스/드레싱/시럽/소스/떡볶이 소스
두원식품 짜장 떡볶이 소스 (순한맛) 500g,소스/드레싱/시럽/소스/떡볶이 소스/파우치
두원식품 짜장 떡볶이 소스 (약간매운맛) 100g,소스/드레싱/시럽/소스/떡볶이 소스
두원식품 짜장 떡볶이 소스 (약간매운맛) 500g,소스/드레싱/시럽/소스/떡볶이 소스/파우치
두원식품 짜장 떡볶이 소스 분말 순한맛 100g,"소스/드레싱/시럽/소스/떡볶이 소스/보관방법: 실온보관/밀(외국산), 전분(호주산)"
두원식품 짜장 떡볶이 소스 분말 순한맛 1kg,"소스/드레싱/시럽/소스/떡볶이 소스/보관방법: 실온보관/밀(외국산), 전분(호주산)"
두원식품 짜장 떡볶이 소스 분말 약간매운맛 100g,"소스/드레싱/시럽/소스/떡볶이 소스/보관방법: 실온보관/밀(외국산), 전분(호주산)"
두원식품 짜장 떡볶이 소스 분말 약간매운맛 1kg,"소스/드레싱/시럽/소스/떡볶이 소스/보관방법: 실온보관/밀(외국산), 전분(호주산)"
두원식품 쭈꾸미 볶음 양념 분말 100g,소스/드레싱/시럽/소스/기타소스/보관방법: 실온보관
두원식품 쭈꾸미 볶음 양념 분말 1kg,소스/드레싱/시럽/소스/기타소스/보관방법: 실온보관
두원식품 치즈 떡볶이 소스 1kg,소스/드레싱/시럽/소스/떡볶이 소스/파우치
두원식품 치즈 떡볶이 소스 분말 100g,소스/드레싱/시럽/소스/떡볶이 소스/보관방법: 실온보관
두원식품 치즈 떡볶이 소스 분말 500g,소스/드레싱/시럽/소스/떡볶이 소스/보관방법: 실온보관
두원식품 카레 까르보나라 떡볶이 소스 100g,소스/드레싱/시럽/소스/떡볶이 소스
두원식품 카레 까르보나라 떡볶이 소스 1kg,소스/드레싱/시럽/소스/떡볶이 소스
두원식품 카레 까르보나라 떡볶이 소스 500g,소스/드레싱/시럽/소스/떡볶이 소스/파우치
두원식품 카레 까르보나라 떡볶이 소스 분말 100g,"소스/드레싱/시럽/소스/떡볶이 소스/보관방법: 실온보관/옥수수전분(외국산), 카레분(인도산)"
두원식품 프로미트 1kg,소스/드레싱/시럽/소스/기타소스/보관방법: 실온보관
두원식품 해물탕 양념 분말 100g,소스/드레싱/시럽/소스/기타소스/보관방법: 실온보관
두원식품 후추 떡볶이 소스 1kg,소스/드레싱/시럽/소스/떡볶이 소스
두원식품 후추 떡볶이 소스 500g,소스/드레싱/시럽/소스/떡볶이 소스/파우치
디벨라 토마토 홀 2.5kg,소스/드레싱/시럽/소스/대용량(업소용)
딜리셔스마켓 딜리셔스마켓 달콤양념소스 550g,소스/드레싱/시럽/소스
떡불킹 로제떡볶이 투움바 분말소스 100g[1개],소스/드레싱/시럽/소스/파스타소스/파우치
떡불킹 로제떡볶이 투움바 분말소스 1kg[1개],소스/드레싱/시럽/소스/파스타소스/파우치
떡불킹 로제떡볶이 투움바 분말소스 4kg,소스/드레싱/시럽/소스/파스타소스/파우치/대용량(업소용)
떡불킹 로제떡볶이 투움바 분말소스 500g,소스/드레싱/시럽/소스/파스타소스/파우치
떡불킹 로제떡볶이 투움바 분말소스 8kg,소스/드레싱/시럽/소스/파스타소스/파우치/대용량(업소용)
라구소스 베이컨 180g,소스/드레싱/시럽/소스/캔
라구소스 소시지 180g,소스/드레싱/시럽/소스/캔
라리 하나 전통돈까스소스 1.8L,소스/드레싱/시럽/소스/돈까스 소스/플라스틱/대용량(업소용)
라무따드 홀그레인 머스타드 135g,소스/드레싱/시럽/소스/머스타드 소스/보관방법: 실온보관
라베키아 유기농 발사믹 크림 250ml,소스/드레싱/시럽/소스/기타소스/보관방법: 실온보관
라베키아 화이트 발사믹 크림 250ml,소스/드레싱/시럽/소스/기타소스/보관방법: 실온보관
라오간마 유라죠우 고추기름 275g,소스/드레싱/시럽/소스/기타소스/보관방법: 실온보관
런던브릭스 서울팩토리 더블초코소스 1.5kg,소스/드레싱/시럽/소스/카페소스
런던브릭스 서울팩토리 더블카라멜소스 1.5kg,소스/드레싱/시럽/소스/카페소스
레벤 핫칠리소스 2kg,소스/드레싱/시럽/소스/플라스틱/대용량(업소용)
레오나르디 발사믹 그레이즈 무화과 220g,소스/드레싱/시럽/소스/이탈리아
레오나르디 발사믹 그레이즈 블루베리 220g,소스/드레싱/시럽/소스/이탈리아
레오나르디 발사믹 그레이즈 트러플향 220g,소스/드레싱/시럽/소스/기타소스/보관방법: 냉장보관
레오나르디 발사믹 그레이즈 패션후르츠 220g,소스/드레싱/시럽/소스/이탈리아
레오나르디 화이트 발사믹 그레이즈 220g,소스/드레싱/시럽/소스/이탈리아
렌렌후이 마라소스 1kg,소스/드레싱/시럽/소스/대용량(업소용)
렌치시저 드레싱 100g,소스/드레싱/시럽/드레싱
로렌치즈앤푸드 로젠 에멘탈 퐁듀 치즈 소스 1kg,소스/드레싱/시럽/드레싱
로쏘 홀 토마토(푸투라그리) 2.55kg,소스/드레싱/시럽/소스/케찹/캔/대용량(업소용)
롯데웰푸드 쉐푸드 요리킥 고추잡채 소스 100g,소스/드레싱/시럽/소스
롯데웰푸드 쉐푸드 요리킥 마라샹궈 소스 100g,소스/드레싱/시럽/소스
롯데푸드 쉐푸드 요리킥 고추잡채 소스 100g,소스/드레싱/시럽/소스/기타소스
