Name,Spec
(주)소모 소모 까르보나라 분말소스 P-22호 순한맛 2kg,소스/드레싱/시럽/소스/떡볶이 소스/대용량(업소용)
(주)소모 소모 대구식 매운떡볶이 소스 매운맛 2kg,소스/드레싱/시럽/소스/떡볶이 소스/스파우트팩/대용량(업소용)
(주)소모 소모 대구식 매운떡볶이 소스 보통맛 2kg,소스/드레싱/시럽/소스/떡볶이 소스/스파우트팩/대용량(업소용)
(주)소모 소모 떡볶이 분말소스 A-02호 약간매운맛 3kg,소스/드레싱/시럽/소스/떡볶이 소스/대용량(업소용)
(주)소모 소모 마늘간장소스 매운맛 2kg,소스/드레싱/시럽/소스/스파우트팩/대용량(업소용)
(주)소모 소모 마늘간장소스 보통맛 2kg,소스/드레싱/시럽/소스/스파우트팩/대용량(업소용)
(주)소모 소모 엽기식 매운떡볶이 소스 매운맛 2kg,소스/드레싱/시럽/소스/떡볶이 소스/스파우트팩/대용량(업소용)
(주)소모 소모 엽기식 매운떡볶이 소스 보통맛 2kg,소스/드레싱/시럽/소스/떡볶이 소스/스파우트팩/대용량(업소용)
(주)소모 소모 엽기프리미엄 떡볶이 분말소스 Y-18호 약간매운맛 3kg,소스/드레싱/시럽/소스/떡볶이 소스/대용량(업소용)
(주)소모 소모 엽기프리미엄 떡볶이 분말소스 Y-19호 매운맛 3kg,소스/드레싱/시럽/소스/떡볶이 소스/대용량(업소용)
(주)소모 소모 추억의 학교떡볶이 소스 보통맛 2kg,소스/드레싱/시럽/소스/떡볶이 소스/스파우트팩/대용량(업소용)
(주)소모 소모 학교프리미엄 떡볶이 분말소스 S-20호 보통맛 3kg,소스/드레싱/시럽/소스/떡볶이 소스/대용량(업소용)
(주)우리식품 참Cham 고기엔 참소스 2.1kg,소스/드레싱/시럽/소스/기타 소스/보관방법: 실온보관/대용량(업소용)
(주)우리식품 참Cham 고기엔 참소스 300g,소스/드레싱/시럽/소스/기타 소스/보관방법: 실온보관
(주)우리식품 참Cham 고기엔 참소스 800g,소스/드레싱/시럽/소스/기타소스/보관방법: 실온보관
(주)우리식품 참Cham 돈까스 소스 300g,소스/드레싱/시럽/소스/돈까스 소스/보관방법: 실온보관
(주)우리식품 참Cham 파채무침 소스 2kg,소스/드레싱/시럽/소스/기타 소스/보관방법: 실온보관/대용량(업소용)
(주)우리식품 참Cham 파채무침 소스 320g,소스/드레싱/시럽/소스/기타 소스/보관방법: 실온보관
(주)청우식품 첫맛 닭강정소스 매운맛 2.1kg,소스/드레싱/시럽/소스/기타소스/보관방법: 실온보관
(주)청우식품 첫맛 돼지갈비양념 10kg,소스/드레싱/시럽/소스/고기양념/대용량(업소용)
(주)청우식품 첫맛 떡볶이 비법 양념소스 2.1kg,소스/드레싱/시럽/소스/떡볶이 소스/보관방법: 실온보관/대용량(업소용)
(주)청우식품 첫맛 떡볶이양념 2kg,소스/드레싱/시럽/소스/떡볶이 소스/보관방법: 실온보관/대용량(업소용)
(주)청우식품 첫맛 떡볶이양념 분말 매운맛 1kg,소스/드레싱/시럽/소스/떡볶이 소스/보관방법: 실온보관/대용량(업소용)
(주)청우식품 첫맛 떡볶이양념 분말 순한맛 1kg,소스/드레싱/시럽/소스/떡볶이 소스/보관방법: 실온보관/대용량(업소용)
(주)청우식품 첫맛 만능 불볶음 양념 2kg,소스/드레싱/시럽/소스/기타소스
(주)청우식품 첫맛 만능 비빔무침양념 1.1kg,소스/드레싱/시럽/소스/기타소스
(주)청우식품 첫맛 만능 비빔무침양념 2.2kg,소스/드레싱/시럽/소스/기타소스
(주)청우식품 첫맛 만능 비빔무침양념 480g,소스/드레싱/시럽/소스/기타소스
(주)청우식품 첫맛 매운 닭발 양념 2kg,소스/드레싱/시럽/소스/기타소스
(주)청우식품 첫맛 스위트 칠리소스 2.05kg,소스/드레싱/시럽/소스/칠리 소스/보관방법: 실온보관/대용량(업소용)
(주)청우식품 첫맛 캡사이신 매운맛소스 10kg,소스/드레싱/시럽/소스/캡사이신/보관방법: 실온보관/대용량(업소용)
A.I모데나 발사믹글라제 오리지날 250ml,소스/드레싱/시럽/소스/기타소스
B&G 라이트 애플우드 리퀴드 스모크 103ml,소스/드레싱/시럽/소스/유리/미국
BEIJING ERSHANG WANGZHI 왕즈허 혼합 즈마장 225g,소스/드레싱/시럽/소스
CHONGQING XIANGSHUI 주군기 마라샹궈 소스 200g,소스/드레싱/시럽/소스/중식소스/파우치
CHONGQING XIANGSHUI 주군기 마라샹궈소스 900g,소스/드레싱/시럽/소스/대용량(업소용)
CJ 다담 순두부찌개양념 140g 20봉,소스/드레싱/시럽/소스
CJ 다담 순두부찌개양념 140g x24개,소스/드레싱/시럽/소스
CJ 백설 오곡참깨 드레싱 550G,드레싱
CJ 백설 파인애플 샐러드소스 560G,소스/드레싱/시럽/드레싱
CJ 크레잇 크리미양파드레싱 2kg[1개],소스/드레싱/시럽/드레싱/스파우트팩/대용량(업소용)
CJ제일제당 다담 강된장 찌개양념 130g,소스/드레싱/시럽/소스/찌개양념/보관방법: 냉장보관
CJ제일제당 다담 강된장찌개양념 2kg,소스/드레싱/시럽/소스/찌개양념
CJ제일제당 다담 고깃집 된장찌개양념 130g,소스/드레싱/시럽/소스/찌개양념/보관방법: 실온보관/대두(외국산)
CJ제일제당 다담 고깃집 된장찌개양념 2kg,소스/드레싱/시럽/소스/찌개양념
CJ제일제당 다담 국물떡볶이양념 145g,소스/드레싱/시럽/소스/떡볶이 소스
CJ제일제당 다담 된장찌개양념 840g,소스/드레싱/시럽/소스/찌개양념
CJ제일제당 다담 떡볶이양념 150g,소스/드레싱/시럽/소스/파우치
CJ제일제당 다담 매콤달콤 떡볶이 양념 150g,소스/드레싱/시럽/소스/떡볶이 소스/보관방법: 냉장보관
CJ제일제당 다담 바지락 순두부 찌개양념 140g+우렁 강된장 비빔양념 140g,소스/드레싱/시럽/소스/찌개양념/보관방법: 냉장보관
CJ제일제당 다담 바지락 순두부찌개양념 2kg,소스/드레싱/시럽/소스/찌개양념
CJ제일제당 다담 사골부대 찌개양념 130g,소스/드레싱/시럽/소스/찌개양념/보관방법: 냉장보관
CJ제일제당 다담 순두부찌개양념 2kg,소스/드레싱/시럽/소스/찌개양념
CJ제일제당 백설 굴소스 해물맛 360g,소스/드레싱/시럽/소스/굴소스/보관방법: 실온보관/굴(국내산)
CJ제일제당 백설 남해 굴소스 2.4kg,소스/드레싱/시럽/소스/굴소스/보관방법: 실온보관/대용량(업소용)
CJ제일제당 백설 남해 굴소스 500g,소스/드레싱/시럽/소스/굴소스/보관방법: 실온보관/굴(국내산)
CJ제일제당 백설 남해바다 굴소스 350g,소스/드레싱/시럽/소스/굴소스
CJ제일제당 백설 다담 국물떡볶이 양념 530g,소스/드레싱/시럽/소스/떡볶이 소스
CJ제일제당 백설 돈까스 소스 255g,소스/드레싱/시럽/소스/돈까스 소스/보관방법: 실온보관
CJ제일제당 백설 돼지갈비양념 10kg,소스/드레싱/시럽/소스/고기양념/보관방법: 냉장보관/대용량(업소용)
CJ제일제당 백설 로제 스파게티 소스 610g,소스/드레싱/시럽/소스/파스타소스/보관방법: 실온보관
CJ제일제당 백설 로제 스파게티소스 150g,소스/드레싱/시럽/소스/파스타소스/보관방법: 냉장보관
CJ제일제당 백설 리얼 매실청 310ml,소스/드레싱/시럽/소스/기타 소스
CJ제일제당 백설 리얼청 3종모음,소스/드레싱/시럽/소스/소스세트/구성: 리얼 매실청 310ml+생강차 310ml+오미자청 310ml
CJ제일제당 백설 매실청 1.025kg,소스/드레싱/시럽/소스/기타 소스/대용량(업소용)
CJ제일제당 백설 매실청 645g,소스/드레싱/시럽/소스/기타 소스
CJ제일제당 백설 매콤 돼지불고기 양념 10kg,소스/드레싱/시럽/소스/고기양념/대용량(업소용)
CJ제일제당 백설 매콤한 돼지불고기 양념 2.45kg,소스/드레싱/시럽/소스/고기양념/대용량(업소용)
CJ제일제당 백설 면비빔소스 890g,소스/드레싱/시럽/소스
CJ제일제당 백설 명란 로제 파스타소스 370g,소스/드레싱/시럽/소스
CJ제일제당 백설 바질 토마토 파스타소스 365g,소스/드레싱/시럽/소스/파스타소스/보관방법: 실온보관
CJ제일제당 백설 베이컨 까르보나라 파스타소스 355g,소스/드레싱/시럽/소스/파스타소스
CJ제일제당 백설 소갈비양념 10kg,소스/드레싱/시럽/소스/고기양념/보관방법: 실온보관/대용량(업소용)
CJ제일제당 백설 스위트 칠리소스 265g,소스/드레싱/시럽/소스/칠리 소스
CJ제일제당 백설 스테이크 소스 255g,소스/드레싱/시럽/소스/스테이크 소스
CJ제일제당 백설 스파이시 아라비아따 파스타소스 365g,소스/드레싱/시럽/소스/파스타소스/보관방법: 실온보관
CJ제일제당 백설 아라비아따 토마토 스파게티 소스 610g,소스/드레싱/시럽/소스/파스타소스/보관방법: 실온보관
CJ제일제당 백설 아라비아따 토마토 파스타 소스 610g,소스/드레싱/시럽/소스
CJ제일제당 백설 아리비아따 토마토 스파게티소스 150g,소스/드레싱/시럽/소스/파우치
CJ제일제당 백설 아몬드호두 드레싱 230g,소스/드레싱/시럽/드레싱
CJ제일제당 백설 오곡 참깨 드레싱 105g,소스/드레싱/시럽/드레싱/참깨(외국산)
CJ제일제당 백설 오리엔탈 드레싱 595g,소스/드레싱/시럽/드레싱
CJ제일제당 백설 치폴레 스파이시 소스 260g,소스/드레싱/시럽/소스/핫소스/보관방법: 냉장보관
CJ제일제당 백설 크리미 로제 파스타소스 365g,소스/드레싱/시럽/소스/파스타소스/보관방법: 실온보관
CJ제일제당 백설 토마토 스파게티 소스 610g,소스/드레싱/시럽/소스/파스타소스/보관방법: 실온보관
CJ제일제당 백설 토마토라구 파스타소스 375g,소스/드레싱/시럽/소스
CJ제일제당 백설 트러플 크림 파스타소스 355g,소스/드레싱/시럽/소스/파스타소스
CJ제일제당 백설 프리미엄 전복굴소스 350g,소스/드레싱/시럽/소스/굴소스/전복굴농축액(국산)
CJ제일제당 백설 한끼식탁 강된장 찌개양념 130g,소스/드레싱/시럽/소스/찌개양념/보관방법: 실온보관/대두(외국산)
CJ제일제당 비비고 갓츄 핫소스 300g,소스/드레싱/시럽/소스/핫소스
CJ제일제당 쉐프솔루션 돼지갈비 양념장 10kg,소스/드레싱/시럽/소스/고기양념/보관방법: 실온보관/대용량(업소용)
CJ제일제당 쉐프솔루션 돼지불고기 양념장 10kg,소스/드레싱/시럽/소스/고기양념/보관방법: 실온보관/대용량(업소용)
CJ제일제당 쉐프솔루션 소불고기 양념장 10kg,소스/드레싱/시럽/소스/고기양념/보관방법: 실온보관/대용량(업소용)
CJ제일제당 쉐프솔루션 오리엔탈 드레싱 2kg,소스/드레싱/시럽/드레싱/보관방법: 냉장보관/대용량(업소용)
CJ제일제당 쉐프솔루션 크리미 양파 드레싱 2kg,소스/드레싱/시럽/드레싱/스파우트팩/대용량(업소용)/양파(국내산)
CJ제일제당 쉐프솔루션 크리미양파 드레싱 2kg,소스/드레싱/시럽/드레싱/보관방법: 냉장보관/양파(국내산)
CJ제일제당 시저 드레싱 235g,소스/드레싱/시럽/드레싱
CJ제일제당 아몬드 호두 드레싱 230g,소스/드레싱/시럽/드레싱
CJ제일제당 유자 샐러드 소스 250g,소스/드레싱/시럽/드레싱/보관방법: 실온보관
CJ제일제당 프레시안 파인애플 샐러드소스 585g,소스/드레싱/시럽/드레싱/보관방법: 실온보관
CJ제일제당 해찬들 그대로 끓여먹는 바지락 꽃게 된장찌개양념 450g,소스/드레싱/시럽/소스/찌개양념
CJ제일제당 해찬들 그대로 끓여먹는 차돌 된장찌개양념 450g,소스/드레싱/시럽/소스/찌개양념
CJ제일제당 해찬들 그대로 끓여먹는 차돌 된장찌개양념 450g[4개],소스/드레싱/시럽/소스
CJ프레시웨이 이츠웰 굴소스 2.1kg,소스/드레싱/시럽/소스/굴소스/보관방법: 실온보관
CJ프레시웨이 이츠웰 랜치드레싱 2kg,소스/드레싱/시럽/드레싱/스파우트팩/대용량(업소용)
CJ프레시웨이 이츠웰 마라로제 떡볶이소스 2kg,소스/드레싱/시럽/소스/떡볶이 소스
CJ프레시웨이 이츠웰 마요네즈 뉴골드 1kg,소스/드레싱/시럽/소스/마요네즈/보관방법: 실온보관/대용량(업소용)
CJ프레시웨이 이츠웰 맛있는 돈까스 소스 2kg,소스/드레싱/시럽/소스/돈까스 소스/플라스틱
CJ프레시웨이 이츠웰 맛있는 무지방 망고소스 2kg,소스/드레싱/시럽/드레싱/대용량(업소용)
CJ프레시웨이 이츠웰 맛있는 무지방 자몽소스 2kg,소스/드레싱/시럽/드레싱/대용량(업소용)
CJ프레시웨이 이츠웰 맛있는 무지방 키위소스 2kg,소스/드레싱/시럽/드레싱/대용량(업소용)
CJ프레시웨이 이츠웰 무지방 망고소스 2kg,소스/드레싱/시럽/소스/기타소스/보관방법: 냉장보관
CJ프레시웨이 이츠웰 상큼팡팡 파인드레싱 2kg,소스/드레싱/시럽/드레싱/대용량(업소용)
CJ프레시웨이 이츠웰 새콤톡톡 유자드레싱 2kg,소스/드레싱/시럽/드레싱/보관방법: 냉장보관/유자(국내산)
CJ프레시웨이 이츠웰 이츠웰 바베큐소스 2k 스테이크 등갈비 소스 캠핑,소스/드레싱/시럽/소스/바베큐 소스
CJ프레시웨이 이츠웰 허니머스타드 드레싱 2kg,소스/드레싱/시럽/소스/머스타드 소스/스파우트팩/대용량(업소용)
CONAGRA FOOD 오리지날 바베큐소스 510g,소스/드레싱/시럽/소스/바베큐 소스/플라스틱
CONAGRA FOOD 허니 머스타드 바베큐소스 510g,소스/드레싱/시럽/소스/바베큐 소스/플라스틱
CONAGRA FOOD 히코리 바베큐 소스 510g[1개],소스/드레싱/시럽/소스/바베큐 소스/플라스틱
CONAGRA FOOD 히코리 스모크 바베큐 소스 355ml[3개],소스/드레싱/시럽/소스/바베큐 소스/플라스틱
EXOTIC FOOD 플라잉구스 스리라차 그린칠리소스 200ml,소스/드레싱/시럽/소스/칠리 소스/플라스틱
EXOTIC FOOD 플라잉구스 스리라차 마요소스 200ml,소스/드레싱/시럽/소스/마요네즈/플라스틱
EXOTIC FOOD 플라잉구스 스리라차 블랙아웃 소스 200ml,소스/드레싱/시럽/소스/칠리 소스/플라스틱
EXOTIC FOOD 플라잉구스 스리라차 슈퍼핫 칠리소스 200ml,소스/드레싱/시럽/소스/칠리 소스/플라스틱
EXOTIC FOOD 플라잉구스 스리라차 슈퍼핫 칠리소스 455ml,소스/드레싱/시럽/소스/칠리 소스/플라스틱
EXOTIC FOOD 플라잉구스 스리라차 옐로우 칠리소스 200ml,소스/드레싱/시럽/소스/칠리 소스/플라스틱
EXOTIC FOOD 플라잉구스 스리라차 핫칠리 소스 200ml,소스/드레싱/시럽/소스/칠리 소스/플라스틱
EXOTIC FOOD 플라잉구스 스리라차 핫칠리 소스 455ml,소스/드레싱/시럽/소스/칠리 소스/플라스틱
FOSHAN HAI TIAN 시그니처 굴소스 캔 2.27kg,소스/드레싱/시럽/소스/굴소스/캔/대용량(업소용)
Franks RedHot Chile n Lime Hot Sauce 프랭크 레드핫 칠리 라임 핫 소스 2개,소스/드레싱/시럽/소스/칠리 소스
FritoLay 토스티토스 살사 버라이어티 팩 440g,소스/드레싱/시럽/소스/살사 소스
FritoLay 토스티토스 살사 콘 퀘소 미디움 425g,소스/드레싱/시럽/소스/살사 소스
FritoLay 토스티토스 청키 살사 마일드 439g,소스/드레싱/시럽/소스/살사 소스/미국
FritoLay 토스티토스 청키 살사 마일드 680g,소스/드레싱/시럽/소스/살사 소스
FritoLay 토스티토스 하바네로 핫 살사소스 439g,소스/드레싱/시럽/소스/미국
GUIYANG NANMING 라오깐마 라조장(고추) 275g,소스/드레싱/시럽/소스/중국
GUIYANG NANMING 라오깐마 라조장(콩) 280g,소스/드레싱/시럽/소스/중국
GUIYANG NANMING 라오깐마 라조장+즈마장+훠궈소스 세트,소스/드레싱/시럽/소스/중국
GUIYANG NANMING 라오깐마 정제뉴러우 유라죠우 노깐마 210g,소스/드레싱/시럽/소스/중국
GUIYANG NANMING 라오깐마 훠궈소스 160g,소스/드레싱/시럽/소스/중국
HuyFong푸드 스리라차 핫칠리 소스 255g,소스/드레싱/시럽/소스/칠리 소스/플라스틱
HuyFong푸드 스리라차 핫칠리 소스 481g,소스/드레싱/시럽/소스/칠리 소스/플라스틱
LONGKOU 왕가두 마라샹궈 소스 샤브샤브 마라탕 마라 훠궈 재료 소스,소스/드레싱/시럽/소스/중식소스
La Doria S.p.A. 필드 프럼 토마토 홀 2.5kg,소스/드레싱/시럽/소스/대용량(업소용)
La Doria S.p.A. 필드토마토 2.55kg 10개,소스/드레싱/시럽/소스/케찹/캔/대용량(업소용)
La Doria S.p.A. 필드토마토 2.55kg 1개,소스/드레싱/시럽/소스/케찹/캔/대용량(업소용)
La Doria S.p.A. 필드토마토 2.55kg 2개,소스/드레싱/시럽/소스/케찹/캔/대용량(업소용)
La Doria S.p.A. 필드토마토 2.55kg 3개,소스/드레싱/시럽/소스/케찹/캔/대용량(업소용)
La Doria S.p.A. 필드토마토 2.55kg 4개,소스/드레싱/시럽/소스/케찹/캔/대용량(업소용)
La Doria S.p.A. 필드토마토 2.55kg 5개,소스/드레싱/시럽/소스/케찹/캔/대용량(업소용)
La Doria S.p.A. 필드토마토 2.55kg 6개,소스/드레싱/시럽/소스/케찹/캔/대용량(업소용)
La Doria S.p.A. 필드토마토 2.55kg 7개,소스/드레싱/시럽/소스/케찹/캔/대용량(업소용)
La Doria S.p.A. 필드토마토 2.55kg 8개,소스/드레싱/시럽/소스/케찹/캔/대용량(업소용)
La Doria S.p.A. 필드토마토 2.55kg 9개,소스/드레싱/시럽/소스/케찹/캔/대용량(업소용)
Liberty Gold 리고 핫소스 177ml 4개,소스/드레싱/시럽/소스
RAGU 트레디셔널 토마토 스파게티 파스타 소스 1.27kg,"소스/드레싱/시럽/소스/파스타소스/보관방법: 실온보관/쇠고기(뉴질랜드산), 토마토페이스트(중국산), 돼지고기(국내산)"
SUREE INTERFOODS CO 망고칠리소스 몬 씨푸드 295g X12 조리용소스 샐러드야채소스 칠리소스 샐러드소스 야채소스 조리용소스 샐러드야채소스 칠리소스,소스/드레싱/시럽/소스
SUREE INTERFOODS CO 망고칠리소스 몬 씨푸드 295g 망고칠리소스 망고소스 과일소스 야채소스 요리용소스 본상품선택 망고칠리소스 몬 씨푸드 29..,소스/드레싱/시럽/소스/칠리 소스
Sweet Baby Rays 골든 머스타드 바비큐 소스 510g,소스/드레싱/시럽/소스/바베큐 소스/보관방법: 실온보관
TOSU KEWPIE 큐피 고마 참깨 드레싱 1L,소스/드레싱/시럽/드레싱/일본
TOSU KEWPIE 큐피 참깨 드레싱 150ml,소스/드레싱/시럽/드레싱/일본
Thomy 토미 육류요리용 크림소스 250ml,소스/드레싱/시럽/소스/파스타소스/스파우트팩
Thomy 토미 커리 소스 250ml,소스/드레싱/시럽/소스/스파우트팩
Thomy 토미 허브 레물라드 소스 튜브 200ml,소스/드레싱/시럽/소스/기타소스/튜브형
Thomy 토미 홀랜다이즈 소스 250ml,소스/드레싱/시럽/소스/기타소스/스파우트팩
VAN LAW FOOD PRODUCTS INC. 잭다니엘 스위트 스파이스 바베큐소스 553g,소스/드레싱/시럽/소스/유리/미국
VAN LAW FOOD PRODUCTS INC. 잭다니엘 오리지널 바베큐소스 553g,소스/드레싱/시럽/소스/유리/미국
VAN LAW FOOD PRODUCTS INC. 잭다니엘 허니 바베큐소스 553g,소스/드레싱/시럽/소스/유리/미국
WINCHANCEFOODS 타시아 스위트 칠리 소스 5L,소스/드레싱/시럽/소스/플라스틱/대용량(업소용)
갓소스 만능요리소스 1단계 순한맛 60g,소스/드레싱/시럽/소스/기타소스
갓소스 만능요리소스 2단계 매운맛 60g,소스/드레싱/시럽/소스/기타소스
갓소스 만능요리소스 3단계 아주매운맛 60g,소스/드레싱/시럽/소스/기타소스
건우유통 꼬마트럭 떡볶이소스 매운맛 25g,소스/드레싱/시럽/소스/떡볶이 소스/파우치
건우유통 꼬마트럭 떡볶이소스 짜장맛 25g,소스/드레싱/시럽/소스/떡볶이 소스/파우치
고추명가 순두부찌개소스 2kg,소스/드레싱/시럽/소스/대용량(업소용)
구스토이탈리아 세트 주세페주스티 화이트 발사믹식초 250ml + 산도메니코 올리브유 250ml,드레싱
구아카몰딥소스 40g,소스/드레싱/시럽/소스/기타소스/보관방법: 실온보관
그레치 폴파셰프 파인리찹 4.05kg,소스/드레싱/시럽/소스/파스타소스/캔/대용량(업소용)
금양식품 돈까스소스 1.92Kg,소스/드레싱/시럽/소스/돈까스 소스/일회용
기꼬만 돈부리소스 1.8L,소스/드레싱/시럽/소스/돈까스 소스/플라스틱/대용량(업소용)/일본
기라델리 바닐라 소스 453g,소스/드레싱/시럽/소스
기라델리 카라멜 소스 2.56kg 3개세트,소스/드레싱/시럽/소스/카페소스/대용량(업소용)
기라델리 카라멜소스 2.47kg 2개,드레싱
기라델리 화이트 초콜릿 소스 2.47kg,소스/드레싱/시럽/소스/카페소스/플라스틱/대용량(업소용)
나베S&F 심영순 향신즙 4L,"소스/드레싱/시럽/소스/기타소스/대용량(업소용)/양파(국내산), 마늘(국내산), 락토에프파우더(중국산)"
난도스 난도스 오리지널 스파이시 마요 퍼리네즈 드레싱 255ml,소스/드레싱/시럽/드레싱/튜브형
난도스 페리페리 소스 미디움 250g,소스/드레싱/시럽/소스/칠리 소스/유리/네덜란드
남대문 국물떡볶이 소스 300g,소스/드레싱/시럽/소스/떡볶이 소스/보관방법: 실온보관
네슬레 매기 액상 쓰촨소스 1kg,소스/드레싱/시럽/소스/중식소스/보관방법: 실온보관
노브랜드 알리오올리오 스파게티소스 250g,소스/드레싱/시럽/소스/파스타소스/보관방법: 실온보관
농심 먹태 청양마요 만능소스 250g,소스/드레싱/시럽/소스/기타소스/튜브형
농심 배홍동 만능소스 300g,소스/드레싱/시럽/소스/기타소스/보관방법: 실온보관
농심 사천짜파게티 만능소스 280g,소스/드레싱/시럽/소스/기타소스/튜브형
농심 짜파게티 만능소스 280g,소스/드레싱/시럽/소스/만능소스/보관방법: 실온보관
뉴그린푸드 김치찌개 양념 280g,소스/드레싱/시럽/소스/찌개양념/보관방법: 실온보관
뉴그린푸드 떡볶이 양념 10kg,소스/드레싱/시럽/소스/떡볶이 소스/보관방법: 실온보관/대용량(업소용)
뉴그린푸드 매콤한 떡볶이소스 골드 2kg,소스/드레싱/시럽/소스/떡볶이 소스/보관방법: 실온보관/대용량(업소용)
뉴그린푸드 바베큐 데리야끼 소스 2kg,소스/드레싱/시럽/소스/일식소스/보관방법: 실온보관/대용량(업소용)
뉴그린푸드 바베큐 데리야끼소스 2kg,소스/드레싱/시럽/소스/스파우트팩/대용량(업소용)
뉴그린푸드 불닭소스 2kg,소스/드레싱/시럽/소스/불닭소스/보관방법: 실온보관
뉴그린푸드 알탕 양념 2kg,소스/드레싱/시럽/소스/기타소스/보관방법: 실온보관/대용량(업소용)
뉴그린푸드 오로지 김치찌개 양념 2kg,소스/드레싱/시럽/소스/찌개양념/보관방법: 실온보관
뉴그린푸드 장어구이 양념 매운맛 2kg,소스/드레싱/시럽/소스/대용량(업소용)
뉴그린푸드 장어구이 양념 순한맛 10kg,소스/드레싱/시럽/소스/기타소스/보관방법: 실온보관/대용량(업소용)
뉴그린푸드 제육볶음 양념 2kg,소스/드레싱/시럽/소스/대용량(업소용)
뉴그린푸드 짬뽕소스 1.75kg,소스/드레싱/시럽/소스/중식소스/보관방법: 실온보관/대용량(업소용)
뉴그린푸드 칠리스테이크 소스 2kg,소스/드레싱/시럽/소스/스테이크 소스/대용량(업소용)
뉴그린푸드 프리미엄 스위트 칠리소스 2kg,소스/드레싱/시럽/소스/칠리 소스/보관방법: 실온보관/대용량(업소용)
뉴그린푸드 프리미엄 탕수육 소스 1.85kg,소스/드레싱/시럽/소스/중식소스/보관방법: 실온보관/대용량(업소용)
뉴먼스온 시저 드레싱 473g,소스/드레싱/시럽/드레싱/플라스틱
뉴먼스온 크리미 시저 드레싱 473ml,소스/드레싱/시럽/드레싱/보관방법: 실온보관
뉴먼스온 허니 머스타드 드레싱 473g,소스/드레싱/시럽/드레싱/플라스틱
늘바른 소떡꿀떡 특제소스 500g,소스/드레싱/시럽/소스
다나(DANA) 바베큐소스 이슬나라 10K 고기양념 스테이크양념 스,소스/드레싱/시럽/소스/바베큐 소스
다담 CJ 매콤 떡볶이 양념 140g 6개,소스/드레싱/시럽/소스/고기양념
다렘식품 감자탕 양념분말 1klg,소스/드레싱/시럽/소스/기타소스
다미코 바질페스토 130g,소스/드레싱/시럽/소스/기타소스/딸기(국내산)
다빈치 다빈치 다빈치카라멜소스 다빈치초코소스,소스/드레싱/시럽/소스
다이쇼 다이쇼 장어소스 240g,소스/드레싱/시럽/소스
대력 잘식비 홀스래디쉬 소스 3kg,소스/드레싱/시럽/드레싱/보관방법: 실온보관/대용량(업소용)
대력 카쿠카쿠 초대리 초밥소스 250ml,소스/드레싱/시럽/소스/카페소스/플라스틱
대상 베스트코 떡볶이소스 2.2kg,소스/드레싱/시럽/소스/떡볶이 소스/대용량(업소용)
