Name,Spec,ImageURL
기라델리 기라델리 프리미엄 베이킹코코아 100 무가당,핫초코/파우치형,C:\dev\ZeroMoa\ZeroMoa\crawl_data\images\핫초코_코코아\기라델리 기라델리 프리미엄 베이킹코코아 100 무가당.jpg
고디바 고디바 핫 초코 코코아,핫초코/용기형,C:\dev\ZeroMoa\ZeroMoa\crawl_data\images\핫초코_코코아\고디바 고디바 핫 초코 코코아.jpg
모리나가 밀크 코코아,핫초코/파우치형,C:\dev\ZeroMoa\ZeroMoa\crawl_data\images\핫초코_코코아\모리나가 밀크 코코아.jpg
허쉬 허쉬 오리지널 핫초코 x 4ea,핫초코,C:\dev\ZeroMoa\ZeroMoa\crawl_data\images\핫초코_코코아\허쉬 허쉬 오리지널 핫초코 x 4ea.jpg
기라델리 기라델리 소스 초코 카라멜 화이트,핫초코,C:\dev\ZeroMoa\ZeroMoa\crawl_data\images\핫초코_코코아\기라델리 기라델리 소스 초코 카라멜 화이트.jpg
다농원 다농원 핫초코핫초콜릿 코코아가루 초코라떼,핫초코,C:\dev\ZeroMoa\ZeroMoa\crawl_data\images\핫초코_코코아\다농원 다농원 핫초코핫초콜릿 코코아가루 초코라떼.jpg
허브인코리아 골든허브 카카오 가루,핫초코,C:\dev\ZeroMoa\ZeroMoa\crawl_data\images\핫초코_코코아\허브인코리아 골든허브 카카오 가루.jpg
기라델리 Ghirardelli 핫 더블 초콜릿 파우치,핫초코,C:\dev\ZeroMoa\ZeroMoa\crawl_data\images\핫초코_코코아\기라델리 Ghirardelli 핫 더블 초콜릿 파우치.jpg
커피빈 스페셜 더치 초콜릿 파우더,핫초코,C:\dev\ZeroMoa\ZeroMoa\crawl_data\images\핫초코_코코아\커피빈 스페셜 더치 초콜릿 파우더.jpg
허쉬 초콜릿드링크,핫초코,C:\dev\ZeroMoa\ZeroMoa\crawl_data\images\핫초코_코코아\허쉬 초콜릿드링크.jpg
동서식품 카누 동서 제티쵸콕 코코아 핫초코,핫초코,C:\dev\ZeroMoa\ZeroMoa\crawl_data\images\핫초코_코코아\동서식품 카누 동서 제티쵸콕 코코아 핫초코.jpg
위타드 위타드 럭셔리코코아,핫초코,C:\dev\ZeroMoa\ZeroMoa\crawl_data\images\핫초코_코코아\위타드 위타드 럭셔리코코아.jpg
기라델리 스윗 그라운드 코코아 가루,핫초코,C:\dev\ZeroMoa\ZeroMoa\crawl_data\images\핫초코_코코아\기라델리 스윗 그라운드 코코아 가루.jpg
스위스미스 스위스미스 핫초코/허쉬코코아,핫초코,C:\dev\ZeroMoa\ZeroMoa\crawl_data\images\핫초코_코코아\스위스미스 스위스미스 핫초코_허쉬코코아.jpg
기라델리 기라델리 스위트 그라운드 초콜릿,핫초코,C:\dev\ZeroMoa\ZeroMoa\crawl_data\images\핫초코_코코아\기라델리 기라델리 스위트 그라운드 초콜릿.jpg
프레쉬 핫초코/자판기국산차,핫초코/리필형,C:\dev\ZeroMoa\ZeroMoa\crawl_data\images\핫초코_코코아\프레쉬 핫초코_자판기국산차.jpg
기라델리 기라델리 스위트 그라운드초콜릿 파우더,핫초코,C:\dev\ZeroMoa\ZeroMoa\crawl_data\images\핫초코_코코아\기라델리 기라델리 스위트 그라운드초콜릿 파우더.jpg
큐팜스 큐팜스 초코렛 시나몬 토핑파우더 혼합,핫초코,C:\dev\ZeroMoa\ZeroMoa\crawl_data\images\핫초코_코코아\큐팜스 큐팜스 초코렛 시나몬 토핑파우더 혼합.jpg
기라델리 기라델리 스위트그라운드 초콜릿 파우더세트,핫초코,C:\dev\ZeroMoa\ZeroMoa\crawl_data\images\핫초코_코코아\기라델리 기라델리 스위트그라운드 초콜릿 파우더세트.jpg
기라델리 기라델리 초콜렛 소스,핫초코,C:\dev\ZeroMoa\ZeroMoa\crawl_data\images\핫초코_코코아\기라델리 기라델리 초콜렛 소스.jpg
큐팜스 큐팜스 초코 토핑파우더세트,핫초코,C:\dev\ZeroMoa\ZeroMoa\crawl_data\images\핫초코_코코아\큐팜스 큐팜스 초코 토핑파우더세트.jpg
아임요 아임요 초코 믹스 핫초코 라떼,핫초코,C:\dev\ZeroMoa\ZeroMoa\crawl_data\images\핫초코_코코아\아임요 아임요 초코 믹스 핫초코 라떼.jpg
스위스미스 콘아그라푸즈 스위스미스 핫코코아 밀크쵸코,핫초코,C:\dev\ZeroMoa\ZeroMoa\crawl_data\images\핫초코_코코아\스위스미스 콘아그라푸즈 스위스미스 핫코코아 밀크쵸코.jpg
비바니 오가닉샵 유기농 코코아,핫초코,C:\dev\ZeroMoa\ZeroMoa\crawl_data\images\핫초코_코코아\비바니 오가닉샵 유기농 코코아.jpg
리얼초코 36 파우더,핫초코,C:\dev\ZeroMoa\ZeroMoa\crawl_data\images\핫초코_코코아\리얼초코 36 파우더.jpg
더블데이 더블데이 세미 스위트 코코아칩스,핫초코,C:\dev\ZeroMoa\ZeroMoa\crawl_data\images\핫초코_코코아\더블데이 더블데이 세미 스위트 코코아칩스.jpg
선인 코코아분말,핫초코,C:\dev\ZeroMoa\ZeroMoa\crawl_data\images\핫초코_코코아\선인 코코아분말.jpg
모리나가 모리나 밀크코코아,핫초코,C:\dev\ZeroMoa\ZeroMoa\crawl_data\images\핫초코_코코아\모리나가 모리나 밀크코코아.jpg
유안종합식품 유안 핫쵸코 최저가/코코아/율무차/핫초코/자판기,핫초코/리필형,C:\dev\ZeroMoa\ZeroMoa\crawl_data\images\핫초코_코코아\유안종합식품 유안 핫쵸코 최저가_코코아_율무차_핫초코_자판기.jpg
초콜릿파우더박스,핫초코/파우치형,C:\dev\ZeroMoa\ZeroMoa\crawl_data\images\핫초코_코코아\초콜릿파우더박스.jpg
티마드 티마드 초코라떼 파우더,핫초코,C:\dev\ZeroMoa\ZeroMoa\crawl_data\images\핫초코_코코아\티마드 티마드 초코라떼 파우더.jpg
큐팜스 큐팜스 파우더화이트초코 프라페노 등,핫초코,C:\dev\ZeroMoa\ZeroMoa\crawl_data\images\핫초코_코코아\큐팜스 큐팜스 파우더화이트초코 프라페노 등.jpg
기라델리 기라델리 스위트그라운드 초콜릿 파우더,핫초코,C:\dev\ZeroMoa\ZeroMoa\crawl_data\images\핫초코_코코아\기라델리 기라델리 스위트그라운드 초콜릿 파우더.jpg
아임요 아임요 다크초코 믹스 핫초코 라떼,핫초코,C:\dev\ZeroMoa\ZeroMoa\crawl_data\images\핫초코_코코아\아임요 아임요 다크초코 믹스 핫초코 라떼.jpg
초콜릿 파우더,핫초코,C:\dev\ZeroMoa\ZeroMoa\crawl_data\images\핫초코_코코아\초콜릿 파우더.jpg
아임요 아임요 다크초코/민트 그린티 초코칩 파우더,핫초코,C:\dev\ZeroMoa\ZeroMoa\crawl_data\images\핫초코_코코아\아임요 아임요 다크초코_민트 그린티 초코칩 파우더.jpg
선인 코코아파우더,핫초코,C:\dev\ZeroMoa\ZeroMoa\crawl_data\images\핫초코_코코아\선인 코코아파우더.jpg
스타벅스 핫초코 코코아 솔티드 카라멜 Starbucks Hot Cocoa,핫초코/용기형,C:\dev\ZeroMoa\ZeroMoa\crawl_data\images\핫초코_코코아\스타벅스 핫초코 코코아 솔티드 카라멜 Starbucks Hot Cocoa.jpg
이마트 노브랜드 밀크 매직 스트로우 초코입,핫초코,C:\dev\ZeroMoa\ZeroMoa\crawl_data\images\핫초코_코코아\이마트 노브랜드 밀크 매직 스트로우 초코입.jpg
아트박스 상상앤드 코코아분말,핫초코/분말,C:\dev\ZeroMoa\ZeroMoa\crawl_data\images\핫초코_코코아\아트박스 상상앤드 코코아분말.jpg
기라델리 기라델리 초콜릿 코코아 파우더,핫초코/용기형,C:\dev\ZeroMoa\ZeroMoa\crawl_data\images\핫초코_코코아\기라델리 기라델리 초콜릿 코코아 파우더.jpg
베터초코 오리지널 무설탕 핫초코,핫초코/분말/스틱형/총량: 8T,C:\dev\ZeroMoa\ZeroMoa\crawl_data\images\핫초코_코코아\베터초코 오리지널 무설탕 핫초코.jpg
스위스미스 유니콘 마시멜로 코코아,핫초코/분말/스틱형/총량: 18T/1T당: 45g,C:\dev\ZeroMoa\ZeroMoa\crawl_data\images\핫초코_코코아\스위스미스 유니콘 마시멜로 코코아.jpg
랜드오레이크스 프렌치 바닐라 초콜릿 핫 코코아 믹스,핫초코,C:\dev\ZeroMoa\ZeroMoa\crawl_data\images\핫초코_코코아\랜드오레이크스 프렌치 바닐라 초콜릿 핫 코코아 믹스.jpg
랜드오레이크스 헤이즐넛 초콜릿 핫 코코아 믹스,핫초코/분말/파우치형,C:\dev\ZeroMoa\ZeroMoa\crawl_data\images\핫초코_코코아\랜드오레이크스 헤이즐넛 초콜릿 핫 코코아 믹스.jpg
랜드오레이크스 민트 초콜릿 코코아 믹스,핫초코/분말/용기형,C:\dev\ZeroMoa\ZeroMoa\crawl_data\images\핫초코_코코아\랜드오레이크스 민트 초콜릿 코코아 믹스.jpg
스티븐스 고메 핫 코코아 화이트 초콜릿,핫초코/분말/용기형,C:\dev\ZeroMoa\ZeroMoa\crawl_data\images\핫초코_코코아\스티븐스 고메 핫 코코아 화이트 초콜릿.jpg
스티븐스 고메 핫 코코아 초콜릿 민트 트러플,핫초코/분말/용기형,C:\dev\ZeroMoa\ZeroMoa\crawl_data\images\핫초코_코코아\스티븐스 고메 핫 코코아 초콜릿 민트 트러플.jpg
스타벅스 핫 코코아 솔티드 카라멜,핫초코/분말/스틱형/총량: 24T/1T당: 28g,C:\dev\ZeroMoa\ZeroMoa\crawl_data\images\핫초코_코코아\스타벅스 핫 코코아 솔티드 카라멜.jpg
다누푸드 코코아 파우더,핫초코/분말/파우치형,C:\dev\ZeroMoa\ZeroMoa\crawl_data\images\핫초코_코코아\다누푸드 코코아 파우더.jpg
꼬미다 코코아,핫초코/분말/파우치형,C:\dev\ZeroMoa\ZeroMoa\crawl_data\images\핫초코_코코아\꼬미다 코코아.jpg
지에프컴퍼니 네이쳐티 초코 라떼 파우더,핫초코/분말/파우치형,C:\dev\ZeroMoa\ZeroMoa\crawl_data\images\핫초코_코코아\지에프컴퍼니 네이쳐티 초코 라떼 파우더.jpg
흥국F&B 초코 파우더,핫초코/분말/파우치형,C:\dev\ZeroMoa\ZeroMoa\crawl_data\images\핫초코_코코아\흥국F&B 초코 파우더.jpg
지엔인터내셔널 모도르 그린티민트초코칩 파우더,핫초코/분말/파우치형,C:\dev\ZeroMoa\ZeroMoa\crawl_data\images\핫초코_코코아\지엔인터내셔널 모도르 그린티민트초코칩 파우더.jpg
지엔인터내셔널 모도르 쿠키 앤 크림 파우더,핫초코/분말/파우치형,C:\dev\ZeroMoa\ZeroMoa\crawl_data\images\핫초코_코코아\지엔인터내셔널 모도르 쿠키 앤 크림 파우더.jpg
더나은에프앤비 더캐럿 매일쓰는 초코 파우더,핫초코/분말/파우치형,C:\dev\ZeroMoa\ZeroMoa\crawl_data\images\핫초코_코코아\더나은에프앤비 더캐럿 매일쓰는 초코 파우더.jpg
탐앤탐스 민트초코,핫초코/분말/스틱형/총량: 30T/1T당: 20g,C:\dev\ZeroMoa\ZeroMoa\crawl_data\images\핫초코_코코아\탐앤탐스 민트초코.jpg
탐앤탐스 티요 코코아 오리지널,핫초코/분말/스틱형/총량: 30T/1T당: 20g,C:\dev\ZeroMoa\ZeroMoa\crawl_data\images\핫초코_코코아\탐앤탐스 티요 코코아 오리지널.jpg
더연두 코코아 파우더,핫초코/분말/파우치형,C:\dev\ZeroMoa\ZeroMoa\crawl_data\images\핫초코_코코아\더연두 코코아 파우더.jpg
스위스미스 핫 코코아 믹스 저칼로리,핫초코/분말/스틱형/총량: 96T/1T당: 11g,C:\dev\ZeroMoa\ZeroMoa\crawl_data\images\핫초코_코코아\스위스미스 핫 코코아 믹스 저칼로리.jpg
브레드가든 코코아파우더,핫초코/분말/용기형,C:\dev\ZeroMoa\ZeroMoa\crawl_data\images\핫초코_코코아\브레드가든 코코아파우더.jpg
기라델리 프리미엄 베이킹 코코아,핫초코/분말/파우치형,C:\dev\ZeroMoa\ZeroMoa\crawl_data\images\핫초코_코코아\기라델리 프리미엄 베이킹 코코아.jpg
C&B 카페마고 핫쵸코,핫초코/분말/파우치형,C:\dev\ZeroMoa\ZeroMoa\crawl_data\images\핫초코_코코아\C&B 카페마고 핫쵸코.jpg
까페드다몬 쵸코레뜨,핫초코/분말/파우치형,C:\dev\ZeroMoa\ZeroMoa\crawl_data\images\핫초코_코코아\까페드다몬 쵸코레뜨.jpg
스위스미스 심플리 코코아 다크 초콜릿맛,핫초코/분말/스틱형/총량: 24T/1T당: 27g,C:\dev\ZeroMoa\ZeroMoa\crawl_data\images\핫초코_코코아\스위스미스 심플리 코코아 다크 초콜릿맛.jpg
기라델리 더블초콜릿 핫코코아,핫초코/분말/파우치형,C:\dev\ZeroMoa\ZeroMoa\crawl_data\images\핫초코_코코아\기라델리 더블초콜릿 핫코코아.jpg
WANDER 카오티나 오리지널,핫초코/분말/용기형,C:\dev\ZeroMoa\ZeroMoa\crawl_data\images\핫초코_코코아\WANDER 카오티나 오리지널.jpg
쟈뎅 까페모리 홈스타일 핫초코렛,핫초코/분말/스틱형/총량: 50T/1T당: 19g,C:\dev\ZeroMoa\ZeroMoa\crawl_data\images\핫초코_코코아\쟈뎅 까페모리 홈스타일 핫초코렛.jpg
네슬레 핫초코 오리지날 파우치형,핫초코/분말/파우치형,C:\dev\ZeroMoa\ZeroMoa\crawl_data\images\핫초코_코코아\네슬레 핫초코 오리지날 파우치형.jpg
아레스 아레스 오리지널 초코 파우더,핫초코/분말/파우치형,C:\dev\ZeroMoa\ZeroMoa\crawl_data\images\핫초코_코코아\아레스 아레스 오리지널 초코 파우더.jpg
비바니 유기농 코코아,핫초코/분말/파우치형,C:\dev\ZeroMoa\ZeroMoa\crawl_data\images\핫초코_코코아\비바니 유기농 코코아.jpg
대호식품 프리미엄 핫초코,핫초코/분말/파우치형,C:\dev\ZeroMoa\ZeroMoa\crawl_data\images\핫초코_코코아\대호식품 프리미엄 핫초코.jpg
카일스 다크리얼 초콜릿 파우더,핫초코/분말/파우치형,C:\dev\ZeroMoa\ZeroMoa\crawl_data\images\핫초코_코코아\카일스 다크리얼 초콜릿 파우더.jpg
