Name,Spec,ImageURL
투썸플레이스 투썸 에이리스트 스틱커피 바닐라라떼,핫초코,C:\dev\ZeroMoa\ZeroMoa\crawl_data\images\핫초코_코코아\투썸플레이스 투썸 에이리스트 스틱커피 바닐라라떼.jpg
오뚜기 오쉐프 유자차자판기용 율무차 유자가루,핫초코,C:\dev\ZeroMoa\ZeroMoa\crawl_data\images\핫초코_코코아\오뚜기 오쉐프 유자차자판기용 율무차 유자가루.jpg
위드고 토피넛 파우더,핫초코,C:\dev\ZeroMoa\ZeroMoa\crawl_data\images\핫초코_코코아\위드고 토피넛 파우더.jpg
투썸플레이스 투썸 초콜릿 라떼입,핫초코/스틱형,C:\dev\ZeroMoa\ZeroMoa\crawl_data\images\핫초코_코코아\투썸플레이스 투썸 초콜릿 라떼입.jpg
동서식품 맥심 카누 다크 로스트 아메리카노 커피/오리지날 사이즈,핫초코,C:\dev\ZeroMoa\ZeroMoa\crawl_data\images\핫초코_코코아\동서식품 맥심 카누 다크 로스트 아메리카노 커피_오리지날 사이즈.jpg
코스트코 이디야 요거트 파우더,핫초코,C:\dev\ZeroMoa\ZeroMoa\crawl_data\images\핫초코_코코아\코스트코 이디야 요거트 파우더.jpg
담터 담터 핫초코 오리지널*,핫초코,C:\dev\ZeroMoa\ZeroMoa\crawl_data\images\핫초코_코코아\담터 담터 핫초코 오리지널_.jpg
카카오바리 카카오바리 초콜렛 파우더-카카오31 7 핫초코,핫초코,C:\dev\ZeroMoa\ZeroMoa\crawl_data\images\핫초코_코코아\카카오바리 카카오바리 초콜렛 파우더-카카오31 7 핫초코.jpg
네슬레 네스퀵 초코 코코아 분말2,핫초코,C:\dev\ZeroMoa\ZeroMoa\crawl_data\images\핫초코_코코아\네슬레 네스퀵 초코 코코아 분말2.jpg
허쉬 오리지널 핫초코 원컵입,핫초코,C:\dev\ZeroMoa\ZeroMoa\crawl_data\images\핫초코_코코아\허쉬 오리지널 핫초코 원컵입.jpg
크래프트하인즈 크리스탈라이트원하는맛 골라담기 4.피치망고5.체리석류,핫초코,C:\dev\ZeroMoa\ZeroMoa\crawl_data\images\핫초코_코코아\크래프트하인즈 크리스탈라이트원하는맛 골라담기 4.피치망고5.체리석류.jpg
동서식품 카누 제티 초코렛 스틱입,핫초코/스틱형,C:\dev\ZeroMoa\ZeroMoa\crawl_data\images\핫초코_코코아\동서식품 카누 제티 초코렛 스틱입.jpg
쟈뎅 투썸 에이리스트 스틱커피 마일드블렌드,핫초코,C:\dev\ZeroMoa\ZeroMoa\crawl_data\images\핫초코_코코아\쟈뎅 투썸 에이리스트 스틱커피 마일드블렌드.jpg
동서식품 카누 제티 바나나맛,핫초코,C:\dev\ZeroMoa\ZeroMoa\crawl_data\images\핫초코_코코아\동서식품 카누 제티 바나나맛.jpg
네슬레 핫쵸코 핫초코/초코우유 코코아,핫초코,C:\dev\ZeroMoa\ZeroMoa\crawl_data\images\핫초코_코코아\네슬레 핫쵸코 핫초코_초코우유 코코아.jpg
이마트 피코크 피코크 마몰로 리치핫초코,핫초코,C:\dev\ZeroMoa\ZeroMoa\crawl_data\images\핫초코_코코아\이마트 피코크 피코크 마몰로 리치핫초코.jpg
네슬레 네슬레 네스퀵 초콜릿맛입,핫초코,C:\dev\ZeroMoa\ZeroMoa\crawl_data\images\핫초코_코코아\네슬레 네슬레 네스퀵 초콜릿맛입.jpg
담터 핫초코/핫쵸코,핫초코,C:\dev\ZeroMoa\ZeroMoa\crawl_data\images\핫초코_코코아\담터 핫초코_핫쵸코.jpg
커피빈 헤이즐넛라떼 액상커피 파우치,핫초코,C:\dev\ZeroMoa\ZeroMoa\crawl_data\images\핫초코_코코아\커피빈 헤이즐넛라떼 액상커피 파우치.jpg
다농원 다농원 오리지널 핫초코코코아,핫초코,C:\dev\ZeroMoa\ZeroMoa\crawl_data\images\핫초코_코코아\다농원 다농원 오리지널 핫초코코코아.jpg
카파아이엔티 포모나 포모나 민트 코코렛 파우더,핫초코,C:\dev\ZeroMoa\ZeroMoa\crawl_data\images\핫초코_코코아\카파아이엔티 포모나 포모나 민트 코코렛 파우더.jpg
기라델리 기라델리 프리미엄 핫초코 핫코코아,핫초코,C:\dev\ZeroMoa\ZeroMoa\crawl_data\images\핫초코_코코아\기라델리 기라델리 프리미엄 핫초코 핫코코아.jpg
기라델리 인텐스 다크초콜릿 카카오86,핫초코,C:\dev\ZeroMoa\ZeroMoa\crawl_data\images\핫초코_코코아\기라델리 인텐스 다크초콜릿 카카오86.jpg
기라델리 인텐스 다크초콜릿 카카오92,핫초코,C:\dev\ZeroMoa\ZeroMoa\crawl_data\images\핫초코_코코아\기라델리 인텐스 다크초콜릿 카카오92.jpg
바나나맛,핫초코,C:\dev\ZeroMoa\ZeroMoa\crawl_data\images\핫초코_코코아\바나나맛.jpg
가루나라 초코렛맛 제티 코코아 믹스,핫초코/스틱형,C:\dev\ZeroMoa\ZeroMoa\crawl_data\images\핫초코_코코아\가루나라 초코렛맛 제티 코코아 믹스.jpg
동서식품 카누 동서 제티 쿠키앤초코제티 쿠키앤쵸코맛,핫초코,C:\dev\ZeroMoa\ZeroMoa\crawl_data\images\핫초코_코코아\동서식품 카누 동서 제티 쿠키앤초코제티 쿠키앤쵸코맛.jpg
허쉬 오리지널 핫초코단품,핫초코,C:\dev\ZeroMoa\ZeroMoa\crawl_data\images\핫초코_코코아\허쉬 오리지널 핫초코단품.jpg
브레드가든 브레드가든 체망이필요없는 코코아파우더,핫초코,C:\dev\ZeroMoa\ZeroMoa\crawl_data\images\핫초코_코코아\브레드가든 브레드가든 체망이필요없는 코코아파우더.jpg
대호식품 대호 코코아카카오분말 초코 가루 핫초코,핫초코,C:\dev\ZeroMoa\ZeroMoa\crawl_data\images\핫초코_코코아\대호식품 대호 코코아카카오분말 초코 가루 핫초코.jpg
네슬레 핫쵸코핫초코 코코아 카카오 초콜릿,핫초코,C:\dev\ZeroMoa\ZeroMoa\crawl_data\images\핫초코_코코아\네슬레 핫쵸코핫초코 코코아 카카오 초콜릿.jpg
네슬레 핫초코 오리지널-,핫초코,C:\dev\ZeroMoa\ZeroMoa\crawl_data\images\핫초코_코코아\네슬레 핫초코 오리지널-.jpg
스위스미스 핫코코아 믹스봉 핫초코 미떼 코코아,핫초코,C:\dev\ZeroMoa\ZeroMoa\crawl_data\images\핫초코_코코아\스위스미스 핫코코아 믹스봉 핫초코 미떼 코코아.jpg
이노라이즈컴퍼니 이노라이즈 초콜릿 파우더 25,핫초코,C:\dev\ZeroMoa\ZeroMoa\crawl_data\images\핫초코_코코아\이노라이즈컴퍼니 이노라이즈 초콜릿 파우더 25.jpg
동서식품 카누 제티 초콜릿,핫초코,C:\dev\ZeroMoa\ZeroMoa\crawl_data\images\핫초코_코코아\동서식품 카누 제티 초콜릿.jpg
세미 세미 블랙빈라떼,핫초코,C:\dev\ZeroMoa\ZeroMoa\crawl_data\images\핫초코_코코아\세미 세미 블랙빈라떼.jpg
이노라이즈컴퍼니 이노라이즈 프리미엄 초콜렛 파우더세트,핫초코,C:\dev\ZeroMoa\ZeroMoa\crawl_data\images\핫초코_코코아\이노라이즈컴퍼니 이노라이즈 프리미엄 초콜렛 파우더세트.jpg
메가MGC커피 카카오바리 초콜렛 파우더-/핫초코,핫초코/파우치형,C:\dev\ZeroMoa\ZeroMoa\crawl_data\images\핫초코_코코아\메가MGC커피 카카오바리 초콜렛 파우더-_핫초코.jpg
큐팜스 큐팜스 초코파우더,핫초코,C:\dev\ZeroMoa\ZeroMoa\crawl_data\images\핫초코_코코아\큐팜스 큐팜스 초코파우더.jpg
기라델리 기라델리 프리미엄 핫 코코아 더블초콜릿 핫초코,핫초코,C:\dev\ZeroMoa\ZeroMoa\crawl_data\images\핫초코_코코아\기라델리 기라델리 프리미엄 핫 코코아 더블초콜릿 핫초코.jpg
복음자리 자바칩 파우더,핫초코,C:\dev\ZeroMoa\ZeroMoa\crawl_data\images\핫초코_코코아\복음자리 자바칩 파우더.jpg
큐팜스 큐팜스 초코 파우더세트,핫초코,C:\dev\ZeroMoa\ZeroMoa\crawl_data\images\핫초코_코코아\큐팜스 큐팜스 초코 파우더세트.jpg
카일스 밤 고구마라떼 파우더,핫초코,C:\dev\ZeroMoa\ZeroMoa\crawl_data\images\핫초코_코코아\카일스 밤 고구마라떼 파우더.jpg
동서식품 카누 제티 바나나맛입,핫초코/스틱형,C:\dev\ZeroMoa\ZeroMoa\crawl_data\images\핫초코_코코아\동서식품 카누 제티 바나나맛입.jpg
스위스미스 Swiss Miss 저칼로리 Hot Cocoa Mix입,핫초코/스틱형,C:\dev\ZeroMoa\ZeroMoa\crawl_data\images\핫초코_코코아\스위스미스 Swiss Miss 저칼로리 Hot Cocoa Mix입.jpg
기라델리 Ghiradelli 그라운드 코코아,핫초코/용기형,C:\dev\ZeroMoa\ZeroMoa\crawl_data\images\핫초코_코코아\기라델리 Ghiradelli 그라운드 코코아.jpg
기라델리 기라델리 핫초코 스위트 그라운드 코코아 48oz,핫초코,C:\dev\ZeroMoa\ZeroMoa\crawl_data\images\핫초코_코코아\기라델리 기라델리 핫초코 스위트 그라운드 코코아 48oz.jpg
스타벅스 솔티드 카라멜 핫초코 코코아 Starbucks Salted Caramel Cocoa입,핫초코,C:\dev\ZeroMoa\ZeroMoa\crawl_data\images\핫초코_코코아\스타벅스 솔티드 카라멜 핫초코 코코아 Starbucks Salted Caramel Cocoa입.jpg
위타드 위타드 핫초코,핫초코,C:\dev\ZeroMoa\ZeroMoa\crawl_data\images\핫초코_코코아\위타드 위타드 핫초코.jpg
스위스미스 스위스미스 밀크 초콜릿 핫 코코아 믹스,핫초코/용기형,C:\dev\ZeroMoa\ZeroMoa\crawl_data\images\핫초코_코코아\스위스미스 스위스미스 밀크 초콜릿 핫 코코아 믹스.jpg
기라델리 기라델리 더블 초콜릿 프리미엄 핫 코코아,핫초코,C:\dev\ZeroMoa\ZeroMoa\crawl_data\images\핫초코_코코아\기라델리 기라델리 더블 초콜릿 프리미엄 핫 코코아.jpg
기라델리 기라델리 핫초코파우더,핫초코,C:\dev\ZeroMoa\ZeroMoa\crawl_data\images\핫초코_코코아\기라델리 기라델리 핫초코파우더.jpg
기라델리 기라델리 스위트 그라운드 초콜릿 코코아 파우더,핫초코,C:\dev\ZeroMoa\ZeroMoa\crawl_data\images\핫초코_코코아\기라델리 기라델리 스위트 그라운드 초콜릿 코코아 파우더.jpg
WANDER 카오티나 코코아 오리지널,핫초코,C:\dev\ZeroMoa\ZeroMoa\crawl_data\images\핫초코_코코아\WANDER 카오티나 코코아 오리지널.jpg
아레스 한마음디에스 아레스 초코 파우더-/코코아/네스퀵,핫초코/파우치형,C:\dev\ZeroMoa\ZeroMoa\crawl_data\images\핫초코_코코아\아레스 한마음디에스 아레스 초코 파우더-_코코아_네스퀵.jpg
스위스미스 스위스미스 다크 초콜릿 핫초코 믹스 10oz,핫초코,C:\dev\ZeroMoa\ZeroMoa\crawl_data\images\핫초코_코코아\스위스미스 스위스미스 다크 초콜릿 핫초코 믹스 10oz.jpg
기라델리 프리미엄 핫코코아 초콜렛,핫초코,C:\dev\ZeroMoa\ZeroMoa\crawl_data\images\핫초코_코코아\기라델리 프리미엄 핫코코아 초콜렛.jpg
스위스미스 Swiss Miss 유니콘 마시멜로 핫 코코아 믹스,핫초코/스틱형,C:\dev\ZeroMoa\ZeroMoa\crawl_data\images\핫초코_코코아\스위스미스 Swiss Miss 유니콘 마시멜로 핫 코코아 믹스.jpg
스타벅스 스타벅스 더블샷 에너지드링크 초콜릿,핫초코,C:\dev\ZeroMoa\ZeroMoa\crawl_data\images\핫초코_코코아\스타벅스 스타벅스 더블샷 에너지드링크 초콜릿.jpg
Options 옵션 벨지안 초콜릿 핫초코 파우더,핫초코/용기형,C:\dev\ZeroMoa\ZeroMoa\crawl_data\images\핫초코_코코아\Options 옵션 벨지안 초콜릿 핫초코 파우더.jpg
기라델리 스위트 초코렛 코코아,핫초코,C:\dev\ZeroMoa\ZeroMoa\crawl_data\images\핫초코_코코아\기라델리 스위트 초코렛 코코아.jpg
기라델리 기라델리 스위트 그라운드 초콜렛파우더,핫초코/용기형,C:\dev\ZeroMoa\ZeroMoa\crawl_data\images\핫초코_코코아\기라델리 기라델리 스위트 그라운드 초콜렛파우더.jpg
기라델리 프리미엄 핫초코 파우더,핫초코,C:\dev\ZeroMoa\ZeroMoa\crawl_data\images\핫초코_코코아\기라델리 프리미엄 핫초코 파우더.jpg
기라델리 Ghirardelli 더블 초콜릿 핫초코,핫초코,C:\dev\ZeroMoa\ZeroMoa\crawl_data\images\핫초코_코코아\기라델리 Ghirardelli 더블 초콜릿 핫초코.jpg
허쉬 코코아 100% 카카오,핫초코/분말/용기형,C:\dev\ZeroMoa\ZeroMoa\crawl_data\images\핫초코_코코아\허쉬 코코아 100% 카카오.jpg
네슬레 Nestle 핫 코코아 믹스 밀크 초콜릿Hot Mix Milk,핫초코,C:\dev\ZeroMoa\ZeroMoa\crawl_data\images\핫초코_코코아\네슬레 Nestle 핫 코코아 믹스 밀크 초콜릿Hot Mix Milk.jpg
위타드 Whittard Limited Edition Raspberry Ripple Flavour Hot Chocolate,핫초코,C:\dev\ZeroMoa\ZeroMoa\crawl_data\images\핫초코_코코아\위타드 Whittard Limited Edition Raspberry Ripple Flavour Hot Chocolate.jpg
세미 밤라떼 페이스트,핫초코,C:\dev\ZeroMoa\ZeroMoa\crawl_data\images\핫초코_코코아\세미 밤라떼 페이스트.jpg
빅트레인 빅트레인 더블 핫 초콜릿 파우더,핫초코/리필형,C:\dev\ZeroMoa\ZeroMoa\crawl_data\images\핫초코_코코아\빅트레인 빅트레인 더블 핫 초콜릿 파우더.jpg
타이거마마 PG 타이거마마 스틱형 분말 쿠키앤크림 라떼세트 쿠키앤크림라떼,핫초코,C:\dev\ZeroMoa\ZeroMoa\crawl_data\images\핫초코_코코아\타이거마마 PG 타이거마마 스틱형 분말 쿠키앤크림 라떼세트 쿠키앤크림라떼.jpg
청은에프엔비 코코아파우더,핫초코,C:\dev\ZeroMoa\ZeroMoa\crawl_data\images\핫초코_코코아\청은에프엔비 코코아파우더.jpg
더블데이 더블데이 카카오 다크홀릭,핫초코,C:\dev\ZeroMoa\ZeroMoa\crawl_data\images\핫초코_코코아\더블데이 더블데이 카카오 다크홀릭.jpg
고디바 코코아 파우더 다크 초콜릿가루 분말 핫초코 GODIVA,핫초코,C:\dev\ZeroMoa\ZeroMoa\crawl_data\images\핫초코_코코아\고디바 코코아 파우더 다크 초콜릿가루 분말 핫초코 GODIVA.jpg
희창유업 희창유업 핫초코봉지X,핫초코,C:\dev\ZeroMoa\ZeroMoa\crawl_data\images\핫초코_코코아\희창유업 희창유업 핫초코봉지X.jpg
업소용 식당 식자재 유안 자판기용 매실차 분말W7AF250,핫초코,C:\dev\ZeroMoa\ZeroMoa\crawl_data\images\핫초코_코코아\업소용 식당 식자재 유안 자판기용 매실차 분말W7AF250.jpg
동서식품 카누 동서 동서 미떼 핫초코 마일드,핫초코,C:\dev\ZeroMoa\ZeroMoa\crawl_data\images\핫초코_코코아\동서식품 카누 동서 동서 미떼 핫초코 마일드.jpg
WANDER 카오티나 카오티나 오리지널 코코아 파우더,핫초코,C:\dev\ZeroMoa\ZeroMoa\crawl_data\images\핫초코_코코아\WANDER 카오티나 카오티나 오리지널 코코아 파우더.jpg
미떼 핫초코 마일드,핫초코,C:\dev\ZeroMoa\ZeroMoa\crawl_data\images\핫초코_코코아\미떼 핫초코 마일드.jpg
타코 타코 카페 다크 초콜릿핫 코코아 핫초코,핫초코,C:\dev\ZeroMoa\ZeroMoa\crawl_data\images\핫초코_코코아\타코 타코 카페 다크 초콜릿핫 코코아 핫초코.jpg
C&B 씨앤비 코코아차 핫초코 핫쵸코 자판기,핫초코/리필형/파우치형,C:\dev\ZeroMoa\ZeroMoa\crawl_data\images\핫초코_코코아\C&B 씨앤비 코코아차 핫초코 핫쵸코 자판기.jpg
담터 레몬에이드 믹스입,핫초코,C:\dev\ZeroMoa\ZeroMoa\crawl_data\images\핫초코_코코아\담터 레몬에이드 믹스입.jpg
동서식품 카누 미떼 핫초코 오리지날초콜릿 코코아 따뜻한핫초코 카카오 따뜻한음료 핫초콜릿 믹스,핫초코,C:\dev\ZeroMoa\ZeroMoa\crawl_data\images\핫초코_코코아\동서식품 카누 미떼 핫초코 오리지날초콜릿 코코아 따뜻한핫초코 카카오 따뜻한음료 핫초콜릿 믹스.jpg
스위스미스 Swissmiss 핫 코코아 x,핫초코,C:\dev\ZeroMoa\ZeroMoa\crawl_data\images\핫초코_코코아\스위스미스 Swissmiss 핫 코코아 x.jpg
까로망 레드진홍삼라떼 파우더입,핫초코,C:\dev\ZeroMoa\ZeroMoa\crawl_data\images\핫초코_코코아\까로망 레드진홍삼라떼 파우더입.jpg
아임요 아임요 다크초코 믹스,핫초코,C:\dev\ZeroMoa\ZeroMoa\crawl_data\images\핫초코_코코아\아임요 아임요 다크초코 믹스.jpg
네슬레 마일로 milo 코코아,핫초코/파우치형,C:\dev\ZeroMoa\ZeroMoa\crawl_data\images\핫초코_코코아\네슬레 마일로 milo 코코아.jpg
이마트 피코크 피코크 마몰로 베이킹코코아,핫초코/용기형,C:\dev\ZeroMoa\ZeroMoa\crawl_data\images\핫초코_코코아\이마트 피코크 피코크 마몰로 베이킹코코아.jpg
동서식품 카누 동서 마일드/오리지날/코코아/핫초코식품,핫초코,C:\dev\ZeroMoa\ZeroMoa\crawl_data\images\핫초코_코코아\동서식품 카누 동서 마일드_오리지날_코코아_핫초코식품.jpg
동서식품 카누 미떼 동서 미떼 핫초코 오리지날,핫초코,C:\dev\ZeroMoa\ZeroMoa\crawl_data\images\핫초코_코코아\동서식품 카누 미떼 동서 미떼 핫초코 오리지날.jpg
동서식품 카누 제티 초코렛맛,핫초코,C:\dev\ZeroMoa\ZeroMoa\crawl_data\images\핫초코_코코아\동서식품 카누 제티 초코렛맛.jpg
동서식품 카누 동서 맥심 커피믹스 모카골드 화이트골드 오리지널 식품,핫초코,C:\dev\ZeroMoa\ZeroMoa\crawl_data\images\핫초코_코코아\동서식품 카누 동서 맥심 커피믹스 모카골드 화이트골드 오리지널 식품.jpg
복음자리 바닐라 파우더세트,핫초코,C:\dev\ZeroMoa\ZeroMoa\crawl_data\images\핫초코_코코아\복음자리 바닐라 파우더세트.jpg
펄세스 스테비아 오트라떼입,핫초코,C:\dev\ZeroMoa\ZeroMoa\crawl_data\images\핫초코_코코아\펄세스 스테비아 오트라떼입.jpg
핫초코 오리지날개별포장 초코릿맛 코코아차,핫초코,C:\dev\ZeroMoa\ZeroMoa\crawl_data\images\핫초코_코코아\핫초코 오리지날개별포장 초코릿맛 코코아차.jpg
아트박스 크라운 쵸코 화이트 하임 2종세트,핫초코,C:\dev\ZeroMoa\ZeroMoa\crawl_data\images\핫초코_코코아\아트박스 크라운 쵸코 화이트 하임 2종세트.jpg
네슬레 네스퀵 네스퀵 초코스틱 분말,핫초코,C:\dev\ZeroMoa\ZeroMoa\crawl_data\images\핫초코_코코아\네슬레 네스퀵 네스퀵 초코스틱 분말.jpg
아임요 17곡 파우더입,핫초코,C:\dev\ZeroMoa\ZeroMoa\crawl_data\images\핫초코_코코아\아임요 17곡 파우더입.jpg
아임요 그린티민트 초코칩 파우더세트,핫초코,C:\dev\ZeroMoa\ZeroMoa\crawl_data\images\핫초코_코코아\아임요 그린티민트 초코칩 파우더세트.jpg
타코 타코 더블초코 자바칩 프라페믹스세트,핫초코,C:\dev\ZeroMoa\ZeroMoa\crawl_data\images\핫초코_코코아\타코 타코 더블초코 자바칩 프라페믹스세트.jpg
티원 티원 초콜릿 파우더세트,핫초코,C:\dev\ZeroMoa\ZeroMoa\crawl_data\images\핫초코_코코아\티원 티원 초콜릿 파우더세트.jpg
빅트레인 자바칩,핫초코,C:\dev\ZeroMoa\ZeroMoa\crawl_data\images\핫초코_코코아\빅트레인 자바칩.jpg
위드고 위드고 애니타임 핫초코 파우더,핫초코,C:\dev\ZeroMoa\ZeroMoa\crawl_data\images\핫초코_코코아\위드고 위드고 애니타임 핫초코 파우더.jpg
이디야 초콜릿 칩 라떼,핫초코/스틱형,C:\dev\ZeroMoa\ZeroMoa\crawl_data\images\핫초코_코코아\이디야 초콜릿 칩 라떼.jpg
티원 티원 초콜릿 파우더 초코라떼,핫초코,C:\dev\ZeroMoa\ZeroMoa\crawl_data\images\핫초코_코코아\티원 티원 초콜릿 파우더 초코라떼.jpg
젤스타 젤스타 요비앙카 밀크 초코파우더세트 카페,핫초코,C:\dev\ZeroMoa\ZeroMoa\crawl_data\images\핫초코_코코아\젤스타 젤스타 요비앙카 밀크 초코파우더세트 카페.jpg
씨앤비에프 내몸에 곡물라떼자판기용,핫초코/리필형,C:\dev\ZeroMoa\ZeroMoa\crawl_data\images\핫초코_코코아\씨앤비에프 내몸에 곡물라떼자판기용.jpg
커피빈 바닐라라떼,핫초코,C:\dev\ZeroMoa\ZeroMoa\crawl_data\images\핫초코_코코아\커피빈 바닐라라떼.jpg
까르페 자바칩 파우더,핫초코,C:\dev\ZeroMoa\ZeroMoa\crawl_data\images\핫초코_코코아\까르페 자바칩 파우더.jpg
아임요 과일베이스 망고,핫초코,C:\dev\ZeroMoa\ZeroMoa\crawl_data\images\핫초코_코코아\아임요 과일베이스 망고.jpg
까로망 민트초코칩 파우더,핫초코,C:\dev\ZeroMoa\ZeroMoa\crawl_data\images\핫초코_코코아\까로망 민트초코칩 파우더.jpg
큐팜스 큐팜스 초코토핑 파우더,핫초코,C:\dev\ZeroMoa\ZeroMoa\crawl_data\images\핫초코_코코아\큐팜스 큐팜스 초코토핑 파우더.jpg
타코 타코파우더 카페 초콜렛,핫초코,C:\dev\ZeroMoa\ZeroMoa\crawl_data\images\핫초코_코코아\타코 타코파우더 카페 초콜렛.jpg
네슬레 네스퀵 초콜렛파우더세트초콜릿 초코,핫초코,C:\dev\ZeroMoa\ZeroMoa\crawl_data\images\핫초코_코코아\네슬레 네스퀵 초콜렛파우더세트초콜릿 초코.jpg
까로망 민트초코칩파우더,핫초코,C:\dev\ZeroMoa\ZeroMoa\crawl_data\images\핫초코_코코아\까로망 민트초코칩파우더.jpg
미떼 핫초코 오리지널쿠팡 고리상 1 쿠팡 고리상 본상품선택,핫초코,C:\dev\ZeroMoa\ZeroMoa\crawl_data\images\핫초코_코코아\미떼 핫초코 오리지널쿠팡 고리상 1 쿠팡 고리상 본상품선택.jpg
신광식품 신광식품 베오베 초코 파우더세트,핫초코,C:\dev\ZeroMoa\ZeroMoa\crawl_data\images\핫초코_코코아\신광식품 신광식품 베오베 초코 파우더세트.jpg
쭝웬 G7 에스프레소입 / 원두 커피 블랙 다크 아메리카노,핫초코,C:\dev\ZeroMoa\ZeroMoa\crawl_data\images\핫초코_코코아\쭝웬 G7 에스프레소입 _ 원두 커피 블랙 다크 아메리카노.jpg
네슬레 네스카페 네스카페 돌체 구스토 네스퀵 핫초코 캡슐입,핫초코,C:\dev\ZeroMoa\ZeroMoa\crawl_data\images\핫초코_코코아\네슬레 네스카페 네스카페 돌체 구스토 네스퀵 핫초코 캡슐입.jpg
허쉬 무설탕 코코아,핫초코,C:\dev\ZeroMoa\ZeroMoa\crawl_data\images\핫초코_코코아\허쉬 무설탕 코코아.jpg
동서식품 카누 제티 초코,핫초코,C:\dev\ZeroMoa\ZeroMoa\crawl_data\images\핫초코_코코아\동서식품 카누 제티 초코.jpg
크래프트하인즈 크리스탈라이트 핑크 레몬 에이드분말입,핫초코,C:\dev\ZeroMoa\ZeroMoa\crawl_data\images\핫초코_코코아\크래프트하인즈 크리스탈라이트 핑크 레몬 에이드분말입.jpg
허쉬 Hersheys Cocoa Special Dark,핫초코,C:\dev\ZeroMoa\ZeroMoa\crawl_data\images\핫초코_코코아\허쉬 Hersheys Cocoa Special Dark.jpg
커피빈 커피빈 아메리카노,핫초코,C:\dev\ZeroMoa\ZeroMoa\crawl_data\images\핫초코_코코아\커피빈 커피빈 아메리카노.jpg
동서식품 카누 제티 초코렛맛입,핫초코/스틱형,C:\dev\ZeroMoa\ZeroMoa\crawl_data\images\핫초코_코코아\동서식품 카누 제티 초코렛맛입.jpg
모리나가 모리나가 퓨어코코아,핫초코/파우치형,C:\dev\ZeroMoa\ZeroMoa\crawl_data\images\핫초코_코코아\모리나가 모리나가 퓨어코코아.jpg
기라델리 기라델리 프리미엄 핫코코아 초콜릿 파우더,핫초코,C:\dev\ZeroMoa\ZeroMoa\crawl_data\images\핫초코_코코아\기라델리 기라델리 프리미엄 핫코코아 초콜릿 파우더.jpg
쟈뎅 홈스타일 까페모리 핫초코,핫초코,C:\dev\ZeroMoa\ZeroMoa\crawl_data\images\핫초코_코코아\쟈뎅 홈스타일 까페모리 핫초코.jpg
동서식품 카누 미떼 핫초코 민트초코입,핫초코/스틱형,C:\dev\ZeroMoa\ZeroMoa\crawl_data\images\핫초코_코코아\동서식품 카누 미떼 핫초코 민트초코입.jpg
허쉬 코코아 분말가루,핫초코,C:\dev\ZeroMoa\ZeroMoa\crawl_data\images\핫초코_코코아\허쉬 코코아 분말가루.jpg
C&B 씨앤비 코코아차,핫초코/파우치형,C:\dev\ZeroMoa\ZeroMoa\crawl_data\images\핫초코_코코아\C&B 씨앤비 코코아차.jpg
스위스미스 스위스미스 Swiss Miss Hot Chocolate,핫초코,C:\dev\ZeroMoa\ZeroMoa\crawl_data\images\핫초코_코코아\스위스미스 스위스미스 Swiss Miss Hot Chocolate.jpg
카페베네 마노 핫초코 라떼입,핫초코/스틱형,C:\dev\ZeroMoa\ZeroMoa\crawl_data\images\핫초코_코코아\카페베네 마노 핫초코 라떼입.jpg
프레나 핫쵸코핫초코 코코아분말 초코파우더,핫초코/파우치형,C:\dev\ZeroMoa\ZeroMoa\crawl_data\images\핫초코_코코아\프레나 핫쵸코핫초코 코코아분말 초코파우더.jpg
네슬레 오리지널 핫초코 파우더,핫초코/용기형,C:\dev\ZeroMoa\ZeroMoa\crawl_data\images\핫초코_코코아\네슬레 오리지널 핫초코 파우더.jpg
허쉬 코코아 파우더입,핫초코/용기형,C:\dev\ZeroMoa\ZeroMoa\crawl_data\images\핫초코_코코아\허쉬 코코아 파우더입.jpg
동서식품 카누 미떼 화이트초코입,핫초코/스틱형,C:\dev\ZeroMoa\ZeroMoa\crawl_data\images\핫초코_코코아\동서식품 카누 미떼 화이트초코입.jpg
브레드가든 코코아가루,핫초코/용기형,C:\dev\ZeroMoa\ZeroMoa\crawl_data\images\핫초코_코코아\브레드가든 코코아가루.jpg
타코 타코 카페 다크 초콜릿 파우더/묶음/,핫초코,C:\dev\ZeroMoa\ZeroMoa\crawl_data\images\핫초코_코코아\타코 타코 카페 다크 초콜릿 파우더_묶음_.jpg
동서식품 카누 제티 초콕 쿠키앤초코입,핫초코,C:\dev\ZeroMoa\ZeroMoa\crawl_data\images\핫초코_코코아\동서식품 카누 제티 초콕 쿠키앤초코입.jpg
스위스미스 Swiss Miss No Sugar Added Hot Cocoa Mix 무설탕 핫코코아믹스 13.8 oz,핫초코/용기형,C:\dev\ZeroMoa\ZeroMoa\crawl_data\images\핫초코_코코아\스위스미스 Swiss Miss No Sugar Added Hot Cocoa Mix 무설탕 핫코코아믹스 13.8 oz.jpg
스위스미스 스위스미스 밀크 초콜릿 핫 코코아 믹스입,핫초코/스틱형,C:\dev\ZeroMoa\ZeroMoa\crawl_data\images\핫초코_코코아\스위스미스 스위스미스 밀크 초콜릿 핫 코코아 믹스입.jpg
