Name,Spec,ImageURL
동서식품 제티 초코렛맛,"핫초코/분말/스틱형/총량: 50T/중량: 17g/원재료: 설탕, 코코아믹스 15%, 바닐린",C:\dev\ZeroMoa\ZeroMoa\crawl_data\images\핫초코_코코아\동서식품 제티 초코렛맛.jpg
허쉬 카카오분말 100% 코코아,핫초코/분말/용기형,C:\dev\ZeroMoa\ZeroMoa\crawl_data\images\핫초코_코코아\허쉬 카카오분말 100% 코코아.jpg
동서식품 제티 초콕 초코렛맛,핫초코/분말/스틱형/총량: 30T/1T당: 3.6g,C:\dev\ZeroMoa\ZeroMoa\crawl_data\images\핫초코_코코아\동서식품 제티 초콕 초코렛맛.jpg
동서식품 미떼 핫초코 오리지날,핫초코/분말/스틱형/총량: 10T/1T당: 30g,C:\dev\ZeroMoa\ZeroMoa\crawl_data\images\핫초코_코코아\동서식품 미떼 핫초코 오리지날.jpg
스위스미스 핫 코코아 믹스 마시멜로,핫초코/분말/스틱형/총량: 60T/1T당: 28g,C:\dev\ZeroMoa\ZeroMoa\crawl_data\images\핫초코_코코아\스위스미스 핫 코코아 믹스 마시멜로.jpg
네슬레 핫쵸코,핫초코/분말/파우치형,C:\dev\ZeroMoa\ZeroMoa\crawl_data\images\핫초코_코코아\네슬레 핫쵸코.jpg
담터 핫초코 오리지날,핫초코/분말/스틱형/총량: 250T/1T당: 20g,C:\dev\ZeroMoa\ZeroMoa\crawl_data\images\핫초코_코코아\담터 핫초코 오리지날.jpg
담터 코코아차,핫초코/분말/파우치형,C:\dev\ZeroMoa\ZeroMoa\crawl_data\images\핫초코_코코아\담터 코코아차.jpg
한국맥널티 스테비아 제로슈가 핫초코라떼,핫초코/분말/스틱형/총량: 30T/1T당: 15g,C:\dev\ZeroMoa\ZeroMoa\crawl_data\images\핫초코_코코아\한국맥널티 스테비아 제로슈가 핫초코라떼.jpg
네슬레 네스퀵 초콜릿맛,핫초코/분말/스틱형/총량: 80T/1T당: 13.5g,C:\dev\ZeroMoa\ZeroMoa\crawl_data\images\핫초코_코코아\네슬레 네스퀵 초콜릿맛.jpg
스위스미스 핫 코코아 믹스 밀크초콜릿,핫초코/분말/스틱형/총량: 60T/1T당: 28g,C:\dev\ZeroMoa\ZeroMoa\crawl_data\images\핫초코_코코아\스위스미스 핫 코코아 믹스 밀크초콜릿.jpg
네슬레 핫초코 오리지날,핫초코/분말/파우치형,C:\dev\ZeroMoa\ZeroMoa\crawl_data\images\핫초코_코코아\네슬레 핫초코 오리지날.jpg
허쉬 오리지널 핫초코,핫초코/분말/스틱형/총량: 24T/1T당: 30g,C:\dev\ZeroMoa\ZeroMoa\crawl_data\images\핫초코_코코아\허쉬 오리지널 핫초코.jpg
희창유업 핫초코,핫초코/분말/파우치형,C:\dev\ZeroMoa\ZeroMoa\crawl_data\images\핫초코_코코아\희창유업 핫초코.jpg
동서식품 카누 제티 초코렛 리필,핫초코/리필형,C:\dev\ZeroMoa\ZeroMoa\crawl_data\images\핫초코_코코아\동서식품 카누 제티 초코렛 리필.jpg
네슬레 네스퀵 초코맛,핫초코/분말/파우치형,C:\dev\ZeroMoa\ZeroMoa\crawl_data\images\핫초코_코코아\네슬레 네스퀵 초코맛.jpg
희창유업 핫초코 오리지날,핫초코/분말/스틱형/총량: 50T/1T당: 20g,C:\dev\ZeroMoa\ZeroMoa\crawl_data\images\핫초코_코코아\희창유업 핫초코 오리지날.jpg
동서식품 카누 미떼 핫초코 오리지날 미니입,핫초코/스틱형,C:\dev\ZeroMoa\ZeroMoa\crawl_data\images\핫초코_코코아\동서식품 카누 미떼 핫초코 오리지날 미니입.jpg
네슬레 Nestle 리치 밀크 초콜릿 코코아 믹스,핫초코,C:\dev\ZeroMoa\ZeroMoa\crawl_data\images\핫초코_코코아\네슬레 Nestle 리치 밀크 초콜릿 코코아 믹스.jpg
오뚜기 오쉐프 코코아차,핫초코/분말/파우치형,C:\dev\ZeroMoa\ZeroMoa\crawl_data\images\핫초코_코코아\오뚜기 오쉐프 코코아차.jpg
네슬레 핫초코,핫초코/분말/파우치형,C:\dev\ZeroMoa\ZeroMoa\crawl_data\images\핫초코_코코아\네슬레 핫초코.jpg
동서식품 제티 딸기맛,핫초코/분말/스틱형/총량: 20T/1T당: 17g,C:\dev\ZeroMoa\ZeroMoa\crawl_data\images\핫초코_코코아\동서식품 제티 딸기맛.jpg
동서식품 미떼 핫초코 마일드,핫초코/분말/스틱형/총량: 20T/1T당: 30g,C:\dev\ZeroMoa\ZeroMoa\crawl_data\images\핫초코_코코아\동서식품 미떼 핫초코 마일드.jpg
카파아이엔티 포모나 코코렛 파우더,핫초코/분말/파우치형,C:\dev\ZeroMoa\ZeroMoa\crawl_data\images\핫초코_코코아\카파아이엔티 포모나 코코렛 파우더.jpg
카일스 초콜릿 파우더,핫초코/분말/파우치형,C:\dev\ZeroMoa\ZeroMoa\crawl_data\images\핫초코_코코아\카일스 초콜릿 파우더.jpg
담터 포켓몬 핫초코 팽도리의 무가당 오리지널,핫초코/분말/스틱형/총량: 30T/1T당: 20g,C:\dev\ZeroMoa\ZeroMoa\crawl_data\images\핫초코_코코아\담터 포켓몬 핫초코 팽도리의 무가당 오리지널.jpg
카페베네 마노 핫초코라떼,핫초코/분말/스틱형/총량: 60T/1T당: 20g,C:\dev\ZeroMoa\ZeroMoa\crawl_data\images\핫초코_코코아\카페베네 마노 핫초코라떼.jpg
대호식품 프리미엄 코코아차,핫초코/분말/파우치형,C:\dev\ZeroMoa\ZeroMoa\crawl_data\images\핫초코_코코아\대호식품 프리미엄 코코아차.jpg
기라델리 프리미엄 핫 코코아,핫초코/분말/파우치형,C:\dev\ZeroMoa\ZeroMoa\crawl_data\images\핫초코_코코아\기라델리 프리미엄 핫 코코아.jpg
동서식품 제티 쿠키앤초코,핫초코/분말/스틱형/총량: 20T/1T당: 17g,C:\dev\ZeroMoa\ZeroMoa\crawl_data\images\핫초코_코코아\동서식품 제티 쿠키앤초코.jpg
이든타운에프앤비 코코아 파우더,핫초코/분말/파우치형,C:\dev\ZeroMoa\ZeroMoa\crawl_data\images\핫초코_코코아\이든타운에프앤비 코코아 파우더.jpg
네슬레 네스퀵 초콜릿맛 리필,핫초코/분말/파우치형,C:\dev\ZeroMoa\ZeroMoa\crawl_data\images\핫초코_코코아\네슬레 네스퀵 초콜릿맛 리필.jpg
유안종합식품 코코아차,핫초코/분말/파우치형,C:\dev\ZeroMoa\ZeroMoa\crawl_data\images\핫초코_코코아\유안종합식품 코코아차.jpg
신광식품 베오베 초코,핫초코/분말/파우치형,C:\dev\ZeroMoa\ZeroMoa\crawl_data\images\핫초코_코코아\신광식품 베오베 초코.jpg
이마트 노브랜드 오리지널 핫초코,핫초코/분말/스틱형/총량: 200T/1T당: 20g,C:\dev\ZeroMoa\ZeroMoa\crawl_data\images\핫초코_코코아\이마트 노브랜드 오리지널 핫초코.jpg
이디야 비니스트 초콜릿 칩 라떼,핫초코/분말/스틱형/총량: 30T,C:\dev\ZeroMoa\ZeroMoa\crawl_data\images\핫초코_코코아\이디야 비니스트 초콜릿 칩 라떼.jpg
동서식품 제티 초콕 딸기맛,핫초코/분말/스틱형/총량: 30T/1T당: 3.6g,C:\dev\ZeroMoa\ZeroMoa\crawl_data\images\핫초코_코코아\동서식품 제티 초콕 딸기맛.jpg
희창유업 코코아차,핫초코/분말/파우치형,C:\dev\ZeroMoa\ZeroMoa\crawl_data\images\핫초코_코코아\희창유업 코코아차.jpg
대호식품 프레쉬 핫초코,핫초코/분말/파우치형,C:\dev\ZeroMoa\ZeroMoa\crawl_data\images\핫초코_코코아\대호식품 프레쉬 핫초코.jpg
허쉬 머쉬멜로 핫초코,핫초코/분말/스틱형/총량: 8T/1T당: 30g,C:\dev\ZeroMoa\ZeroMoa\crawl_data\images\핫초코_코코아\허쉬 머쉬멜로 핫초코.jpg
4447 더치코코아파우더,핫초코/분말/파우치형,C:\dev\ZeroMoa\ZeroMoa\crawl_data\images\핫초코_코코아\4447 더치코코아파우더.jpg
동서식품 제티 바나나맛,핫초코/분말/스틱형/총량: 20T/1T당: 17g,C:\dev\ZeroMoa\ZeroMoa\crawl_data\images\핫초코_코코아\동서식품 제티 바나나맛.jpg
담터 포켓몬 핫초코 피카츄의 오리지널,핫초코/분말/스틱형/총량: 30T/1T당: 20g,C:\dev\ZeroMoa\ZeroMoa\crawl_data\images\핫초코_코코아\담터 포켓몬 핫초코 피카츄의 오리지널.jpg
타코 카페 초콜릿,핫초코/분말/파우치형,C:\dev\ZeroMoa\ZeroMoa\crawl_data\images\핫초코_코코아\타코 카페 초콜릿.jpg
쟈뎅 까페모리 홈스타일 핫초코,핫초코/분말/스틱형/총량: 100T/1T당: 19g,C:\dev\ZeroMoa\ZeroMoa\crawl_data\images\핫초코_코코아\쟈뎅 까페모리 홈스타일 핫초코.jpg
타코 카페 다크초콜릿,핫초코/분말/파우치형,C:\dev\ZeroMoa\ZeroMoa\crawl_data\images\핫초코_코코아\타코 카페 다크초콜릿.jpg
네슬레 핫쵸코 오리지날,핫초코/분말/스틱형,C:\dev\ZeroMoa\ZeroMoa\crawl_data\images\핫초코_코코아\네슬레 핫쵸코 오리지날.jpg
탐앤탐스 티요 코코아 오리지널입,핫초코/스틱형,C:\dev\ZeroMoa\ZeroMoa\crawl_data\images\핫초코_코코아\탐앤탐스 티요 코코아 오리지널입.jpg
동서식품 카누 미떼 핫초코 오리지날입,핫초코/스틱형,C:\dev\ZeroMoa\ZeroMoa\crawl_data\images\핫초코_코코아\동서식품 카누 미떼 핫초코 오리지날입.jpg
바이오믹스테크 핫초코 한잔에 당분이 단,핫초코/분말/스틱형/총량: 10T/1T당: 15g,C:\dev\ZeroMoa\ZeroMoa\crawl_data\images\핫초코_코코아\바이오믹스테크 핫초코 한잔에 당분이 단.jpg
담터 포켓몬 핫초코 이브이의 바나나,핫초코/분말/스틱형/총량: 60T/1T당: 20g,C:\dev\ZeroMoa\ZeroMoa\crawl_data\images\핫초코_코코아\담터 포켓몬 핫초코 이브이의 바나나.jpg
복음자리 초콜릿 파우더,핫초코/분말/파우치형,C:\dev\ZeroMoa\ZeroMoa\crawl_data\images\핫초코_코코아\복음자리 초콜릿 파우더.jpg
삼양사 큐원 코코아 파우더,핫초코/분말/파우치형,C:\dev\ZeroMoa\ZeroMoa\crawl_data\images\핫초코_코코아\삼양사 큐원 코코아 파우더.jpg
바리칼리바우트 코코아파우더 엑스트라 브뤼트,핫초코/분말/파우치형,C:\dev\ZeroMoa\ZeroMoa\crawl_data\images\핫초코_코코아\바리칼리바우트 코코아파우더 엑스트라 브뤼트.jpg
동서식품 미떼 핫초코 오리지날 마시멜로팩 하프물범,핫초코/분말/스틱형/총량: 20T,C:\dev\ZeroMoa\ZeroMoa\crawl_data\images\핫초코_코코아\동서식품 미떼 핫초코 오리지날 마시멜로팩 하프물범.jpg
달콤퐁당 초코 파우더,핫초코/분말/파우치형,C:\dev\ZeroMoa\ZeroMoa\crawl_data\images\핫초코_코코아\달콤퐁당 초코 파우더.jpg
카페드롭탑 925 초콜릿 라떼,핫초코/분말/스틱형/총량: 10T/1T당: 20g,C:\dev\ZeroMoa\ZeroMoa\crawl_data\images\핫초코_코코아\카페드롭탑 925 초콜릿 라떼.jpg
희창유업 달콤한 핫초코,핫초코/분말/스틱형/총량: 60T/1T당: 20g,C:\dev\ZeroMoa\ZeroMoa\crawl_data\images\핫초코_코코아\희창유업 달콤한 핫초코.jpg
쟈뎅 시그니처 아메리카노 블랙,핫초코,C:\dev\ZeroMoa\ZeroMoa\crawl_data\images\핫초코_코코아\쟈뎅 시그니처 아메리카노 블랙.jpg
동서식품 미떼 화이트 초코,핫초코/분말/스틱형/총량: 10T/1T당: 30g,C:\dev\ZeroMoa\ZeroMoa\crawl_data\images\핫초코_코코아\동서식품 미떼 화이트 초코.jpg
스위트컵 초코라떼 파우더,핫초코/분말/파우치형,C:\dev\ZeroMoa\ZeroMoa\crawl_data\images\핫초코_코코아\스위트컵 초코라떼 파우더.jpg
유안 유안 코코아자판기용,핫초코/리필형,C:\dev\ZeroMoa\ZeroMoa\crawl_data\images\핫초코_코코아\유안 유안 코코아자판기용.jpg
타코 그린티 민트 초코칩,핫초코/분말/파우치형,C:\dev\ZeroMoa\ZeroMoa\crawl_data\images\핫초코_코코아\타코 그린티 민트 초코칩.jpg
중앙 코코아차,핫초코/분말/파우치형,C:\dev\ZeroMoa\ZeroMoa\crawl_data\images\핫초코_코코아\중앙 코코아차.jpg
투썸플레이스 투썸 초콜릿 라떼,핫초코/분말/스틱형/총량: 40T/1T당: 32g,C:\dev\ZeroMoa\ZeroMoa\crawl_data\images\핫초코_코코아\투썸플레이스 투썸 초콜릿 라떼.jpg
남양유업 초코에몽,핫초코/분말/스틱형/총량: 40T/1T당: 30g,C:\dev\ZeroMoa\ZeroMoa\crawl_data\images\핫초코_코코아\남양유업 초코에몽.jpg
카파아이엔티 포모나 화이트 코코렛 파우더,핫초코/분말/파우치형,C:\dev\ZeroMoa\ZeroMoa\crawl_data\images\핫초코_코코아\카파아이엔티 포모나 화이트 코코렛 파우더.jpg
허쉬 코코아 분말,핫초코/용기형,C:\dev\ZeroMoa\ZeroMoa\crawl_data\images\핫초코_코코아\허쉬 코코아 분말.jpg
위타드 라즈베리맛 코코아 핫초코,핫초코/분말/용기형,C:\dev\ZeroMoa\ZeroMoa\crawl_data\images\핫초코_코코아\위타드 라즈베리맛 코코아 핫초코.jpg
허쉬 머쉬멜로 핫초코입,핫초코/스틱형,C:\dev\ZeroMoa\ZeroMoa\crawl_data\images\핫초코_코코아\허쉬 머쉬멜로 핫초코입.jpg
쟈뎅 까페모리 핫초코,핫초코/분말/스틱형/총량: 36T/1T당: 32g,C:\dev\ZeroMoa\ZeroMoa\crawl_data\images\핫초코_코코아\쟈뎅 까페모리 핫초코.jpg
오뚜기 힐링타임 핫쵸코,핫초코/분말/스틱형/총량: 10T/1T당: 20g,C:\dev\ZeroMoa\ZeroMoa\crawl_data\images\핫초코_코코아\오뚜기 힐링타임 핫쵸코.jpg
무화당 에리스리톨 저당 핫초코입,핫초코/분말/스틱형,C:\dev\ZeroMoa\ZeroMoa\crawl_data\images\핫초코_코코아\무화당 에리스리톨 저당 핫초코입.jpg
이마트 피코크 마몰로 리치핫초코,핫초코/분말/스틱형/총량: 10T/1T당: 30g,C:\dev\ZeroMoa\ZeroMoa\crawl_data\images\핫초코_코코아\이마트 피코크 마몰로 리치핫초코.jpg
제이큐 핫초코 코코아 자판기용 X 초코 핫쵸코12,핫초코,C:\dev\ZeroMoa\ZeroMoa\crawl_data\images\핫초코_코코아\제이큐 핫초코 코코아 자판기용 X 초코 핫쵸코12.jpg
이마트 피코크 마몰로 베이킹코코아,핫초코/분말/용기형/1회 제공량 100g당 열량: 405kcal/나트륨: 19mg/탄수화물: 48g/당류: 1g/지방: 13.4g/트랜스지방: 0g/포화지방: 3g/콜레스테롤: 1mg/단백질: 23g,C:\dev\ZeroMoa\ZeroMoa\crawl_data\images\핫초코_코코아\이마트 피코크 마몰로 베이킹코코아.jpg
동서식품 카누 핫초코 오리지날,핫초코/분말/파우치형,C:\dev\ZeroMoa\ZeroMoa\crawl_data\images\핫초코_코코아\동서식품 카누 핫초코 오리지날.jpg
큐팜스 초코 파우더,핫초코,C:\dev\ZeroMoa\ZeroMoa\crawl_data\images\핫초코_코코아\큐팜스 초코 파우더.jpg
네슬레 리치밀크 핫코코아 믹스,핫초코/분말/용기형,C:\dev\ZeroMoa\ZeroMoa\crawl_data\images\핫초코_코코아\네슬레 리치밀크 핫코코아 믹스.jpg
베오베 초코민트 파우더,핫초코/분말,C:\dev\ZeroMoa\ZeroMoa\crawl_data\images\핫초코_코코아\베오베 초코민트 파우더.jpg
모카씨엔티 핫쵸코,핫초코/분말/파우치형,C:\dev\ZeroMoa\ZeroMoa\crawl_data\images\핫초코_코코아\모카씨엔티 핫쵸코.jpg
위타드 럭셔리 화이트 핫초코,핫초코/분말/용기형,C:\dev\ZeroMoa\ZeroMoa\crawl_data\images\핫초코_코코아\위타드 럭셔리 화이트 핫초코.jpg
담터 자판기용 코코아덕용,핫초코,C:\dev\ZeroMoa\ZeroMoa\crawl_data\images\핫초코_코코아\담터 자판기용 코코아덕용.jpg
허쉬 오리지널 핫초코 원컵,핫초코/스틱형,C:\dev\ZeroMoa\ZeroMoa\crawl_data\images\핫초코_코코아\허쉬 오리지널 핫초코 원컵.jpg
까로망 모카 초콜렛 파우더,핫초코/분말/파우치형,C:\dev\ZeroMoa\ZeroMoa\crawl_data\images\핫초코_코코아\까로망 모카 초콜렛 파우더.jpg
카파아이엔티 포모나 민트 코코렛 파우더,핫초코/분말/파우치형,C:\dev\ZeroMoa\ZeroMoa\crawl_data\images\핫초코_코코아\카파아이엔티 포모나 민트 코코렛 파우더.jpg
씨앤비에프 씨앤비에프 코코아/자판기용,핫초코/리필형,C:\dev\ZeroMoa\ZeroMoa\crawl_data\images\핫초코_코코아\씨앤비에프 씨앤비에프 코코아_자판기용.jpg
씨앤비에프 다이랑 씨앤비에프/핫초코 자판기용 국산차,핫초코/리필형,C:\dev\ZeroMoa\ZeroMoa\crawl_data\images\핫초코_코코아\씨앤비에프 다이랑 씨앤비에프_핫초코 자판기용 국산차.jpg
스위스미스 밀크 초콜릿 핫 코코아 믹스,핫초코/분말/용기형,C:\dev\ZeroMoa\ZeroMoa\crawl_data\images\핫초코_코코아\스위스미스 밀크 초콜릿 핫 코코아 믹스.jpg
카카오바리 초콜릿 파우더,핫초코/분말/파우치형,C:\dev\ZeroMoa\ZeroMoa\crawl_data\images\핫초코_코코아\카카오바리 초콜릿 파우더.jpg
동서식품 핫쵸코,핫초코/분말/파우치형,C:\dev\ZeroMoa\ZeroMoa\crawl_data\images\핫초코_코코아\동서식품 핫쵸코.jpg
오뚜기 핫쵸코입,핫초코/스틱형,C:\dev\ZeroMoa\ZeroMoa\crawl_data\images\핫초코_코코아\오뚜기 핫쵸코입.jpg
발로나 코코아 파우더,핫초코,C:\dev\ZeroMoa\ZeroMoa\crawl_data\images\핫초코_코코아\발로나 코코아 파우더.jpg
스위스미스 핫 코코아 믹스 다크 초콜릿,핫초코/분말/스틱형/총량: 32T/1T당: 35g,C:\dev\ZeroMoa\ZeroMoa\crawl_data\images\핫초코_코코아\스위스미스 핫 코코아 믹스 다크 초콜릿.jpg
다농원 오리지널 핫초코,핫초코/분말/스틱형/총량: 50T/1T당: 20g,C:\dev\ZeroMoa\ZeroMoa\crawl_data\images\핫초코_코코아\다농원 오리지널 핫초코.jpg
까로망 민트 초코칩 파우더,핫초코/분말/파우치형,C:\dev\ZeroMoa\ZeroMoa\crawl_data\images\핫초코_코코아\까로망 민트 초코칩 파우더.jpg
고디바 핫코코아 다크초콜렛,핫초코/분말/용기형,C:\dev\ZeroMoa\ZeroMoa\crawl_data\images\핫초코_코코아\고디바 핫코코아 다크초콜렛.jpg
동서식품 카누 초콕 딸기맛,핫초코/스틱형,C:\dev\ZeroMoa\ZeroMoa\crawl_data\images\핫초코_코코아\동서식품 카누 초콕 딸기맛.jpg
허쉬 머쉬멜로 핫초코 원컵,핫초코/스틱형,C:\dev\ZeroMoa\ZeroMoa\crawl_data\images\핫초코_코코아\허쉬 머쉬멜로 핫초코 원컵.jpg
다농원 민트초코,"핫초코/분말/스틱형/총량: 20T/중량: 20g/원재료: 백설탕, 식물성크림, 코코아파우더",C:\dev\ZeroMoa\ZeroMoa\crawl_data\images\핫초코_코코아\다농원 민트초코.jpg
스위트컵 민트초코 파우더,핫초코/분말/파우치형,C:\dev\ZeroMoa\ZeroMoa\crawl_data\images\핫초코_코코아\스위트컵 민트초코 파우더.jpg
위카페 핫초코 프리미엄,핫초코/분말/파우치형,C:\dev\ZeroMoa\ZeroMoa\crawl_data\images\핫초코_코코아\위카페 핫초코 프리미엄.jpg
쥬피터 초코 파우더,핫초코/분말/파우치형,C:\dev\ZeroMoa\ZeroMoa\crawl_data\images\핫초코_코코아\쥬피터 초코 파우더.jpg
담터 핫초코 팽도리의 무가당 오리지널입,핫초코/스틱형,C:\dev\ZeroMoa\ZeroMoa\crawl_data\images\핫초코_코코아\담터 핫초코 팽도리의 무가당 오리지널입.jpg
가보트레이딩 에퀵 공정무역 유기농 저지방 코코아,핫초코/분말/용기형,C:\dev\ZeroMoa\ZeroMoa\crawl_data\images\핫초코_코코아\가보트레이딩 에퀵 공정무역 유기농 저지방 코코아.jpg
동서식품 리치스 초콜릿 믹스,핫초코/분말/용기형,C:\dev\ZeroMoa\ZeroMoa\crawl_data\images\핫초코_코코아\동서식품 리치스 초콜릿 믹스.jpg
아레스 아레스 그린티 민트초코칩 파우더,핫초코/분말/파우치형,C:\dev\ZeroMoa\ZeroMoa\crawl_data\images\핫초코_코코아\아레스 아레스 그린티 민트초코칩 파우더.jpg
담터 핫초코 피카츄의 오리지널입,핫초코/스틱형,C:\dev\ZeroMoa\ZeroMoa\crawl_data\images\핫초코_코코아\담터 핫초코 피카츄의 오리지널입.jpg
위드고 핫초코 파우더,핫초코/분말/파우치형,C:\dev\ZeroMoa\ZeroMoa\crawl_data\images\핫초코_코코아\위드고 핫초코 파우더.jpg
스위트컵 자바칩 파우더,핫초코/분말/파우치형,C:\dev\ZeroMoa\ZeroMoa\crawl_data\images\핫초코_코코아\스위트컵 자바칩 파우더.jpg
할리스커피 리얼 벨지안 초코 라떼입,핫초코/스틱형,C:\dev\ZeroMoa\ZeroMoa\crawl_data\images\핫초코_코코아\할리스커피 리얼 벨지안 초코 라떼입.jpg
에스앤에이치 큐팜스 초코 파우더,핫초코/분말/파우치형,C:\dev\ZeroMoa\ZeroMoa\crawl_data\images\핫초코_코코아\에스앤에이치 큐팜스 초코 파우더.jpg
기라델리 스위트 그라운드 초코앤코코아,핫초코/분말/용기형,C:\dev\ZeroMoa\ZeroMoa\crawl_data\images\핫초코_코코아\기라델리 스위트 그라운드 초코앤코코아.jpg
동서식품 카누 핫초코 동서코코아 분말 자판기용 식당 업소,핫초코/리필형,C:\dev\ZeroMoa\ZeroMoa\crawl_data\images\핫초코_코코아\동서식품 카누 핫초코 동서코코아 분말 자판기용 식당 업소.jpg
허쉬 오리지널 핫초코 용기형,핫초코/용기형,C:\dev\ZeroMoa\ZeroMoa\crawl_data\images\핫초코_코코아\허쉬 오리지널 핫초코 용기형.jpg
모리나가 퓨어 코코아,핫초코/분말/파우치형,C:\dev\ZeroMoa\ZeroMoa\crawl_data\images\핫초코_코코아\모리나가 퓨어 코코아.jpg
허쉬 오리지널 핫초코입,핫초코/스틱형,C:\dev\ZeroMoa\ZeroMoa\crawl_data\images\핫초코_코코아\허쉬 오리지널 핫초코입.jpg
동서식품 카누 화이트 초코,핫초코/스틱형,C:\dev\ZeroMoa\ZeroMoa\crawl_data\images\핫초코_코코아\동서식품 카누 화이트 초코.jpg
스위스미스 핫 코코아 믹스 헤이즐넛 초콜릿,핫초코/분말/스틱형/총량: 8T/1T당: 26g,C:\dev\ZeroMoa\ZeroMoa\crawl_data\images\핫초코_코코아\스위스미스 핫 코코아 믹스 헤이즐넛 초콜릿.jpg
해시즈 제로당 설탕무첨가 민트향 초코,핫초코/분말/스틱형/총량: 10T/1T당: 20g,C:\dev\ZeroMoa\ZeroMoa\crawl_data\images\핫초코_코코아\해시즈 제로당 설탕무첨가 민트향 초코.jpg
해시즈 제로당 설탕무첨가 핫초코,핫초코/분말/스틱형/총량: 10T/1T당: 20g,C:\dev\ZeroMoa\ZeroMoa\crawl_data\images\핫초코_코코아\해시즈 제로당 설탕무첨가 핫초코.jpg
스타벅스 핫 코코아 클래식,핫초코/분말/용기형,C:\dev\ZeroMoa\ZeroMoa\crawl_data\images\핫초코_코코아\스타벅스 핫 코코아 클래식.jpg
기라델리 다크 그라운드 초코앤코코아,핫초코/분말/용기형,C:\dev\ZeroMoa\ZeroMoa\crawl_data\images\핫초코_코코아\기라델리 다크 그라운드 초코앤코코아.jpg
옵션스 벨기에 핫 초콜릿 솔티드 카라멜,핫초코/분말/용기형,C:\dev\ZeroMoa\ZeroMoa\crawl_data\images\핫초코_코코아\옵션스 벨기에 핫 초콜릿 솔티드 카라멜.jpg
옵션스 벨기에 핫 초콜릿 민트,핫초코/분말/용기형,C:\dev\ZeroMoa\ZeroMoa\crawl_data\images\핫초코_코코아\옵션스 벨기에 핫 초콜릿 민트.jpg
허쉬 스페셜 다크 핫초코,핫초코/분말/용기형,C:\dev\ZeroMoa\ZeroMoa\crawl_data\images\핫초코_코코아\허쉬 스페셜 다크 핫초코.jpg
건강스토리 코코아 분말,핫초코/분말/용기형,C:\dev\ZeroMoa\ZeroMoa\crawl_data\images\핫초코_코코아\건강스토리 코코아 분말.jpg
위타드 화이트 딸기맛 핫초코,핫초코/분말/용기형,C:\dev\ZeroMoa\ZeroMoa\crawl_data\images\핫초코_코코아\위타드 화이트 딸기맛 핫초코.jpg
초원한방플러스 코코아 분말,핫초코/분말/파우치형,C:\dev\ZeroMoa\ZeroMoa\crawl_data\images\핫초코_코코아\초원한방플러스 코코아 분말.jpg
카일스 프리미엄 초콜릿 파우더,핫초코/분말/파우치형,C:\dev\ZeroMoa\ZeroMoa\crawl_data\images\핫초코_코코아\카일스 프리미엄 초콜릿 파우더.jpg
호주네슬레 인터내셔널로스트입,핫초코,C:\dev\ZeroMoa\ZeroMoa\crawl_data\images\핫초코_코코아\호주네슬레 인터내셔널로스트입.jpg
유니레버 립톤 말차밀크티입,핫초코,C:\dev\ZeroMoa\ZeroMoa\crawl_data\images\핫초코_코코아\유니레버 립톤 말차밀크티입.jpg
네슬레 네스퀵 네스퀵 네스퀵 초코파우치,핫초코,C:\dev\ZeroMoa\ZeroMoa\crawl_data\images\핫초코_코코아\네슬레 네스퀵 네스퀵 네스퀵 초코파우치.jpg
복음자리 자바칩 파우더세트,핫초코,C:\dev\ZeroMoa\ZeroMoa\crawl_data\images\핫초코_코코아\복음자리 자바칩 파우더세트.jpg
동서식품 카누 동서 제티 바나나,핫초코/스틱형,C:\dev\ZeroMoa\ZeroMoa\crawl_data\images\핫초코_코코아\동서식품 카누 동서 제티 바나나.jpg
네슬레 네슬레 네스퀵 초코GB,핫초코,C:\dev\ZeroMoa\ZeroMoa\crawl_data\images\핫초코_코코아\네슬레 네슬레 네스퀵 초코GB.jpg
크래프트하인즈 크리스탈라이트 온더고 핑크레몬에이드 분말입,핫초코,C:\dev\ZeroMoa\ZeroMoa\crawl_data\images\핫초코_코코아\크래프트하인즈 크리스탈라이트 온더고 핑크레몬에이드 분말입.jpg
스위스미스 핫코코아 믹스 마시멜로,핫초코,C:\dev\ZeroMoa\ZeroMoa\crawl_data\images\핫초코_코코아\스위스미스 핫코코아 믹스 마시멜로.jpg
타코 녹차 팝 라떼,핫초코,C:\dev\ZeroMoa\ZeroMoa\crawl_data\images\핫초코_코코아\타코 녹차 팝 라떼.jpg
희창유업 임시제조사 핫초코a,핫초코,C:\dev\ZeroMoa\ZeroMoa\crawl_data\images\핫초코_코코아\희창유업 임시제조사 핫초코a.jpg
희창 핫초코,핫초코,C:\dev\ZeroMoa\ZeroMoa\crawl_data\images\핫초코_코코아\희창 핫초코.jpg
아임요 아임요 바닐라 믹스프라페 라떼 핫초코,핫초코,C:\dev\ZeroMoa\ZeroMoa\crawl_data\images\핫초코_코코아\아임요 아임요 바닐라 믹스프라페 라떼 핫초코.jpg
타코 흑임자 파우더 라떼분말,핫초코,C:\dev\ZeroMoa\ZeroMoa\crawl_data\images\핫초코_코코아\타코 흑임자 파우더 라떼분말.jpg
메가MGC커피 네슬레 네스퀵 초콜렛파우더세트초콜릿 초코,핫초코,C:\dev\ZeroMoa\ZeroMoa\crawl_data\images\핫초코_코코아\메가MGC커피 네슬레 네스퀵 초콜렛파우더세트초콜릿 초코.jpg
