Name,Spec,ImageURL
네슬레 네스프레소 스타벅스 이탈리안 스타일 로스트 캡슐커피,캡슐커피/사용머신: 네스프레소/총량: 80개/캡슐 중량: 5.6g,C:\dev\ZeroMoa\ZeroMoa\crawl_data\images\캡슐커피\네슬레 네스프레소 스타벅스 이탈리안 스타일 로스트 캡슐커피.jpg
네슬레 네스카페 돌체구스토 카푸치노 16개입,"캡슐커피/맛: 카푸치노/사용머신: 돌체구스토/총량: 16개입/중량: 커피 8g, 밀크 17g",C:\dev\ZeroMoa\ZeroMoa\crawl_data\images\캡슐커피\네슬레 네스카페 돌체구스토 카푸치노 16개입.jpg
네슬레 네스프레소 이스피라치오네 로마 캡슐커피,캡슐커피/맛: 에스프레소/캡슐 총량: 50개/네스프레소,C:\dev\ZeroMoa\ZeroMoa\crawl_data\images\캡슐커피\네슬레 네스프레소 이스피라치오네 로마 캡슐커피.jpg
킴보 에스프레소 캡슐커피,원두커피/캡슐커피/맛: 에스프레소/사용머신: 네스프레소/총량: 100개/캡슐 중량: 7g,C:\dev\ZeroMoa\ZeroMoa\crawl_data\images\캡슐커피\킴보 에스프레소 캡슐커피.jpg
한국맥널티 맥널티 캡슐 커피 콜롬비아 안데스 수프리모 8개입,캡슐커피/맛: 에스프레소/사용머신: 네스프레소/총량: 8개입/중량: 5g,C:\dev\ZeroMoa\ZeroMoa\crawl_data\images\캡슐커피\한국맥널티 맥널티 캡슐 커피 콜롬비아 안데스 수프리모 8개입.jpg
동서식품 맥심 카누 싱글 오리진 에티오피아 예가체프 바리스타 전용캡슐,캡슐커피,C:\dev\ZeroMoa\ZeroMoa\crawl_data\images\캡슐커피\동서식품 맥심 카누 싱글 오리진 에티오피아 예가체프 바리스타 전용캡슐.jpg
스타벅스 하우스블렌드 by 네스카페 돌체구스토 캡슐커피 8.5g 12개입 3개,캡슐커피,C:\dev\ZeroMoa\ZeroMoa\crawl_data\images\캡슐커피\스타벅스 하우스블렌드 by 네스카페 돌체구스토 캡슐커피 8.5g 12개입 3개.jpg
네슬레 네스프레소 버츄오 캡슐 샘플러 S. 한정판 2번,캡슐커피/사용머신: 네스프레소,C:\dev\ZeroMoa\ZeroMoa\crawl_data\images\캡슐커피\네슬레 네스프레소 버츄오 캡슐 샘플러 S. 한정판 2번.jpg
스타벅스 네스프레소 파이크 플레이스 로스트 룽고 캡슐커피 53g 10개입 10개,캡슐커피,C:\dev\ZeroMoa\ZeroMoa\crawl_data\images\캡슐커피\스타벅스 네스프레소 파이크 플레이스 로스트 룽고 캡슐커피 53g 10개입 10개.jpg
가리발디 네스프레소 호환 by 이태리캡슐 버라이어티 10팩 100알 +2팩 20알,캡슐커피,
할리스커피 캡슐커피 프리미엄 블렌드 10개입,캡슐커피/맛: 에스프레소/사용머신: 네스프레소/총량: 10개입/중량: 5.3g,C:\dev\ZeroMoa\ZeroMoa\crawl_data\images\캡슐커피\할리스커피 캡슐커피 프리미엄 블렌드 10개입.jpg
할리스커피 캡슐커피 시그니처 블렌드 10개입,캡슐커피/맛: 에스프레소/사용머신: 네스프레소/총량: 10개입,C:\dev\ZeroMoa\ZeroMoa\crawl_data\images\캡슐커피\할리스커피 캡슐커피 시그니처 블렌드 10개입.jpg
셀리니 브리오소 캡슐,캡슐커피/캡슐 총량: 100개,C:\dev\ZeroMoa\ZeroMoa\crawl_data\images\캡슐커피\셀리니 브리오소 캡슐.jpg
셀리니 크레모소 캡슐,캡슐커피/맛: 에스프레소/캡슐 총량: 100개,C:\dev\ZeroMoa\ZeroMoa\crawl_data\images\캡슐커피\셀리니 크레모소 캡슐.jpg
라바짜 에스프레소 아르모니코 캡슐커피,캡슐커피/맛: 에스프레소/사용머신: 네스프레소/총량: 60개,C:\dev\ZeroMoa\ZeroMoa\crawl_data\images\캡슐커피\라바짜 에스프레소 아르모니코 캡슐커피.jpg
보난자 디카페인 캡슐커피,"캡슐커피/맛: 에스프레소, 디카페인/사용머신: 네스프레소/총량: ~10개입/캡슐 중량: 5.5g",C:\dev\ZeroMoa\ZeroMoa\crawl_data\images\캡슐커피\보난자 디카페인 캡슐커피.jpg
보난자 에티오피아 캡슐커피,캡슐커피/맛: 에스프레소/사용머신: 네스프레소/총량: ~10개입/캡슐 중량: 5.5g,C:\dev\ZeroMoa\ZeroMoa\crawl_data\images\캡슐커피\보난자 에티오피아 캡슐커피.jpg
웨이브온커피 브라질 캡슐 커피 10개입,"캡슐커피/맛: 에스프레소/사용머신: 네스프레소/총량: 10개입/
[맛집] 웨이브온커피/중량: 5.2g",C:\dev\ZeroMoa\ZeroMoa\crawl_data\images\캡슐커피\웨이브온커피 브라질 캡슐 커피 10개입.jpg
셀리니 인텐소 10개입,캡슐커피/맛: 에스프레소/사용머신: 네스프레소/총량: 10개입/중량: 5g,C:\dev\ZeroMoa\ZeroMoa\crawl_data\images\캡슐커피\셀리니 인텐소 10개입.jpg
투썸플레이스 에이리스트 캡슐커피 과테말라 안티구아 10개입,캡슐커피/맛: 에스프레소/사용머신: 네스프레소/총량: 10개입/중량: 5.3g,C:\dev\ZeroMoa\ZeroMoa\crawl_data\images\캡슐커피\투썸플레이스 에이리스트 캡슐커피 과테말라 안티구아 10개입.jpg
투썸플레이스 투썸 에이리스트 스틱커피 다크블렌드 150P+쇼핑백,캡슐커피,
라바짜 네스프레소 호환 캡슐커피 퀄티나 로사 50P 10P 5,캡슐커피,C:\dev\ZeroMoa\ZeroMoa\crawl_data\images\캡슐커피\라바짜 네스프레소 호환 캡슐커피 퀄티나 로사 50P 10P 5.jpg
동서식품 맥심 카누 바리스타 머신 전용 캡슐커피 와일드워터폴 9.5g 10개입 4개,캡슐커피,C:\dev\ZeroMoa\ZeroMoa\crawl_data\images\캡슐커피\동서식품 맥심 카누 바리스타 머신 전용 캡슐커피 와일드워터폴 9.5g 10개입 4개.jpg
네슬레 네스프레소 오리지널 헤이즐넛향 캡슐커피 10개입 110ml,캡슐커피,C:\dev\ZeroMoa\ZeroMoa\crawl_data\images\캡슐커피\네슬레 네스프레소 오리지널 헤이즐넛향 캡슐커피 10개입 110ml.jpg
터모제타 이탈리코 캡슐커피 롱캡 10박스,캡슐커피/사용머신: 일리,C:\dev\ZeroMoa\ZeroMoa\crawl_data\images\캡슐커피\터모제타 이탈리코 캡슐커피 롱캡 10박스.jpg
일리 인텐소 룽고 캡슐커피 네스프레소호환 10개입,캡슐커피/사용머신: 네스프레소,C:\dev\ZeroMoa\ZeroMoa\crawl_data\images\캡슐커피\일리 인텐소 룽고 캡슐커피 네스프레소호환 10개입.jpg
어라운지 데일리 드립백 커피 에티오피아12p 10g + 마일드12p 10g 세트 240g 1세트,캡슐커피,
킴보 인텐소 16개입,캡슐커피/맛: 에스프레소/사용머신: 돌체구스토/총량: 16개입/중량: 7g,C:\dev\ZeroMoa\ZeroMoa\crawl_data\images\캡슐커피\킴보 인텐소 16개입.jpg
네슬레 블론드 에스프레소 12개입,인스턴트커피/캡슐커피,C:\dev\ZeroMoa\ZeroMoa\crawl_data\images\캡슐커피\네슬레 블론드 에스프레소 12개입.jpg
스타벅스 하우스블렌드 by 네스카페 돌체구스토 캡슐커피 8.5g 12개입 6개,캡슐커피,C:\dev\ZeroMoa\ZeroMoa\crawl_data\images\캡슐커피\스타벅스 하우스블렌드 by 네스카페 돌체구스토 캡슐커피 8.5g 12개입 6개.jpg
네슬레 네스프레소 리니지오 룽고 캡슐커피,캡슐커피/맛: 에스프레소/캡슐 총량: 50개/네스프레소,C:\dev\ZeroMoa\ZeroMoa\crawl_data\images\캡슐커피\네슬레 네스프레소 리니지오 룽고 캡슐커피.jpg
까라로 푸로 아라비카 캡슐커피,캡슐커피/맛: 에스프레소/사용머신: 돌체구스토/캡슐 총량: 16개/돌체구스토,C:\dev\ZeroMoa\ZeroMoa\crawl_data\images\캡슐커피\까라로 푸로 아라비카 캡슐커피.jpg
동서식품 맥심 카누 카누 볼드 다크 로스트 캡슐커피(네스프레소 호환),캡슐커피/맛: 에스프레소,C:\dev\ZeroMoa\ZeroMoa\crawl_data\images\캡슐커피\동서식품 맥심 카누 카누 볼드 다크 로스트 캡슐커피(네스프레소 호환).jpg
카파아이엔티 포르테 콜롬비아 캡슐커피,캡슐커피/맛: 에스프레소/캡슐 총량: 15개,C:\dev\ZeroMoa\ZeroMoa\crawl_data\images\캡슐커피\카파아이엔티 포르테 콜롬비아 캡슐커피.jpg
네슬레 네스프레소 스타벅스 써니데이 블렌드 캡슐커피,캡슐커피/맛: 에스프레소,C:\dev\ZeroMoa\ZeroMoa\crawl_data\images\캡슐커피\네슬레 네스프레소 스타벅스 써니데이 블렌드 캡슐커피.jpg
보르보네 디카페인 캡슐커피,캡슐커피/맛: 디카페인/총량: 50개,C:\dev\ZeroMoa\ZeroMoa\crawl_data\images\캡슐커피\보르보네 디카페인 캡슐커피.jpg
던킨도너츠 네스프레소 호환 캡슐커피,캡슐커피/네스프레소 (호환),C:\dev\ZeroMoa\ZeroMoa\crawl_data\images\캡슐커피\던킨도너츠 네스프레소 호환 캡슐커피.jpg
매일유업 바리스타룰스 무라벨 디카페인 아메리카노 350ml 20개,캡슐커피,C:\dev\ZeroMoa\ZeroMoa\crawl_data\images\캡슐커피\매일유업 바리스타룰스 무라벨 디카페인 아메리카노 350ml 20개.jpg
네슬레 네스카페 돌체구스토 캡슐 컬렉션팩 모음전,캡슐커피/사용머신: 돌체구스토,C:\dev\ZeroMoa\ZeroMoa\crawl_data\images\캡슐커피\네슬레 네스카페 돌체구스토 캡슐 컬렉션팩 모음전.jpg
네슬레 네스프레소 버츄오 비앙코 레제로 10개입,캡슐커피/맛: 아메리카노/사용머신: 버츄오/총량: 10개입/바리스타 크리에이션,C:\dev\ZeroMoa\ZeroMoa\crawl_data\images\캡슐커피\네슬레 네스프레소 버츄오 비앙코 레제로 10개입.jpg
일리 클라시코 캡슐커피 21개입,캡슐커피/맛: 에스프레소/사용머신: 일리/캡슐 총량: 42개/'일리'호환,C:\dev\ZeroMoa\ZeroMoa\crawl_data\images\캡슐커피\일리 클라시코 캡슐커피 21개입.jpg
카페로얄 에스프레소 캡슐커피,캡슐커피/네스프레소 (호환),C:\dev\ZeroMoa\ZeroMoa\crawl_data\images\캡슐커피\카페로얄 에스프레소 캡슐커피.jpg
카페로얄 룽고 클래시코 캡슐커피 10개입,캡슐커피/맛: 에스프레소/네스프레소 (호환),C:\dev\ZeroMoa\ZeroMoa\crawl_data\images\캡슐커피\카페로얄 룽고 클래시코 캡슐커피 10개입.jpg
이탈리안커피 리스트레토 16개입,캡슐커피/맛: 에스프레소,C:\dev\ZeroMoa\ZeroMoa\crawl_data\images\캡슐커피\이탈리안커피 리스트레토 16개입.jpg
동서식품 맥심 카누 스모키 다크 로스트 캡슐커피(네스프레소 호환),캡슐커피/맛: 에스프레소,C:\dev\ZeroMoa\ZeroMoa\crawl_data\images\캡슐커피\동서식품 맥심 카누 스모키 다크 로스트 캡슐커피(네스프레소 호환).jpg
투썸플레이스 캡슐커피 마일드블렌드 10개입,캡슐커피,C:\dev\ZeroMoa\ZeroMoa\crawl_data\images\캡슐커피\투썸플레이스 캡슐커피 마일드블렌드 10개입.jpg
네슬레 네스프레소 이스피라치오네 리스트레토 이탈리아노 캡슐커피,캡슐커피/맛: 에스프레소/사용머신: 네스프레소/총량: ~10개입/캡슐 중량: 5.7g,C:\dev\ZeroMoa\ZeroMoa\crawl_data\images\캡슐커피\네슬레 네스프레소 이스피라치오네 리스트레토 이탈리아노 캡슐커피.jpg
벨미오 룽고 포르테 캡슐커피,캡슐커피/맛: 에스프레소/사용머신: 네스프레소/총량: ~10개입/캡슐 중량: 5.2g,C:\dev\ZeroMoa\ZeroMoa\crawl_data\images\캡슐커피\벨미오 룽고 포르테 캡슐커피.jpg
카피탈리 네스카피탈리 캡슐커피세트,캡슐커피/맛: 기타/사용머신: 네스프레소/총량: 120개/캡슐 중량: 5.5g,C:\dev\ZeroMoa\ZeroMoa\crawl_data\images\캡슐커피\카피탈리 네스카피탈리 캡슐커피세트.jpg
캐빈잇 프리미엄 룽고 16개입,캡슐커피/맛: 에스프레소/사용머신: 돌체구스토/총량: 16개입/중량: 8.5g,C:\dev\ZeroMoa\ZeroMoa\crawl_data\images\캡슐커피\캐빈잇 프리미엄 룽고 16개입.jpg
던킨도너츠 던킨 디즈니 에스프레소 블렌드 캡슐 20개입,캡슐커피/맛: 에스프레소/사용머신: 네스프레소/총량: 60개입/중량: 5g,C:\dev\ZeroMoa\ZeroMoa\crawl_data\images\캡슐커피\던킨도너츠 던킨 디즈니 에스프레소 블렌드 캡슐 20개입.jpg
네슬레 네스프레소 버츄오 플러스 캡슐커피머신 1개,캡슐커피,C:\dev\ZeroMoa\ZeroMoa\crawl_data\images\캡슐커피\네슬레 네스프레소 버츄오 플러스 캡슐커피머신 1개.jpg
펄세스 스테비아 커피믹스 9.5g 200ct,캡슐커피,C:\dev\ZeroMoa\ZeroMoa\crawl_data\images\캡슐커피\펄세스 스테비아 커피믹스 9.5g 200ct.jpg
셀리니 멜로디코 캡슐,캡슐커피/캡슐 총량: 20개,C:\dev\ZeroMoa\ZeroMoa\crawl_data\images\캡슐커피\셀리니 멜로디코 캡슐.jpg
벨미오 에스프레소 포르테 캡슐커피,캡슐커피/맛: 에스프레소/캡슐 총량: 10개/네스프레소(호환),C:\dev\ZeroMoa\ZeroMoa\crawl_data\images\캡슐커피\벨미오 에스프레소 포르테 캡슐커피.jpg
던킨도너츠 첼시바이브 블렌드 캡슐커피 5g,캡슐커피,C:\dev\ZeroMoa\ZeroMoa\crawl_data\images\캡슐커피\던킨도너츠 첼시바이브 블렌드 캡슐커피 5g.jpg
던킨도너츠 에스프레소 블렌드 네스프레소 호환 캡슐커피,캡슐커피/맛: 에스프레소/네스프레소 (호환),C:\dev\ZeroMoa\ZeroMoa\crawl_data\images\캡슐커피\던킨도너츠 에스프레소 블렌드 네스프레소 호환 캡슐커피.jpg
동서식품 맥심 카누 카누 밸런스 디카페인 캡슐커피(네스프레소 호환)[50개],캡슐커피/맛: 에스프레소,C:\dev\ZeroMoa\ZeroMoa\crawl_data\images\캡슐커피\동서식품 맥심 카누 카누 밸런스 디카페인 캡슐커피(네스프레소 호환)[50개].jpg
야콥스 룽고 6 클래시코 캡슐커피,캡슐커피/맛: 에스프레소,C:\dev\ZeroMoa\ZeroMoa\crawl_data\images\캡슐커피\야콥스 룽고 6 클래시코 캡슐커피.jpg
커피빈 시그니처 블렌드 캡슐커피,캡슐커피,C:\dev\ZeroMoa\ZeroMoa\crawl_data\images\캡슐커피\커피빈 시그니처 블렌드 캡슐커피.jpg
네슬레 네스프레소 포티시오 룽고 캡슐커피,캡슐커피/맛: 에스프레소/사용머신: 네스프레소/총량: 50개,C:\dev\ZeroMoa\ZeroMoa\crawl_data\images\캡슐커피\네슬레 네스프레소 포티시오 룽고 캡슐커피.jpg
네슬레 스타벅스 앳홈 하우스 블렌드 룽고 18개입,캡슐커피/맛: 에스프레소/사용머신: 네스프레소/총량: 18개입/중량: 5.7g/풍부함&토피넛 노트,C:\dev\ZeroMoa\ZeroMoa\crawl_data\images\캡슐커피\네슬레 스타벅스 앳홈 하우스 블렌드 룽고 18개입.jpg
네슬레 스타벅스 앳홈 블론드 에스프레소 로스트 18개입,캡슐커피/맛: 에스프레소/사용머신: 네스프레소/총량: 18개입/중량: 5.3g/부드러움&달콤함,C:\dev\ZeroMoa\ZeroMoa\crawl_data\images\캡슐커피\네슬레 스타벅스 앳홈 블론드 에스프레소 로스트 18개입.jpg
투썸플레이스 에이리스트 캡슐커피 다크블렌드 10개입,"캡슐커피/맛: 아메리카노/사용머신: 네스프레소/총량: 10개입/중량: 5.1g/커피원두: 콜롬비아산45%, 브라질산30%, 에티오피아산17%",C:\dev\ZeroMoa\ZeroMoa\crawl_data\images\캡슐커피\투썸플레이스 에이리스트 캡슐커피 다크블렌드 10개입.jpg
네슬레 네스프레소 볼루토 디카페나토 10개입,캡슐커피/맛: 디카페인/사용머신: 네스프레소/총량: 10개입/중량: 5g,C:\dev\ZeroMoa\ZeroMoa\crawl_data\images\캡슐커피\네슬레 네스프레소 볼루토 디카페나토 10개입.jpg
네슬레 네스카페 돌체구스토 카페오레 16개입,캡슐커피/맛: 카페오레/사용머신: 돌체구스토/총량: 48개입/중량: 10g,C:\dev\ZeroMoa\ZeroMoa\crawl_data\images\캡슐커피\네슬레 네스카페 돌체구스토 카페오레 16개입.jpg
일리 아메리카노 클라시코 미디엄 필터 캡슐 커피 18개입 1개,캡슐커피,C:\dev\ZeroMoa\ZeroMoa\crawl_data\images\캡슐커피\일리 아메리카노 클라시코 미디엄 필터 캡슐 커피 18개입 1개.jpg
스타벅스 캡슐커피 토피넛향 네스프레소 10P,캡슐커피,C:\dev\ZeroMoa\ZeroMoa\crawl_data\images\캡슐커피\스타벅스 캡슐커피 토피넛향 네스프레소 10P.jpg
네슬레 네스카페 돌체구스토 호환 Milk 밀크 우유 캡슐 16개입 2팩,캡슐커피/사용머신: 돌체구스토,C:\dev\ZeroMoa\ZeroMoa\crawl_data\images\캡슐커피\네슬레 네스카페 돌체구스토 호환 Milk 밀크 우유 캡슐 16개입 2팩.jpg
스타벅스 네스프레소 에스프레소 로스트 빅팩 캡슐커피 5.7g 36개입 1개,캡슐커피,C:\dev\ZeroMoa\ZeroMoa\crawl_data\images\캡슐커피\스타벅스 네스프레소 에스프레소 로스트 빅팩 캡슐커피 5.7g 36개입 1개.jpg
네슬레 네스퀵 16개입,캡슐커피,C:\dev\ZeroMoa\ZeroMoa\crawl_data\images\캡슐커피\네슬레 네스퀵 16개입.jpg
일리 디카페인 캡슐커피,"캡슐커피/맛: 에스프레소, 디카페인/사용머신: 일리/총량: 84개",C:\dev\ZeroMoa\ZeroMoa\crawl_data\images\캡슐커피\일리 디카페인 캡슐커피.jpg
이탈리안커피 인텐소 10개입,캡슐커피/맛: 에스프레소/사용머신: 네스프레소/총량: 10개입/중량: 5.5g,C:\dev\ZeroMoa\ZeroMoa\crawl_data\images\캡슐커피\이탈리안커피 인텐소 10개입.jpg
동서식품 맥심 카누 카누 밸런스 디카페인 캡슐커피(네스프레소 호환)[60개],캡슐커피/맛: 에스프레소,C:\dev\ZeroMoa\ZeroMoa\crawl_data\images\캡슐커피\동서식품 맥심 카누 카누 밸런스 디카페인 캡슐커피(네스프레소 호환)[60개].jpg
카피탈리 돌체구스토 호환 캡슐커피 골드 수프레모,캡슐커피,C:\dev\ZeroMoa\ZeroMoa\crawl_data\images\캡슐커피\카피탈리 돌체구스토 호환 캡슐커피 골드 수프레모.jpg
네슬레 네스프레소 이스피라치오네 팔레르모 카자르 캡슐커피,캡슐커피/맛: 에스프레소/사용머신: 네스프레소/총량: ~10개입/캡슐 중량: 6g,C:\dev\ZeroMoa\ZeroMoa\crawl_data\images\캡슐커피\네슬레 네스프레소 이스피라치오네 팔레르모 카자르 캡슐커피.jpg
지모카 크레모소 캡슐커피,캡슐커피/총량: ~10개입,C:\dev\ZeroMoa\ZeroMoa\crawl_data\images\캡슐커피\지모카 크레모소 캡슐커피.jpg
가리발디 네스프레소 구스토 돌체 캡슐커피,캡슐커피/맛: 에스프레소/사용머신: 네스프레소/총량: 100개/캡슐 중량: 5g,C:\dev\ZeroMoa\ZeroMoa\crawl_data\images\캡슐커피\가리발디 네스프레소 구스토 돌체 캡슐커피.jpg
네슬레 네스프레소 볼루토 디카페나토 캡슐커피,"캡슐커피/맛: 에스프레소, 디카페인/사용머신: 네스프레소/총량: 20개/캡슐 중량: 5g",C:\dev\ZeroMoa\ZeroMoa\crawl_data\images\캡슐커피\네슬레 네스프레소 볼루토 디카페나토 캡슐커피.jpg
일리 클라시코 룽고 캡슐커피,캡슐커피/맛: 에스프레소/사용머신: 일리/총량: 216개,C:\dev\ZeroMoa\ZeroMoa\crawl_data\images\캡슐커피\일리 클라시코 룽고 캡슐커피.jpg
까라로 돌체구스토 브라질 16개입,캡슐커피/맛: 에스프레소/사용머신: 돌체구스토/총량: 64개입/중량: 7g,C:\dev\ZeroMoa\ZeroMoa\crawl_data\images\캡슐커피\까라로 돌체구스토 브라질 16개입.jpg
네슬레 스타벅스 앳홈 에스프레소 로스트 18개입,캡슐커피/맛: 에스프레소/사용머신: 네스프레소/총량: 18개입/중량: 5.7g/리치함&캐러멜향,C:\dev\ZeroMoa\ZeroMoa\crawl_data\images\캡슐커피\네슬레 스타벅스 앳홈 에스프레소 로스트 18개입.jpg
네슬레 스타벅스 앳홈 싱글 오리진 콜롬비아 18개입,캡슐커피/맛: 에스프레소/사용머신: 네스프레소/총량: 18개입/중량: 5.7g/조화로움&견과류향,C:\dev\ZeroMoa\ZeroMoa\crawl_data\images\캡슐커피\네슬레 스타벅스 앳홈 싱글 오리진 콜롬비아 18개입.jpg
라바짜 아로마 포인트 2개입,캡슐커피/맛: 에스프레소/사용머신: 라바짜/총량: 2개입/중량: 12.5g,C:\dev\ZeroMoa\ZeroMoa\crawl_data\images\캡슐커피\라바짜 아로마 포인트 2개입.jpg
네슬레 네스카페 돌체구스토 카푸치노 16개입 (해외),"캡슐커피/맛: 카푸치노/사용머신: 돌체구스토/총량: 16개입/중량: 커피 8g, 밀크 17g",C:\dev\ZeroMoa\ZeroMoa\crawl_data\images\캡슐커피\네슬레 네스카페 돌체구스토 카푸치노 16개입 (해외).jpg
가리발디 셀레지오네 1860 10개입,캡슐커피/맛: 에스프레소/사용머신: 네스프레소/총량: 10개입/중량: 5g,C:\dev\ZeroMoa\ZeroMoa\crawl_data\images\캡슐커피\가리발디 셀레지오네 1860 10개입.jpg
올카페 올카페 스타벅스 에스프레소 14일 캡슐,캡슐커피/맛: 에스프레소/사용머신: 돌체구스토,C:\dev\ZeroMoa\ZeroMoa\crawl_data\images\캡슐커피\올카페 올카페 스타벅스 에스프레소 14일 캡슐.jpg
일리 네스프레소 호환 캡슐커피 클라시코 5.7g 10개입 1개,캡슐커피,C:\dev\ZeroMoa\ZeroMoa\crawl_data\images\캡슐커피\일리 네스프레소 호환 캡슐커피 클라시코 5.7g 10개입 1개.jpg
스타벅스 써니데이 블렌드 by 네스카페 돌체구스토 캡슐커피 8.3g 12개입 3개,캡슐커피,C:\dev\ZeroMoa\ZeroMoa\crawl_data\images\캡슐커피\스타벅스 써니데이 블렌드 by 네스카페 돌체구스토 캡슐커피 8.3g 12개입 3개.jpg
칼리타 Style Up세트185 그린 500ml 글라스 드리퍼,캡슐커피,C:\dev\ZeroMoa\ZeroMoa\crawl_data\images\캡슐커피\칼리타 Style Up세트185 그린 500ml 글라스 드리퍼.jpg
동서식품 카누 커피 맥심 오리지날 동서 500g 리필 업소용 식당용,캡슐커피,C:\dev\ZeroMoa\ZeroMoa\crawl_data\images\캡슐커피\동서식품 카누 커피 맥심 오리지날 동서 500g 리필 업소용 식당용.jpg
스타벅스 캡슐커피 네스프레소 오리지널 머신 전용 에스프레소 블론드,캡슐커피/사용머신: 네스프레소,C:\dev\ZeroMoa\ZeroMoa\crawl_data\images\캡슐커피\스타벅스 캡슐커피 네스프레소 오리지널 머신 전용 에스프레소 블론드.jpg
칼리타 핸드드립세트 도자기 4인용 102LD,캡슐커피,C:\dev\ZeroMoa\ZeroMoa\crawl_data\images\캡슐커피\칼리타 핸드드립세트 도자기 4인용 102LD.jpg
동서식품 맥심 카누 카누 아이스 블렌드 120T,캡슐커피,C:\dev\ZeroMoa\ZeroMoa\crawl_data\images\캡슐커피\동서식품 맥심 카누 카누 아이스 블렌드 120T.jpg
일리 캡슐 커피 클라시코 룽고 18 캡슐 머신 전용,캡슐커피,C:\dev\ZeroMoa\ZeroMoa\crawl_data\images\캡슐커피\일리 캡슐 커피 클라시코 룽고 18 캡슐 머신 전용.jpg
동서식품 타시모 켄코 모카 캡슐 8개입 5팩 Coffee,캡슐커피,C:\dev\ZeroMoa\ZeroMoa\crawl_data\images\캡슐커피\동서식품 타시모 켄코 모카 캡슐 8개입 5팩 Coffee.jpg
네슬레 네스프레소 호환 스텐 리필 캡슐 재활용 반영구,캡슐커피,C:\dev\ZeroMoa\ZeroMoa\crawl_data\images\캡슐커피\네슬레 네스프레소 호환 스텐 리필 캡슐 재활용 반영구.jpg
네슬레 라테 마키아토 12개입,캡슐커피,C:\dev\ZeroMoa\ZeroMoa\crawl_data\images\캡슐커피\네슬레 라테 마키아토 12개입.jpg
네슬레 네스카페 돌체구스토 카푸치노 캡슐커피 186.4g,캡슐커피,C:\dev\ZeroMoa\ZeroMoa\crawl_data\images\캡슐커피\네슬레 네스카페 돌체구스토 카푸치노 캡슐커피 186.4g.jpg
카피탈리 네스프레소 버라이어티팩 6종,캡슐커피/맛: 에스프레소/사용머신: 네스프레소/총량: 120개,C:\dev\ZeroMoa\ZeroMoa\crawl_data\images\캡슐커피\카피탈리 네스프레소 버라이어티팩 6종.jpg
라바짜 에스프레소 리스트레토 캡슐커피,캡슐커피/맛: 에스프레소/사용머신: 네스프레소/총량: 60개,C:\dev\ZeroMoa\ZeroMoa\crawl_data\images\캡슐커피\라바짜 에스프레소 리스트레토 캡슐커피.jpg
네슬레 네스프레소 버츄오 카페 쿠바 캡슐커피 해외쇼핑,캡슐커피/맛: 에스프레소/사용머신: 버츄오/총량: ~10개입,C:\dev\ZeroMoa\ZeroMoa\crawl_data\images\캡슐커피\네슬레 네스프레소 버츄오 카페 쿠바 캡슐커피 해외쇼핑.jpg
엠즈씨드 폴바셋 시그니처 블렌드 캡슐커피,캡슐커피/맛: 에스프레소/사용머신: 네스프레소/총량: ~10개입/캡슐 중량: 5.3g,C:\dev\ZeroMoa\ZeroMoa\crawl_data\images\캡슐커피\엠즈씨드 폴바셋 시그니처 블렌드 캡슐커피.jpg
치보 카피시모 카페 크랍티그 캡슐커피,"캡슐커피/맛: 아메리카노/사용머신: 치보,카피시모/총량: 80개/캡슐 중량: 7g",C:\dev\ZeroMoa\ZeroMoa\crawl_data\images\캡슐커피\치보 카피시모 카페 크랍티그 캡슐커피.jpg
네슬레 네스프레소 버츄오 지오니오 캡슐커피,캡슐커피/맛: 에스프레소/사용머신: 버츄오/총량: ~10개입,C:\dev\ZeroMoa\ZeroMoa\crawl_data\images\캡슐커피\네슬레 네스프레소 버츄오 지오니오 캡슐커피.jpg
치보 카피시모 에스프레소 디카페인 캡슐커피,"캡슐커피/맛: 에스프레소, 디카페인/사용머신: 치보,카피시모/총량: ~10개입/캡슐 중량: 7.5g",C:\dev\ZeroMoa\ZeroMoa\crawl_data\images\캡슐커피\치보 카피시모 에스프레소 디카페인 캡슐커피.jpg
라바짜 포인트 티에라 캡슐커피,캡슐커피/맛: 에스프레소/사용머신: 라바짜/총량: 100개,C:\dev\ZeroMoa\ZeroMoa\crawl_data\images\캡슐커피\라바짜 포인트 티에라 캡슐커피.jpg
쟈뎅 레브 헤이즐넛향 네스프레소 호환 캡슐커피,캡슐커피/맛: 에스프레소,C:\dev\ZeroMoa\ZeroMoa\crawl_data\images\캡슐커피\쟈뎅 레브 헤이즐넛향 네스프레소 호환 캡슐커피.jpg
