Name,Spec,ImageURL
"동서식품 맥심 카누 캡슐커피, 네스프레소 호환, 스무스 미디엄 로스트, 20개 + 벨베티 미디엄, 20개",캡슐커피,
네슬레 네스프레소 캡슐 버츄오 아이스 레제로 캡슐커피,캡슐커피/사용머신: 네스프레소,C:\dev\ZeroMoa\ZeroMoa\crawl_data\images\캡슐커피\네슬레 네스프레소 캡슐 버츄오 아이스 레제로 캡슐커피.jpg
네슬레 네스프레소 버츄오 캡슐 바리스타 로스티드 헤이즐넛향 커피 10캡슐,캡슐커피,C:\dev\ZeroMoa\ZeroMoa\crawl_data\images\캡슐커피\네슬레 네스프레소 버츄오 캡슐 바리스타 로스티드 헤이즐넛향 커피 10캡슐.jpg
카피탈리 치보 에카페 캡슐커피 에카페 쁘레지오소 8곽,캡슐커피,C:\dev\ZeroMoa\ZeroMoa\crawl_data\images\캡슐커피\카피탈리 치보 에카페 캡슐커피 에카페 쁘레지오소 8곽.jpg
네슬레 네스카페 돌체구스토 더블 에스프레소 캡슐커피 8.5g,캡슐커피,C:\dev\ZeroMoa\ZeroMoa\crawl_data\images\캡슐커피\네슬레 네스카페 돌체구스토 더블 에스프레소 캡슐커피 8.5g.jpg
가리발디 네스프레소 캡슐커피 호환 6종 60캡슐,캡슐커피,C:\dev\ZeroMoa\ZeroMoa\crawl_data\images\캡슐커피\가리발디 네스프레소 캡슐커피 호환 6종 60캡슐.jpg
일리 과테말라 캡슐커피 18p 120.6g 5개,캡슐커피,C:\dev\ZeroMoa\ZeroMoa\crawl_data\images\캡슐커피\일리 과테말라 캡슐커피 18p 120.6g 5개.jpg
"동서식품 맥심 카누 캡슐커피, 네스프레소 호환, 스무스 미디엄 로스트, 20개 + 볼드 다크, 20개",캡슐커피,
네슬레 네스프레소 버츄오 캡슐 그랑 룽고 이니지오 캡슐,캡슐커피/사용머신: 네스프레소,C:\dev\ZeroMoa\ZeroMoa\crawl_data\images\캡슐커피\네슬레 네스프레소 버츄오 캡슐 그랑 룽고 이니지오 캡슐.jpg
네슬레 네스프레소 스타벅스 에스프레소 로스트 캡슐커피 5.7g 40개,캡슐커피,C:\dev\ZeroMoa\ZeroMoa\crawl_data\images\캡슐커피\네슬레 네스프레소 스타벅스 에스프레소 로스트 캡슐커피 5.7g 40개.jpg
일리 18 캡슐커피 니카라과,캡슐커피,C:\dev\ZeroMoa\ZeroMoa\crawl_data\images\캡슐커피\일리 18 캡슐커피 니카라과.jpg
"동서식품 맥심 카누 캡슐커피, 네스프레소 호환, 벨베티 미디엄 로스트, 20개 + 볼드 다크, 20개",캡슐커피,
카피탈리 에카페 꼬르포소 커피빈 치보 카피시모 캡슐커피,캡슐커피,C:\dev\ZeroMoa\ZeroMoa\crawl_data\images\캡슐커피\카피탈리 에카페 꼬르포소 커피빈 치보 카피시모 캡슐커피.jpg
스타벅스 캡슐커피 by 네스프레소 블론드 에스프레소 36P by 네스프레소,캡슐커피,C:\dev\ZeroMoa\ZeroMoa\crawl_data\images\캡슐커피\스타벅스 캡슐커피 by 네스프레소 블론드 에스프레소 36P by 네스프레소.jpg
이디야 커피랩 캡슐커피 8Tx3팩 총24팩 콜롬비아/에티오피아/페르소나,캡슐커피,C:\dev\ZeroMoa\ZeroMoa\crawl_data\images\캡슐커피\이디야 커피랩 캡슐커피 8Tx3팩 총24팩 콜롬비아_에티오피아_페르소나.jpg
보르보네 네스프레소 호환 캡슐커피 200개,캡슐커피,C:\dev\ZeroMoa\ZeroMoa\crawl_data\images\캡슐커피\보르보네 네스프레소 호환 캡슐커피 200개.jpg
카페르네 케냐 네스카페 돌체구스토 호환 캡슐커피 16개입,캡슐커피/사용머신: 돌체구스토,C:\dev\ZeroMoa\ZeroMoa\crawl_data\images\캡슐커피\카페르네 케냐 네스카페 돌체구스토 호환 캡슐커피 16개입.jpg
스타벅스 네스프레소 캡슐커피 브렉퍼스트 호환머신,캡슐커피/사용머신: 네스프레소,C:\dev\ZeroMoa\ZeroMoa\crawl_data\images\캡슐커피\스타벅스 네스프레소 캡슐커피 브렉퍼스트 호환머신.jpg
까라로 네스프레소 호환 캡슐커피 알루라인 그란 크레마,캡슐커피/사용머신: 네스프레소,C:\dev\ZeroMoa\ZeroMoa\crawl_data\images\캡슐커피\까라로 네스프레소 호환 캡슐커피 알루라인 그란 크레마.jpg
에카페 캡슐커피 끄레모쏘 1곽 10개입,캡슐커피,C:\dev\ZeroMoa\ZeroMoa\crawl_data\images\캡슐커피\에카페 캡슐커피 끄레모쏘 1곽 10개입.jpg
던킨도너츠 프렌치 바닐라 커피 K 컵 22ea 1개,캡슐커피,C:\dev\ZeroMoa\ZeroMoa\crawl_data\images\캡슐커피\던킨도너츠 프렌치 바닐라 커피 K 컵 22ea 1개.jpg
라바짜 Qualita Rossa 캡슐커피 10개입 4팩,캡슐커피,C:\dev\ZeroMoa\ZeroMoa\crawl_data\images\캡슐커피\라바짜 Qualita Rossa 캡슐커피 10개입 4팩.jpg
스타벅스 싱글 오리진 콜롬비아 by 네스프레소 캡슐커피 5.7g 10개 1개,캡슐커피,C:\dev\ZeroMoa\ZeroMoa\crawl_data\images\캡슐커피\스타벅스 싱글 오리진 콜롬비아 by 네스프레소 캡슐커피 5.7g 10개 1개.jpg
네슬레 네스프레소 오리지널 캡슐 샘플러 I. 디카페인,캡슐커피/사용머신: 네스프레소,C:\dev\ZeroMoa\ZeroMoa\crawl_data\images\캡슐커피\네슬레 네스프레소 오리지널 캡슐 샘플러 I. 디카페인.jpg
네슬레 네스프레소 버츄오 로스티드 헤이즐넛향 커피 바리스타 캡슐커피 강도6,캡슐커피,C:\dev\ZeroMoa\ZeroMoa\crawl_data\images\캡슐커피\네슬레 네스프레소 버츄오 로스티드 헤이즐넛향 커피 바리스타 캡슐커피 강도6.jpg
"커피빈 네스프레소용 시그니처 블렌드, 10캡슐, 3개 총 30캡슐",캡슐커피,"C:\dev\ZeroMoa\ZeroMoa\crawl_data\images\캡슐커피\커피빈 네스프레소용 시그니처 블렌드, 10캡슐, 3개 총 30캡슐.jpg"
동서식품 맥심 카누 바리스타 머신 전용 캡슐커피 프라우드오션 95g 4개입,캡슐커피/사용머신: 네스프레소,C:\dev\ZeroMoa\ZeroMoa\crawl_data\images\캡슐커피\동서식품 맥심 카누 바리스타 머신 전용 캡슐커피 프라우드오션 95g 4개입.jpg
일리 캡슐 커피 개별포장 싱글팩 50캡슐,캡슐커피,C:\dev\ZeroMoa\ZeroMoa\crawl_data\images\캡슐커피\일리 캡슐 커피 개별포장 싱글팩 50캡슐.jpg
라바짜 캡슐 커피 EP 포인트 25팩 50개입 디카페인,캡슐커피,C:\dev\ZeroMoa\ZeroMoa\crawl_data\images\캡슐커피\라바짜 캡슐 커피 EP 포인트 25팩 50개입 디카페인.jpg
치보 카피시모 캡슐커피 카페크레마 리치 아로마 10캡슐 8박스 카피탈리시스템 전용,캡슐커피,C:\dev\ZeroMoa\ZeroMoa\crawl_data\images\캡슐커피\치보 카피시모 캡슐커피 카페크레마 리치 아로마 10캡슐 8박스 카피탈리시스템 전용.jpg
카페르네 아메리카노 96개입 돌체구스토 호환 캡슐커피,캡슐커피/사용머신: 돌체구스토,C:\dev\ZeroMoa\ZeroMoa\crawl_data\images\캡슐커피\카페르네 아메리카노 96개입 돌체구스토 호환 캡슐커피.jpg
네슬레 네스프레소 버츄오 초코릿 퍼지향 커스터드 바리스타 캡슐커피 강도6 / 리치 초코릿향 NEW,캡슐커피,C:\dev\ZeroMoa\ZeroMoa\crawl_data\images\캡슐커피\네슬레 네스프레소 버츄오 초코릿 퍼지향 커스터드 바리스타 캡슐커피 강도6 _ 리치 초코릿향 NEW.jpg
벨미오 네스프레소 호환캡슐커피 모음,캡슐커피/사용머신: 네스프레소,C:\dev\ZeroMoa\ZeroMoa\crawl_data\images\캡슐커피\벨미오 네스프레소 호환캡슐커피 모음.jpg
치보 카피시모 캡슐커피 에스프레소 인텐스 아로마 10캡슐 8박스 카피탈리시스템 전용,캡슐커피,C:\dev\ZeroMoa\ZeroMoa\crawl_data\images\캡슐커피\치보 카피시모 캡슐커피 에스프레소 인텐스 아로마 10캡슐 8박스 카피탈리시스템 전용.jpg
네슬레 네스카페 돌체구스토_카페롱고_104G 1개,캡슐커피/사용머신: 돌체구스토,C:\dev\ZeroMoa\ZeroMoa\crawl_data\images\캡슐커피\네슬레 네스카페 돌체구스토_카페롱고_104G 1개.jpg
캐빈잇 CABINEAT 돌체구스토 호환 캡슐커피 모모라 36개입,캡슐커피/사용머신: 돌체구스토,C:\dev\ZeroMoa\ZeroMoa\crawl_data\images\캡슐커피\캐빈잇 CABINEAT 돌체구스토 호환 캡슐커피 모모라 36개입.jpg
스타벅스 에스프레소 로스트 인텐시티 11 캡슐커피 바이 네스프레소 126개입,캡슐커피,C:\dev\ZeroMoa\ZeroMoa\crawl_data\images\캡슐커피\스타벅스 에스프레소 로스트 인텐시티 11 캡슐커피 바이 네스프레소 126개입.jpg
네슬레 네스카페 돌체구스토 호환 캡슐커피 온두라스 32캡슐,캡슐커피,C:\dev\ZeroMoa\ZeroMoa\crawl_data\images\캡슐커피\네슬레 네스카페 돌체구스토 호환 캡슐커피 온두라스 32캡슐.jpg
스타벅스 캡슐커피 -블론드 에스프레소 by 네스카페 돌체구스토,캡슐커피/사용머신: 네스프레소,C:\dev\ZeroMoa\ZeroMoa\crawl_data\images\캡슐커피\스타벅스 캡슐커피 -블론드 에스프레소 by 네스카페 돌체구스토.jpg
카페르네 카페오레 96개입 돌체구스토 호환 캡슐커피,캡슐커피/사용머신: 돌체구스토,C:\dev\ZeroMoa\ZeroMoa\crawl_data\images\캡슐커피\카페르네 카페오레 96개입 돌체구스토 호환 캡슐커피.jpg
스타벅스 캡슐커피 -하우스 블렌드 by 네스프레소,캡슐커피/사용머신: 네스프레소,C:\dev\ZeroMoa\ZeroMoa\crawl_data\images\캡슐커피\스타벅스 캡슐커피 -하우스 블렌드 by 네스프레소.jpg
쟈뎅 레브 캡슐커피 스모키/웰/웜/콜롬비아/모닝/헤이즐넛/디카페인 30캡슐 골라담기,캡슐커피,C:\dev\ZeroMoa\ZeroMoa\crawl_data\images\캡슐커피\쟈뎅 레브 캡슐커피 스모키_웰_웜_콜롬비아_모닝_헤이즐넛_디카페인 30캡슐 골라담기.jpg
네슬레 네스프레소 캡슐 케이프타운 엔비보 룽고 10캡슐,캡슐커피/사용머신: 네스프레소,C:\dev\ZeroMoa\ZeroMoa\crawl_data\images\캡슐커피\네슬레 네스프레소 캡슐 케이프타운 엔비보 룽고 10캡슐.jpg
스타벅스 네스프레소 호환 캡슐커피 9종 10캡슐,캡슐커피/사용머신: 네스프레소,C:\dev\ZeroMoa\ZeroMoa\crawl_data\images\캡슐커피\스타벅스 네스프레소 호환 캡슐커피 9종 10캡슐.jpg
"동서식품 맥심 카누 캡슐커피, 네스프레소 호환, 볼드 다크 로스트, 20개 + 스모키 다크, 20개",캡슐커피,
치보 카피시모 캡슐커피 에스프레소 브라질 10캡슐 8박스 카피탈리시스템 전용,캡슐커피,C:\dev\ZeroMoa\ZeroMoa\crawl_data\images\캡슐커피\치보 카피시모 캡슐커피 에스프레소 브라질 10캡슐 8박스 카피탈리시스템 전용.jpg
네슬레 네스프레소 버츄오 캡슐 디아볼리토 10캡슐,캡슐커피/사용머신: 네스프레소,C:\dev\ZeroMoa\ZeroMoa\crawl_data\images\캡슐커피\네슬레 네스프레소 버츄오 캡슐 디아볼리토 10캡슐.jpg
까라로 네스프레소 호환 캡슐커피 21종,캡슐커피/사용머신: 네스프레소,C:\dev\ZeroMoa\ZeroMoa\crawl_data\images\캡슐커피\까라로 네스프레소 호환 캡슐커피 21종.jpg
까라로 네스프레소 호환 캡슐커피 블랙라인 에티오피아,캡슐커피/사용머신: 네스프레소,C:\dev\ZeroMoa\ZeroMoa\crawl_data\images\캡슐커피\까라로 네스프레소 호환 캡슐커피 블랙라인 에티오피아.jpg
카페르네 아메리카노 16개입 돌체구스토 호환 캡슐커피,캡슐커피/사용머신: 돌체구스토,C:\dev\ZeroMoa\ZeroMoa\crawl_data\images\캡슐커피\카페르네 아메리카노 16개입 돌체구스토 호환 캡슐커피.jpg
"동서식품 맥심 카누 캡슐커피, 네스프레소 호환, 벨베티 미디엄 로스트, 20개 + 스모키 다크, 20개",캡슐커피,
네슬레 네스프레소 캡슐 카자르 캡슐커피 10캡슐,캡슐커피/사용머신: 네스프레소,C:\dev\ZeroMoa\ZeroMoa\crawl_data\images\캡슐커피\네슬레 네스프레소 캡슐 카자르 캡슐커피 10캡슐.jpg
"동서식품 맥심 카누 캡슐커피, 네스프레소 호환, 스무스 미디엄 로스트, 20개 + 스모키 다크, 20개",캡슐커피,
스타벅스 앳홈 네스프레소 맛보기 10종 총100캡슐 10캡슐x10개,캡슐커피/사용머신: 네스프레소,C:\dev\ZeroMoa\ZeroMoa\crawl_data\images\캡슐커피\스타벅스 앳홈 네스프레소 맛보기 10종 총100캡슐 10캡슐x10개.jpg
스타벅스 베란다 블렌드 by 돌체구스토 캡슐 캡슐,캡슐커피,C:\dev\ZeroMoa\ZeroMoa\crawl_data\images\캡슐커피\스타벅스 베란다 블렌드 by 돌체구스토 캡슐 캡슐.jpg
이마트 노브랜드 룽고 캡슐커피 16입,캡슐커피,C:\dev\ZeroMoa\ZeroMoa\crawl_data\images\캡슐커피\이마트 노브랜드 룽고 캡슐커피 16입.jpg
카피탈리 네스프레소 호환100캡슐 3종 오리지널 550g,캡슐커피/사용머신: 네스프레소,C:\dev\ZeroMoa\ZeroMoa\crawl_data\images\캡슐커피\카피탈리 네스프레소 호환100캡슐 3종 오리지널 550g.jpg
네슬레 네스프레소 버츄오 캡슐 머그 아이스 포르테 10캡슐,캡슐커피,C:\dev\ZeroMoa\ZeroMoa\crawl_data\images\캡슐커피\네슬레 네스프레소 버츄오 캡슐 머그 아이스 포르테 10캡슐.jpg
스타벅스 네스프레소 호환 캡슐커피 세트 50캡슐,캡슐커피,C:\dev\ZeroMoa\ZeroMoa\crawl_data\images\캡슐커피\스타벅스 네스프레소 호환 캡슐커피 세트 50캡슐.jpg
네슬레 네스프레소 오리지널 도쿄 비발토 룽고 캡슐커피 5.8g 10개,캡슐커피/사용머신: 네스프레소,C:\dev\ZeroMoa\ZeroMoa\crawl_data\images\캡슐커피\네슬레 네스프레소 오리지널 도쿄 비발토 룽고 캡슐커피 5.8g 10개.jpg
네슬레 네스카페 돌체구스토 아메리카노 리치 아로마 캡슐커피 8g 80개,캡슐커피,C:\dev\ZeroMoa\ZeroMoa\crawl_data\images\캡슐커피\네슬레 네스카페 돌체구스토 아메리카노 리치 아로마 캡슐커피 8g 80개.jpg
동서식품 카누 카누 다크 로스트 스위트 아메리카노 120T 360g,캡슐커피,C:\dev\ZeroMoa\ZeroMoa\crawl_data\images\캡슐커피\동서식품 카누 카누 다크 로스트 스위트 아메리카노 120T 360g.jpg
네슬레 네스프레소 버츄오 캡슐 더블에스프레소 아이스레제로,캡슐커피,C:\dev\ZeroMoa\ZeroMoa\crawl_data\images\캡슐커피\네슬레 네스프레소 버츄오 캡슐 더블에스프레소 아이스레제로.jpg
네슬레 네스카페 돌체구스토 캡슐커피 대용량 모음전,캡슐커피/사용머신: 돌체구스토,C:\dev\ZeroMoa\ZeroMoa\crawl_data\images\캡슐커피\네슬레 네스카페 돌체구스토 캡슐커피 대용량 모음전.jpg
네슬레 네스프레소 캡슐 I.파퓰러 샘플킷 6캡슐,캡슐커피/사용머신: 네스프레소,C:\dev\ZeroMoa\ZeroMoa\crawl_data\images\캡슐커피\네슬레 네스프레소 캡슐 I.파퓰러 샘플킷 6캡슐.jpg
일리 네스프레소 호환 캡슐 커피 6종 세트 60캡슐,캡슐커피,C:\dev\ZeroMoa\ZeroMoa\crawl_data\images\캡슐커피\일리 네스프레소 호환 캡슐 커피 6종 세트 60캡슐.jpg
카페르네 콜롬비아 96개입 돌체구스토 호환 캡슐커피,캡슐커피/사용머신: 돌체구스토,C:\dev\ZeroMoa\ZeroMoa\crawl_data\images\캡슐커피\카페르네 콜롬비아 96개입 돌체구스토 호환 캡슐커피.jpg
네슬레 네스프레소 오리지널 캡슐커피 아이스 프레도 인텐소 / 아이스3종 _new,캡슐커피,C:\dev\ZeroMoa\ZeroMoa\crawl_data\images\캡슐커피\네슬레 네스프레소 오리지널 캡슐커피 아이스 프레도 인텐소 _ 아이스3종 _new.jpg
네슬레 네스프레소 버츄오 마스터 오리진 코스타리카 캡슐커피 강도7,캡슐커피/사용머신: 네스프레소,C:\dev\ZeroMoa\ZeroMoa\crawl_data\images\캡슐커피\네슬레 네스프레소 버츄오 마스터 오리진 코스타리카 캡슐커피 강도7.jpg
네슬레 네스프레소 버츄오 캡슐 비앙코 도피오 포 밀크 10개입,캡슐커피/사용머신: 네스프레소,C:\dev\ZeroMoa\ZeroMoa\crawl_data\images\캡슐커피\네슬레 네스프레소 버츄오 캡슐 비앙코 도피오 포 밀크 10개입.jpg
라바짜 돌체구스토 호환 캡슐커피 크레모소 16캡슐,캡슐커피/사용머신: 돌체구스토,C:\dev\ZeroMoa\ZeroMoa\crawl_data\images\캡슐커피\라바짜 돌체구스토 호환 캡슐커피 크레모소 16캡슐.jpg
트레이더조 일렉트릭 버즈 컵커피 12개입 144g 2팩,캡슐커피,C:\dev\ZeroMoa\ZeroMoa\crawl_data\images\캡슐커피\트레이더조 일렉트릭 버즈 컵커피 12개입 144g 2팩.jpg
일리 디카페인 디카프 캡슐 21개입 140.7g 3개,캡슐커피,C:\dev\ZeroMoa\ZeroMoa\crawl_data\images\캡슐커피\일리 디카페인 디카프 캡슐 21개입 140.7g 3개.jpg
스타벅스 by 네스프레소 다크 로스트 버라이어티 팩 커피 32개,캡슐커피/사용머신: 네스프레소,C:\dev\ZeroMoa\ZeroMoa\crawl_data\images\캡슐커피\스타벅스 by 네스프레소 다크 로스트 버라이어티 팩 커피 32개.jpg
스타벅스 네스프레소 캡슐 커피 디카프 에스프레소 로스트 70캡슐,캡슐커피,C:\dev\ZeroMoa\ZeroMoa\crawl_data\images\캡슐커피\스타벅스 네스프레소 캡슐 커피 디카프 에스프레소 로스트 70캡슐.jpg
네슬레 네스프레소 버츄오 바리스타 세트 4종 다양한 아로마 향의 세계,캡슐커피/사용머신: 네스프레소,C:\dev\ZeroMoa\ZeroMoa\crawl_data\images\캡슐커피\네슬레 네스프레소 버츄오 바리스타 세트 4종 다양한 아로마 향의 세계.jpg
UCC 골드 스페셜 블렌드 AP1000g 2개,캡슐커피,C:\dev\ZeroMoa\ZeroMoa\crawl_data\images\캡슐커피\UCC 골드 스페셜 블렌드 AP1000g 2개.jpg
네슬레 네스프레소 오리지널 캡슐커피 블루토 에스프레소 강도4 스타벅스 입고,캡슐커피/사용머신: 네스프레소,C:\dev\ZeroMoa\ZeroMoa\crawl_data\images\캡슐커피\네슬레 네스프레소 오리지널 캡슐커피 블루토 에스프레소 강도4 스타벅스 입고.jpg
일리 과테말라 캡슐 18개입,캡슐커피/사용머신: 일리,C:\dev\ZeroMoa\ZeroMoa\crawl_data\images\캡슐커피\일리 과테말라 캡슐 18개입.jpg
탐앤탐스 에티오피아 예가체프 핸드드립 커피 10개 8g 10개,캡슐커피,C:\dev\ZeroMoa\ZeroMoa\crawl_data\images\캡슐커피\탐앤탐스 에티오피아 예가체프 핸드드립 커피 10개 8g 10개.jpg
네슬레 네스프레소 버츄오 후레쉬 세트 4종 상큼한 아침 느낌의 아로마,캡슐커피/사용머신: 네스프레소,C:\dev\ZeroMoa\ZeroMoa\crawl_data\images\캡슐커피\네슬레 네스프레소 버츄오 후레쉬 세트 4종 상큼한 아침 느낌의 아로마.jpg
카페드롭탑 925 디카페인 캡슐커피 10개 5.3g,캡슐커피/사용머신: 네스프레소,C:\dev\ZeroMoa\ZeroMoa\crawl_data\images\캡슐커피\카페드롭탑 925 디카페인 캡슐커피 10개 5.3g.jpg
일리 캡슐커피 룽고 18캡슐 6팩,캡슐커피,C:\dev\ZeroMoa\ZeroMoa\crawl_data\images\캡슐커피\일리 캡슐커피 룽고 18캡슐 6팩.jpg
네슬레 네스카페 돌체구스토 네스카페 달마이어 프로도모 30캡슐,캡슐커피/사용머신: 돌체구스토,C:\dev\ZeroMoa\ZeroMoa\crawl_data\images\캡슐커피\네슬레 네스카페 돌체구스토 네스카페 달마이어 프로도모 30캡슐.jpg
네슬레 네스카페 돌체 구스토 캡슐 16개입 5팩 아메리카노 볼드 모닝 Nescafe Dolce Gusto Preludio Intenso,캡슐커피/사용머신: 돌체구스토,C:\dev\ZeroMoa\ZeroMoa\crawl_data\images\캡슐커피\네슬레 네스카페 돌체 구스토 캡슐 16개입 5팩 아메리카노 볼드 모닝 Nescafe Dolce Gusto Preludio Intenso.jpg
일리 커피캡슐 룽고 21개입 1통,캡슐커피,C:\dev\ZeroMoa\ZeroMoa\crawl_data\images\캡슐커피\일리 커피캡슐 룽고 21개입 1통.jpg
라바짜 에스프레소 이탈리아노 홀빈 원두 커피 Caffe Espresso Whole Bean Coffee 1kg 3개,캡슐커피,C:\dev\ZeroMoa\ZeroMoa\crawl_data\images\캡슐커피\라바짜 에스프레소 이탈리아노 홀빈 원두 커피 Caffe Espresso Whole Bean Coffee 1kg 3개.jpg
쟈뎅 클래스 원두커피 227g 로얄 헤이즐넛향 분쇄형 블랜딩커피 커피빈 쟈댕원두커피 수입원두 커피 원두,캡슐커피,C:\dev\ZeroMoa\ZeroMoa\crawl_data\images\캡슐커피\쟈뎅 클래스 원두커피 227g 로얄 헤이즐넛향 분쇄형 블랜딩커피 커피빈 쟈댕원두커피 수입원두 커피 원두.jpg
치보 카피시모 캡슐커피 96캡슐 에스프레소,캡슐커피,C:\dev\ZeroMoa\ZeroMoa\crawl_data\images\캡슐커피\치보 카피시모 캡슐커피 96캡슐 에스프레소.jpg
큐리그 McCafe Cinnamon Streusel Coffee Cake Kcup 미국 맥카페 시나몬 스트로이젤 커피 케잌 72개,캡슐커피,C:\dev\ZeroMoa\ZeroMoa\crawl_data\images\캡슐커피\큐리그 McCafe Cinnamon Streusel Coffee Cake Kcup 미국 맥카페 시나몬 스트로이젤 커피 케잌 72개.jpg
스타벅스 디카페인 에스프레소 네스프레소 호환 캡슐커피 5.3g 10개,캡슐커피,C:\dev\ZeroMoa\ZeroMoa\crawl_data\images\캡슐커피\스타벅스 디카페인 에스프레소 네스프레소 호환 캡슐커피 5.3g 10개.jpg
일리 몰 인스턴트 커피 스틱 클라시코 레귤러 70입,캡슐커피,C:\dev\ZeroMoa\ZeroMoa\crawl_data\images\캡슐커피\일리 몰 인스턴트 커피 스틱 클라시코 레귤러 70입.jpg
달마이어 캡사 캡슐커피 룽고 벨루노 네스프레소호환,캡슐커피/사용머신: 네스프레소,C:\dev\ZeroMoa\ZeroMoa\crawl_data\images\캡슐커피\달마이어 캡사 캡슐커피 룽고 벨루노 네스프레소호환.jpg
일리 브라질 캡슐 18개입,캡슐커피/사용머신: 일리,C:\dev\ZeroMoa\ZeroMoa\crawl_data\images\캡슐커피\일리 브라질 캡슐 18개입.jpg
까라로 돌체구스토 호환 캡슐커피 르완다 16개입,캡슐커피/사용머신: 돌체구스토,C:\dev\ZeroMoa\ZeroMoa\crawl_data\images\캡슐커피\까라로 돌체구스토 호환 캡슐커피 르완다 16개입.jpg
스타벅스 카푸치노 by 네스카페 돌체구스토,캡슐커피/사용머신: 돌체구스토,C:\dev\ZeroMoa\ZeroMoa\crawl_data\images\캡슐커피\스타벅스 카푸치노 by 네스카페 돌체구스토.jpg
일리 네스프레소 호환 캡슐커피 룽고 5.7g 10개입 3개,캡슐커피/사용머신: 네스프레소,C:\dev\ZeroMoa\ZeroMoa\crawl_data\images\캡슐커피\일리 네스프레소 호환 캡슐커피 룽고 5.7g 10개입 3개.jpg
네슬레 네스프레소 캡슐 오리지널 리스트레토,캡슐커피/사용머신: 네스프레소,C:\dev\ZeroMoa\ZeroMoa\crawl_data\images\캡슐커피\네슬레 네스프레소 캡슐 오리지널 리스트레토.jpg
네슬레 네스카페 돌체구스토 호환 캡슐커피 브라질 32캡슐,캡슐커피,C:\dev\ZeroMoa\ZeroMoa\crawl_data\images\캡슐커피\네슬레 네스카페 돌체구스토 호환 캡슐커피 브라질 32캡슐.jpg
네슬레 네스카페 돌체구스토 리스트레토 아덴자 캡슐커피 7g 16개입 2개,캡슐커피/사용머신: 돌체구스토,C:\dev\ZeroMoa\ZeroMoa\crawl_data\images\캡슐커피\네슬레 네스카페 돌체구스토 리스트레토 아덴자 캡슐커피 7g 16개입 2개.jpg
일리 코스타리카 캡슐 18p 18개 7.2g,캡슐커피,C:\dev\ZeroMoa\ZeroMoa\crawl_data\images\캡슐커피\일리 코스타리카 캡슐 18p 18개 7.2g.jpg
동서식품 맥심 카누 바리스타 머신 전용 캡슐커피 멜로우윈드 9.5g 30개,캡슐커피,C:\dev\ZeroMoa\ZeroMoa\crawl_data\images\캡슐커피\동서식품 맥심 카누 바리스타 머신 전용 캡슐커피 멜로우윈드 9.5g 30개.jpg
가리발디 디카페인 캡슐커피 64개입-돌체구스토호환 코스트코,캡슐커피/사용머신: 돌체구스토,C:\dev\ZeroMoa\ZeroMoa\crawl_data\images\캡슐커피\가리발디 디카페인 캡슐커피 64개입-돌체구스토호환 코스트코.jpg
일리 네스프레소 호환캡슐 클라시코 57g 10개입 10개 네스프레소 호환캡슐 클라시코 57g 10개입 10개,캡슐커피/사용머신: 일리,C:\dev\ZeroMoa\ZeroMoa\crawl_data\images\캡슐커피\일리 네스프레소 호환캡슐 클라시코 57g 10개입 10개 네스프레소 호환캡슐 클라시코 57g 10개입 10개.jpg
네슬레 네스카페 돌체구스토 룽고 캡슐커피 6.5g 32개,캡슐커피,C:\dev\ZeroMoa\ZeroMoa\crawl_data\images\캡슐커피\네슬레 네스카페 돌체구스토 룽고 캡슐커피 6.5g 32개.jpg
네슬레 네스프레소 버츄오 에스프레소 3종 캡슐커피,캡슐커피/사용머신: 네스프레소,C:\dev\ZeroMoa\ZeroMoa\crawl_data\images\캡슐커피\네슬레 네스프레소 버츄오 에스프레소 3종 캡슐커피.jpg
네슬레 네스프레소 VertuoLine 에스프레소 캡슐커피 50개,캡슐커피/사용머신: 네스프레소,C:\dev\ZeroMoa\ZeroMoa\crawl_data\images\캡슐커피\네슬레 네스프레소 VertuoLine 에스프레소 캡슐커피 50개.jpg
라바짜 에스프레소 포인트캡슐 크레모소_50팩 100개,캡슐커피/사용머신: 네스프레소,C:\dev\ZeroMoa\ZeroMoa\crawl_data\images\캡슐커피\라바짜 에스프레소 포인트캡슐 크레모소_50팩 100개.jpg
네슬레 네스프레소 캡슐 커피 31종류 룽고 신제품 출시 오리지널 캡슐 캐러멜향,캡슐커피,C:\dev\ZeroMoa\ZeroMoa\crawl_data\images\캡슐커피\네슬레 네스프레소 캡슐 커피 31종류 룽고 신제품 출시 오리지널 캡슐 캐러멜향.jpg
동서식품 맥심 카누 밸런스 디카페인 네스프레소 호환 캡슐 커피 5.7g 10개 4개,캡슐커피,C:\dev\ZeroMoa\ZeroMoa\crawl_data\images\캡슐커피\동서식품 맥심 카누 밸런스 디카페인 네스프레소 호환 캡슐 커피 5.7g 10개 4개.jpg
