Name,Spec,ImageURL
스타벅스 네스프레소 호환캡슐 6종 혼합 에스프레소 디카프 콜롬비아 블론드 카페베로나 하우스블렌드 10개입 6팩,캡슐커피,C:\dev\ZeroMoa\ZeroMoa\crawl_data\images\캡슐커피\스타벅스 네스프레소 호환캡슐 6종 혼합 에스프레소 디카프 콜롬비아 블론드 카페베로나 하우스블렌드 10개입 6팩.jpg
엠즈씨드 폴바셋 바리스타 캡슐 커피 멀티팩,캡슐커피/맛: 혼합/캡슐 총량: 48/돌체구스토 (호환),C:\dev\ZeroMoa\ZeroMoa\crawl_data\images\캡슐커피\엠즈씨드 폴바셋 바리스타 캡슐 커피 멀티팩.jpg
일리 아라비카 캡슐커피 번들,캡슐커피/맛: 에스프레소/캡슐 총량: 63개,C:\dev\ZeroMoa\ZeroMoa\crawl_data\images\캡슐커피\일리 아라비카 캡슐커피 번들.jpg
네슬레 네스카페 돌체구스토 모닝 블렌드 캡슐커피 8.3g 18개입 2개,캡슐커피,C:\dev\ZeroMoa\ZeroMoa\crawl_data\images\캡슐커피\네슬레 네스카페 돌체구스토 모닝 블렌드 캡슐커피 8.3g 18개입 2개.jpg
카피탈리 에카페 캡슐커피 아로마,캡슐커피/맛: 기타/캡슐 총량: 100개/카피탈리,C:\dev\ZeroMoa\ZeroMoa\crawl_data\images\캡슐커피\카피탈리 에카페 캡슐커피 아로마.jpg
네슬레 네스카페 돌체구스토 아메리카노 룽고 캡슐커피,캡슐커피/맛: 혼합/캡슐 총량: 64개/돌체구스토,C:\dev\ZeroMoa\ZeroMoa\crawl_data\images\캡슐커피\네슬레 네스카페 돌체구스토 아메리카노 룽고 캡슐커피.jpg
가리발디 네스프레소 그랑 크루 캡슐커피,캡슐커피/맛: 에스프레소/캡슐 총량: 10개/네스프레소,C:\dev\ZeroMoa\ZeroMoa\crawl_data\images\캡슐커피\가리발디 네스프레소 그랑 크루 캡슐커피.jpg
스타벅스 네스프레소 에스프레소 로스트 캡슐커피 5.3g 10개입 12개,캡슐커피,C:\dev\ZeroMoa\ZeroMoa\crawl_data\images\캡슐커피\스타벅스 네스프레소 에스프레소 로스트 캡슐커피 5.3g 10개입 12개.jpg
까라로 돈 카를로스 에스프레소 바 돌체구스토 호환 캡슐커피,캡슐커피,C:\dev\ZeroMoa\ZeroMoa\crawl_data\images\캡슐커피\까라로 돈 카를로스 에스프레소 바 돌체구스토 호환 캡슐커피.jpg
스타벅스 네스프레소 호환 캡슐 커피 디카페인 10개입 캡슐_디카페인 10개입 1개,캡슐커피,C:\dev\ZeroMoa\ZeroMoa\crawl_data\images\캡슐커피\스타벅스 네스프레소 호환 캡슐 커피 디카페인 10개입 캡슐_디카페인 10개입 1개.jpg
동서식품 맥심 카누 바리스타 머신 전용 캡슐커피 프라우드오션 9.5g 10개입 2개,캡슐커피,C:\dev\ZeroMoa\ZeroMoa\crawl_data\images\캡슐커피\동서식품 맥심 카누 바리스타 머신 전용 캡슐커피 프라우드오션 9.5g 10개입 2개.jpg
이탈리안커피 캡슐커피 6종 32캡슐 돌체구스토 호환캡슐,캡슐커피,C:\dev\ZeroMoa\ZeroMoa\crawl_data\images\캡슐커피\이탈리안커피 캡슐커피 6종 32캡슐 돌체구스토 호환캡슐.jpg
일리 캡슐커피 인텐소 18캡슐,캡슐커피,C:\dev\ZeroMoa\ZeroMoa\crawl_data\images\캡슐커피\일리 캡슐커피 인텐소 18캡슐.jpg
"동서식품 맥심 카누 카누 캡슐커피 벨베티 미디엄 로스트 돌체구스토호환 , 16개입, 3개",캡슐커피,"C:\dev\ZeroMoa\ZeroMoa\crawl_data\images\캡슐커피\동서식품 맥심 카누 카누 캡슐커피 벨베티 미디엄 로스트 돌체구스토호환 , 16개입, 3개.jpg"
"동서식품 맥심 카누 카누 캡슐커피 스모키 다크 로스트 돌체구스토호환 , 16개입, 3개",캡슐커피,"C:\dev\ZeroMoa\ZeroMoa\crawl_data\images\캡슐커피\동서식품 맥심 카누 카누 캡슐커피 스모키 다크 로스트 돌체구스토호환 , 16개입, 3개.jpg"
스타벅스 이탈리안스타일 로스트 by 네스프레소 캡슐커피 5.6g 10개입 6개,캡슐커피,C:\dev\ZeroMoa\ZeroMoa\crawl_data\images\캡슐커피\스타벅스 이탈리안스타일 로스트 by 네스프레소 캡슐커피 5.6g 10개입 6개.jpg
"동서식품 맥심 카누 맥심 캡슐커피 밸런스 디카페인 16개입 돌체구스토호환 , 3개",캡슐커피,"C:\dev\ZeroMoa\ZeroMoa\crawl_data\images\캡슐커피\동서식품 맥심 카누 맥심 캡슐커피 밸런스 디카페인 16개입 돌체구스토호환 , 3개.jpg"
스타벅스 큐리그 디카페인 하우스 72 캡슐 커피,캡슐커피/사용머신: 네스프레소,C:\dev\ZeroMoa\ZeroMoa\crawl_data\images\캡슐커피\스타벅스 큐리그 디카페인 하우스 72 캡슐 커피.jpg
청호나이스 에스프레 아라비카 커피캡슐 낱개 2알,캡슐커피,C:\dev\ZeroMoa\ZeroMoa\crawl_data\images\캡슐커피\청호나이스 에스프레 아라비카 커피캡슐 낱개 2알.jpg
터모제타 이탈리코 캡슐커피 아라비카3박스,캡슐커피,C:\dev\ZeroMoa\ZeroMoa\crawl_data\images\캡슐커피\터모제타 이탈리코 캡슐커피 아라비카3박스.jpg
스타벅스 네스프레소 에스프레소 로스트 빅팩 캡슐커피 18p 5.7g 18개입 2개,캡슐커피,C:\dev\ZeroMoa\ZeroMoa\crawl_data\images\캡슐커피\스타벅스 네스프레소 에스프레소 로스트 빅팩 캡슐커피 18p 5.7g 18개입 2개.jpg
이마트 노브랜드 에스프레소캡슐커피20입,캡슐커피,C:\dev\ZeroMoa\ZeroMoa\crawl_data\images\캡슐커피\이마트 노브랜드 에스프레소캡슐커피20입.jpg
킴보 네스프레소 호환캡슐 인텐소 50P 10P 5EA,캡슐커피,C:\dev\ZeroMoa\ZeroMoa\crawl_data\images\캡슐커피\킴보 네스프레소 호환캡슐 인텐소 50P 10P 5EA.jpg
커피빈 시그니처 블렌드 캡슐 커피 5g 10개입 4개,캡슐커피,C:\dev\ZeroMoa\ZeroMoa\crawl_data\images\캡슐커피\커피빈 시그니처 블렌드 캡슐 커피 5g 10개입 4개.jpg
까라로 돌체구스토 호환 캡슐커피 프리모마티노 _30알 강도4,캡슐커피,C:\dev\ZeroMoa\ZeroMoa\crawl_data\images\캡슐커피\까라로 돌체구스토 호환 캡슐커피 프리모마티노 _30알 강도4.jpg
까라로 네스프레소 호환 캡슐커피 알루미늄 6종,캡슐커피/사용머신: 네스프레소,C:\dev\ZeroMoa\ZeroMoa\crawl_data\images\캡슐커피\까라로 네스프레소 호환 캡슐커피 알루미늄 6종.jpg
크레메소 룽고 크레마 캡슐,캡슐커피,C:\dev\ZeroMoa\ZeroMoa\crawl_data\images\캡슐커피\크레메소 룽고 크레마 캡슐.jpg
스타벅스 네스프레소 캡슐 커피 블랙퍼스트 50캡슐,캡슐커피,C:\dev\ZeroMoa\ZeroMoa\crawl_data\images\캡슐커피\스타벅스 네스프레소 캡슐 커피 블랙퍼스트 50캡슐.jpg
스타벅스 아이스 아메리카노 캡슐커피 by 네스카페 돌체구스토 12캡슐 x 4박스 총 48캡슐,캡슐커피/사용머신: 네스프레소,C:\dev\ZeroMoa\ZeroMoa\crawl_data\images\캡슐커피\스타벅스 아이스 아메리카노 캡슐커피 by 네스카페 돌체구스토 12캡슐 x 4박스 총 48캡슐.jpg
일리 네스프레소 호환 캡슐커피 포르테 5.7g 10개입 3개,캡슐커피,C:\dev\ZeroMoa\ZeroMoa\crawl_data\images\캡슐커피\일리 네스프레소 호환 캡슐커피 포르테 5.7g 10개입 3개.jpg
동서식품 맥심 카누 벨베티 미디엄 로스트 네스프레소 호환 캡슐 커피 57g 6개,캡슐커피,C:\dev\ZeroMoa\ZeroMoa\crawl_data\images\캡슐커피\동서식품 맥심 카누 벨베티 미디엄 로스트 네스프레소 호환 캡슐 커피 57g 6개.jpg
에스프레소캡 이탈리코 클래식 캡슐커피,캡슐커피/맛: 에스프레소/캡슐 총량: 10개/이탈리코,C:\dev\ZeroMoa\ZeroMoa\crawl_data\images\캡슐커피\에스프레소캡 이탈리코 클래식 캡슐커피.jpg
일리 캡슐커피 개별포장 50캡슐 / 100캡슐 개별포장 100캡슐 포르테,캡슐커피,C:\dev\ZeroMoa\ZeroMoa\crawl_data\images\캡슐커피\일리 캡슐커피 개별포장 50캡슐 _ 100캡슐 개별포장 100캡슐 포르테.jpg
동서식품 맥심 카누 벨베티 미디엄 로스트 네스프레소 호환 캡슐 커피 5.7g 10개입 1개,캡슐커피,C:\dev\ZeroMoa\ZeroMoa\crawl_data\images\캡슐커피\동서식품 맥심 카누 벨베티 미디엄 로스트 네스프레소 호환 캡슐 커피 5.7g 10개입 1개.jpg
네슬레 네스카페 돌체구스토 아메리카노 마일드 7.5g 16개입 4개,캡슐커피,C:\dev\ZeroMoa\ZeroMoa\crawl_data\images\캡슐커피\네슬레 네스카페 돌체구스토 아메리카노 마일드 7.5g 16개입 4개.jpg
동서식품 맥심 카누 바리스타 머신 전용 캡슐커피 케어링스타 디카페인 9.5g 20개,캡슐커피,C:\dev\ZeroMoa\ZeroMoa\crawl_data\images\캡슐커피\동서식품 맥심 카누 바리스타 머신 전용 캡슐커피 케어링스타 디카페인 9.5g 20개.jpg
동서식품 맥심 카누 바리스타 머신 전용 캡슐커피 조이풀스노우 9.5g 10개입 2개,캡슐커피,C:\dev\ZeroMoa\ZeroMoa\crawl_data\images\캡슐커피\동서식품 맥심 카누 바리스타 머신 전용 캡슐커피 조이풀스노우 9.5g 10개입 2개.jpg
이디야 페르소나 블렌드 캡슐커피 8개입,캡슐커피,C:\dev\ZeroMoa\ZeroMoa\crawl_data\images\캡슐커피\이디야 페르소나 블렌드 캡슐커피 8개입.jpg
네슬레 네스프레소 버츄오 알티시오 디카페나토 7g 10개입 4개,캡슐커피,C:\dev\ZeroMoa\ZeroMoa\crawl_data\images\캡슐커피\네슬레 네스프레소 버츄오 알티시오 디카페나토 7g 10개입 4개.jpg
동서식품 맥심 카누 밸런스 디카페인 네스프레소 호환 캡슐 커피 5.7g 10개 2개,캡슐커피,C:\dev\ZeroMoa\ZeroMoa\crawl_data\images\캡슐커피\동서식품 맥심 카누 밸런스 디카페인 네스프레소 호환 캡슐 커피 5.7g 10개 2개.jpg
스타벅스 네스프레소 카페 베로나 캡슐커피 120캡슐 세트,캡슐커피/사용머신: 돌체구스토,C:\dev\ZeroMoa\ZeroMoa\crawl_data\images\캡슐커피\스타벅스 네스프레소 카페 베로나 캡슐커피 120캡슐 세트.jpg
스타벅스 네스프레소 캡슐커피 카페 베로나 70캡슐,캡슐커피,C:\dev\ZeroMoa\ZeroMoa\crawl_data\images\캡슐커피\스타벅스 네스프레소 캡슐커피 카페 베로나 70캡슐.jpg
일리 미타카 i-1 캡슐커피100개 라바짜 킴보 호환,캡슐커피,C:\dev\ZeroMoa\ZeroMoa\crawl_data\images\캡슐커피\일리 미타카 i-1 캡슐커피100개 라바짜 킴보 호환.jpg
캐빈잇 돌체구스토 호환 캡슐커피 모모라 12개입,캡슐커피,C:\dev\ZeroMoa\ZeroMoa\crawl_data\images\캡슐커피\캐빈잇 돌체구스토 호환 캡슐커피 모모라 12개입.jpg
일리 클래시코 그라운드 커피 250g,캡슐커피/총량: ~10개입,C:\dev\ZeroMoa\ZeroMoa\crawl_data\images\캡슐커피\일리 클래시코 그라운드 커피 250g.jpg
일리 에스프레소 호환 캡슐 미디움 10T 57G,캡슐커피,C:\dev\ZeroMoa\ZeroMoa\crawl_data\images\캡슐커피\일리 에스프레소 호환 캡슐 미디움 10T 57G.jpg
일리 에스프레소 호환 캡슐 다크 10T 57G,캡슐커피,C:\dev\ZeroMoa\ZeroMoa\crawl_data\images\캡슐커피\일리 에스프레소 호환 캡슐 다크 10T 57G.jpg
일리 캡슐 커피 다크 캡슐커피 6.7g 18개입 5개,캡슐커피,C:\dev\ZeroMoa\ZeroMoa\crawl_data\images\캡슐커피\일리 캡슐 커피 다크 캡슐커피 6.7g 18개입 5개.jpg
까라로 돌체구스토 호환 캡슐커피 브라질 32캡슐,캡슐커피/사용머신: 돌체구스토,C:\dev\ZeroMoa\ZeroMoa\crawl_data\images\캡슐커피\까라로 돌체구스토 호환 캡슐커피 브라질 32캡슐.jpg
스타벅스 돌체구스토 카페라테 캡슐커피 36개,캡슐커피,C:\dev\ZeroMoa\ZeroMoa\crawl_data\images\캡슐커피\스타벅스 돌체구스토 카페라테 캡슐커피 36개.jpg
일리 18캡슐 디카페인 18입,캡슐커피,C:\dev\ZeroMoa\ZeroMoa\crawl_data\images\캡슐커피\일리 18캡슐 디카페인 18입.jpg
AGF 블랜디 포션커피 저당 6X12봉 12개,캡슐커피,C:\dev\ZeroMoa\ZeroMoa\crawl_data\images\캡슐커피\AGF 블랜디 포션커피 저당 6X12봉 12개.jpg
쟈뎅 레브 캡슐커피 웜 브리즈 10P 5박스,캡슐커피,C:\dev\ZeroMoa\ZeroMoa\crawl_data\images\캡슐커피\쟈뎅 레브 캡슐커피 웜 브리즈 10P 5박스.jpg
네슬레 네스프레소 버츄오 캐러멜향 쿠키 캡슐커피 12.5g 10개입 3개,캡슐커피,C:\dev\ZeroMoa\ZeroMoa\crawl_data\images\캡슐커피\네슬레 네스프레소 버츄오 캐러멜향 쿠키 캡슐커피 12.5g 10개입 3개.jpg
스타벅스 싱글 오리진 콜롬비아 캡슐커피 5개 12개입 5.5g,캡슐커피,C:\dev\ZeroMoa\ZeroMoa\crawl_data\images\캡슐커피\스타벅스 싱글 오리진 콜롬비아 캡슐커피 5개 12개입 5.5g.jpg
네슬레 네스프레소 버츄오 볼테소 캡슐커피 5.2g 10개입 6개,캡슐커피,C:\dev\ZeroMoa\ZeroMoa\crawl_data\images\캡슐커피\네슬레 네스프레소 버츄오 볼테소 캡슐커피 5.2g 10개입 6개.jpg
스타벅스 캡슐커피 9종 180캡슐 1개,캡슐커피,C:\dev\ZeroMoa\ZeroMoa\crawl_data\images\캡슐커피\스타벅스 캡슐커피 9종 180캡슐 1개.jpg
동서식품 맥심 카누 카누 바리스타 전용캡슐 싱글 오리진 에티오피아 예가체프 10개입 4팩,캡슐커피,C:\dev\ZeroMoa\ZeroMoa\crawl_data\images\캡슐커피\동서식품 맥심 카누 카누 바리스타 전용캡슐 싱글 오리진 에티오피아 예가체프 10개입 4팩.jpg
쟈뎅 한잔의원두커피 헤이즐넛향원두커피백15P 원두커피 티백 헤이즐넛향원두커피백,캡슐커피,C:\dev\ZeroMoa\ZeroMoa\crawl_data\images\캡슐커피\쟈뎅 한잔의원두커피 헤이즐넛향원두커피백15P 원두커피 티백 헤이즐넛향원두커피백.jpg
동서식품 맥심 카누 네스프레소 호환캡슐 릴렉스디카페인 57g 10캡슐,캡슐커피/사용머신: 네스프레소,C:\dev\ZeroMoa\ZeroMoa\crawl_data\images\캡슐커피\동서식품 맥심 카누 네스프레소 호환캡슐 릴렉스디카페인 57g 10캡슐.jpg
AGF 블랜디포션커피 무가당 저당 카라멜오레 3종 1봉 무가당 6p,캡슐커피,C:\dev\ZeroMoa\ZeroMoa\crawl_data\images\캡슐커피\AGF 블랜디포션커피 무가당 저당 카라멜오레 3종 1봉 무가당 6p.jpg
네슬레 네스프레소 오리지널 캡슐커피 비엔나 리니지오 룽고 10캡슐,캡슐커피,C:\dev\ZeroMoa\ZeroMoa\crawl_data\images\캡슐커피\네슬레 네스프레소 오리지널 캡슐커피 비엔나 리니지오 룽고 10캡슐.jpg
일리 캡슐커피 18캡슐 6팩 6.7g 18개 6개,캡슐커피,C:\dev\ZeroMoa\ZeroMoa\crawl_data\images\캡슐커피\일리 캡슐커피 18캡슐 6팩 6.7g 18개 6개.jpg
AGF 블랜디 포션커피 무가당 6개입 액상커피 18g 4개,캡슐커피,C:\dev\ZeroMoa\ZeroMoa\crawl_data\images\캡슐커피\AGF 블랜디 포션커피 무가당 6개입 액상커피 18g 4개.jpg
스타벅스 캡슐커피 by 돌체구스토 파이크플레이스 12개입x3개,캡슐커피/사용머신: 돌체구스토,C:\dev\ZeroMoa\ZeroMoa\crawl_data\images\캡슐커피\스타벅스 캡슐커피 by 돌체구스토 파이크플레이스 12개입x3개.jpg
스타벅스 돌체구스토 캡슐 카푸치노 12입x 3개,캡슐커피/사용머신: 돌체구스토,C:\dev\ZeroMoa\ZeroMoa\crawl_data\images\캡슐커피\스타벅스 돌체구스토 캡슐 카푸치노 12입x 3개.jpg
쟈뎅 레브 캡슐커피 디카페인 10P 5박스,캡슐커피,C:\dev\ZeroMoa\ZeroMoa\crawl_data\images\캡슐커피\쟈뎅 레브 캡슐커피 디카페인 10P 5박스.jpg
네슬레 네스프레소 키아로 캡슐커피 4.8g 10개입 3개,캡슐커피,C:\dev\ZeroMoa\ZeroMoa\crawl_data\images\캡슐커피\네슬레 네스프레소 키아로 캡슐커피 4.8g 10개입 3개.jpg
어라운지 데일리 드립백 커피 에티오피아12p 10g + 마일드12p 10g 세트 24개입 2개,캡슐커피/사용머신: 네스프레소,
청호나이스 에스프레 아르떼 커피캡슐 낱개 2알,캡슐커피,C:\dev\ZeroMoa\ZeroMoa\crawl_data\images\캡슐커피\청호나이스 에스프레 아르떼 커피캡슐 낱개 2알.jpg
일리 커피 룽고 캡슐커피 6.2g 18개입 1개,캡슐커피,C:\dev\ZeroMoa\ZeroMoa\crawl_data\images\캡슐커피\일리 커피 룽고 캡슐커피 6.2g 18개입 1개.jpg
네슬레 네스프레소 버츄오 더블 에스프레소 돌체 캡슐커피 9.5g 10개입 2개,캡슐커피,C:\dev\ZeroMoa\ZeroMoa\crawl_data\images\캡슐커피\네슬레 네스프레소 버츄오 더블 에스프레소 돌체 캡슐커피 9.5g 10개입 2개.jpg
"스타벅스 by 네스프레소 브렉퍼스트 블렌드 캡슐커피, 5.6g, 10개입, 5개",캡슐커피/사용머신: 네스프레소,"C:\dev\ZeroMoa\ZeroMoa\crawl_data\images\캡슐커피\스타벅스 by 네스프레소 브렉퍼스트 블렌드 캡슐커피, 5.6g, 10개입, 5개.jpg"
쟈뎅 레브 캡슐커피 싱글 오리진 콜롬비아 10P 10박스,캡슐커피,C:\dev\ZeroMoa\ZeroMoa\crawl_data\images\캡슐커피\쟈뎅 레브 캡슐커피 싱글 오리진 콜롬비아 10P 10박스.jpg
커클랜드 베스트 모먼트 캡슐커피 96개입 돌체구스토 호환 8g 96개 1개,캡슐커피,C:\dev\ZeroMoa\ZeroMoa\crawl_data\images\캡슐커피\커클랜드 베스트 모먼트 캡슐커피 96개입 돌체구스토 호환 8g 96개 1개.jpg
네슬레 네스프레소 버츄오 이니지오 캡슐커피 10g 10개입 2개,캡슐커피,C:\dev\ZeroMoa\ZeroMoa\crawl_data\images\캡슐커피\네슬레 네스프레소 버츄오 이니지오 캡슐커피 10g 10개입 2개.jpg
던킨도너츠 디즈니 에스프레소 블렌드 캡슐커피 돌체구스토 호환 8g 12개입 3개,캡슐커피,C:\dev\ZeroMoa\ZeroMoa\crawl_data\images\캡슐커피\던킨도너츠 디즈니 에스프레소 블렌드 캡슐커피 돌체구스토 호환 8g 12개입 3개.jpg
네슬레 네스카페 돌체구스토 디카페인 아메리카노 캡슐커피 8g 16개입 5개,캡슐커피,C:\dev\ZeroMoa\ZeroMoa\crawl_data\images\캡슐커피\네슬레 네스카페 돌체구스토 디카페인 아메리카노 캡슐커피 8g 16개입 5개.jpg
일리 클라시코 미디움 캡슐커피 6.7g 36개,캡슐커피,C:\dev\ZeroMoa\ZeroMoa\crawl_data\images\캡슐커피\일리 클라시코 미디움 캡슐커피 6.7g 36개.jpg
스타벅스 네스프레소 호환캡슐 6종 혼합 에스프레소 디카프 콜롬비아 블론드 카페베로나 하우스블렌드 5.7g 1세트,캡슐커피,C:\dev\ZeroMoa\ZeroMoa\crawl_data\images\캡슐커피\스타벅스 네스프레소 호환캡슐 6종 혼합 에스프레소 디카프 콜롬비아 블론드 카페베로나 하우스블렌드 5.7g 1세트.jpg
일리 다크로스트 캡슐커피 6.7g 21개입 5개,캡슐커피,C:\dev\ZeroMoa\ZeroMoa\crawl_data\images\캡슐커피\일리 다크로스트 캡슐커피 6.7g 21개입 5개.jpg
네슬레 네스프레소 카피탈리 커피캡슐 5종 5.5g 1개 120개입,캡슐커피,C:\dev\ZeroMoa\ZeroMoa\crawl_data\images\캡슐커피\네슬레 네스프레소 카피탈리 커피캡슐 5종 5.5g 1개 120개입.jpg
쟈뎅 레브 네스프레소 호환 캡슐커피 7종세트+쇼핑백,캡슐커피,
네슬레 네스프레소 프로페셔널 디카페나토 커피 캡슐 50개입 회사용 기업용,캡슐커피,C:\dev\ZeroMoa\ZeroMoa\crawl_data\images\캡슐커피\네슬레 네스프레소 프로페셔널 디카페나토 커피 캡슐 50개입 회사용 기업용.jpg
동서식품 맥심 카누 모카골드 커피믹스 21호 쿠폰가,캡슐커피,C:\dev\ZeroMoa\ZeroMoa\crawl_data\images\캡슐커피\동서식품 맥심 카누 모카골드 커피믹스 21호 쿠폰가.jpg
까라로 디카페인 네스프레소 호환 캡슐커피 알루미늄,캡슐커피/사용머신: 네스프레소,C:\dev\ZeroMoa\ZeroMoa\crawl_data\images\캡슐커피\까라로 디카페인 네스프레소 호환 캡슐커피 알루미늄.jpg
라바짜 크레마에구스토 포르테 네스프레소 호환캡슐 커피 10개입 알루미늄 캡슐,캡슐커피,C:\dev\ZeroMoa\ZeroMoa\crawl_data\images\캡슐커피\라바짜 크레마에구스토 포르테 네스프레소 호환캡슐 커피 10개입 알루미늄 캡슐.jpg
일리 다크로스트 캡슐커피 140.7g 3통,캡슐커피,C:\dev\ZeroMoa\ZeroMoa\crawl_data\images\캡슐커피\일리 다크로스트 캡슐커피 140.7g 3통.jpg
일리 캡슐 커피 18캡슐 팩 1+1 아메리카노 인텐소 외 28종,캡슐커피,
동서식품 맥심 카누 오리지날 병 100gx1개 + 워터 보틀,캡슐커피,
맥널티 1+1+1 콜롬비아 슈프리모 8gx7개입x3개 핸드드립 원두커피 드립백커피 8g 3개 7개입,캡슐커피,
일리 캡슐커피 50P 맛별 10P 5팩 혼합구성 네스프레소 호환,캡슐커피,C:\dev\ZeroMoa\ZeroMoa\crawl_data\images\캡슐커피\일리 캡슐커피 50P 맛별 10P 5팩 혼합구성 네스프레소 호환.jpg
네슬레 네스프레소 코르토 1개 10개입 5.8g,캡슐커피,C:\dev\ZeroMoa\ZeroMoa\crawl_data\images\캡슐커피\네슬레 네스프레소 코르토 1개 10개입 5.8g.jpg
네슬레 네스프레소 버츄오 캡슐커피 로스티드 헤이즐넛향 12.5g 10개,캡슐커피,C:\dev\ZeroMoa\ZeroMoa\crawl_data\images\캡슐커피\네슬레 네스프레소 버츄오 캡슐커피 로스티드 헤이즐넛향 12.5g 10개.jpg
올카페 캡슐커피 네스프레소호환 랜덤230개 커피캡슐,캡슐커피/사용머신: 네스프레소,C:\dev\ZeroMoa\ZeroMoa\crawl_data\images\캡슐커피\올카페 캡슐커피 네스프레소호환 랜덤230개 커피캡슐.jpg
스타벅스 캡슐커피 by 네스프레소 10종 호환,캡슐커피,C:\dev\ZeroMoa\ZeroMoa\crawl_data\images\캡슐커피\스타벅스 캡슐커피 by 네스프레소 10종 호환.jpg
스타벅스 파이크 플레이스 로스트 캡슐커피 5.3g 10개입 12개,캡슐커피,C:\dev\ZeroMoa\ZeroMoa\crawl_data\images\캡슐커피\스타벅스 파이크 플레이스 로스트 캡슐커피 5.3g 10개입 12개.jpg
네슬레 네스프레소 버츄오 캡슐커피 바리스타 로스티드 헤이즐넛향 커피 10캡슐 12.5g 3개 10개입,캡슐커피,C:\dev\ZeroMoa\ZeroMoa\crawl_data\images\캡슐커피\네슬레 네스프레소 버츄오 캡슐커피 바리스타 로스티드 헤이즐넛향 커피 10캡슐 12.5g 3개 10개입.jpg
동서식품 맥심 카누 바리스타 싱글 오리진 인도네시아 수마트라 95g 캡슐커피 머신 전용 4개 묶음 40캡슐,캡슐커피,C:\dev\ZeroMoa\ZeroMoa\crawl_data\images\캡슐커피\동서식품 맥심 카누 바리스타 싱글 오리진 인도네시아 수마트라 95g 캡슐커피 머신 전용 4개 묶음 40캡슐.jpg
네슬레 네스프레소 바리스타 크리에이션 스쿠로 캡슐커피 5.5g 10개입 2개,캡슐커피,C:\dev\ZeroMoa\ZeroMoa\crawl_data\images\캡슐커피\네슬레 네스프레소 바리스타 크리에이션 스쿠로 캡슐커피 5.5g 10개입 2개.jpg
네슬레 네스카페 돌체구스토 룽고 디카페인 캡슐커피 7g 16개입 6개,캡슐커피,C:\dev\ZeroMoa\ZeroMoa\crawl_data\images\캡슐커피\네슬레 네스카페 돌체구스토 룽고 디카페인 캡슐커피 7g 16개입 6개.jpg
일리 네스프레소 호환 캡슐커피 3종 혼합 30캡슐,캡슐커피/사용머신: 네스프레소,C:\dev\ZeroMoa\ZeroMoa\crawl_data\images\캡슐커피\일리 네스프레소 호환 캡슐커피 3종 혼합 30캡슐.jpg
스타벅스 카페라테 by 네스카페 돌체구스토 10.1g 12개입 5개,캡슐커피,C:\dev\ZeroMoa\ZeroMoa\crawl_data\images\캡슐커피\스타벅스 카페라테 by 네스카페 돌체구스토 10.1g 12개입 5개.jpg
동서식품 맥심 카누 바리스타 싱글 오리진 에티오피아 예가체프 95g 캡슐커피 머신 전용 4개 묶음 40캡슐,캡슐커피,C:\dev\ZeroMoa\ZeroMoa\crawl_data\images\캡슐커피\동서식품 맥심 카누 바리스타 싱글 오리진 에티오피아 예가체프 95g 캡슐커피 머신 전용 4개 묶음 40캡슐.jpg
네슬레 네스프레소 이스피라치오네 리스트레토 이탈리아노 캡슐커피 5.7g 10개입 4개,캡슐커피,C:\dev\ZeroMoa\ZeroMoa\crawl_data\images\캡슐커피\네슬레 네스프레소 이스피라치오네 리스트레토 이탈리아노 캡슐커피 5.7g 10개입 4개.jpg
스타벅스 카페라테 돌체구스토 캡슐커피 12개입 5개,캡슐커피/사용머신: 네스프레소,C:\dev\ZeroMoa\ZeroMoa\crawl_data\images\캡슐커피\스타벅스 카페라테 돌체구스토 캡슐커피 12개입 5개.jpg
스타벅스 에스프레소 네스프레소 전용 캡슐 120개 10입X12줄,캡슐커피,C:\dev\ZeroMoa\ZeroMoa\crawl_data\images\캡슐커피\스타벅스 에스프레소 네스프레소 전용 캡슐 120개 10입X12줄.jpg
투썸플레이스 에이리스트 다크 블렌드 캡슐커피,캡슐커피/사용머신: 네스프레소,C:\dev\ZeroMoa\ZeroMoa\crawl_data\images\캡슐커피\투썸플레이스 에이리스트 다크 블렌드 캡슐커피.jpg
일리 브라질 캡슐커피 6.7g 18개입 2개,캡슐커피,C:\dev\ZeroMoa\ZeroMoa\crawl_data\images\캡슐커피\일리 브라질 캡슐커피 6.7g 18개입 2개.jpg
할리스커피 캡슐커피 이클립스 블렌드 30개,캡슐커피/사용머신: 네스프레소,C:\dev\ZeroMoa\ZeroMoa\crawl_data\images\캡슐커피\할리스커피 캡슐커피 이클립스 블렌드 30개.jpg
동서식품 맥심 카누 캡슐커피 릴렉스 디카페인 10개입 4개 네스프레소호환,캡슐커피,C:\dev\ZeroMoa\ZeroMoa\crawl_data\images\캡슐커피\동서식품 맥심 카누 캡슐커피 릴렉스 디카페인 10개입 4개 네스프레소호환.jpg
동서식품 카누 맥심 카누 다크 로스트 10T+마일드 로스트 10T /아메리카노/블랙커피,캡슐커피,
동서식품 맥심 카누 바리스타 머신 전용 캡슐커피 케어링스타 디카페인 9.5g 10개입 2개,캡슐커피,C:\dev\ZeroMoa\ZeroMoa\crawl_data\images\캡슐커피\동서식품 맥심 카누 바리스타 머신 전용 캡슐커피 케어링스타 디카페인 9.5g 10개입 2개.jpg
