Name,Spec,Name
브라운하우스 커피필그림스 인도네시아 수마트라 만델링 G1,원두커피/파우치형/홀빈/분쇄여부: 선택/원산지: 인도네시아
브라운하우스 커피필그림스 케냐 AA,원두커피/파우치형/홀빈/분쇄여부: 선택/로스팅정도: 중간/원산지: 케냐 로스팅 단계: 시티 로스팅
브라운하우스 커피필그림스 코스타리카 SHB,원두커피/파우치형/홀빈/분쇄여부: 선택/원산지: 코스타리카
브라운하우스 커피필그림스 콜롬비아 파티오 보니토 슈프리모,원두커피/파우치형/홀빈/분쇄여부: 선택/원산지: 콜롬비아
브라운하우스 커피필그림스 프로그레스,"원두커피/파우치형/홀빈/분쇄여부: 선택/원산지: 브라질, 베트남, 콜롬비아 외"
브라운하우스 프라넬 브라질 세하도 내츄럴,원두커피/파우치형/홀빈/분쇄여부: 선택/로스팅정도: 약함/원산지: 브라질 로스팅 단계: 하이 로스팅~시티 로스팅
브라운하우스 프라넬 이클립스 골드,"원두커피/파우치형/홀빈/분쇄여부: 선택/로스팅정도: 강함/원산지: 브라질, 콜롬비아, 에티오피아, 과테말라, 케냐, 인도네시아 로스팅 단계: 풀시티 로스팅"
브라운하우스 프라넬 인도네시아 수마트라 만델링 G1,원두커피/파우치형/홀빈/분쇄여부: 선택/로스팅정도: 중간/원산지: 인도네시아 로스팅 단계: 하이 로스팅~시티 로스팅
브라운하우스 프라넬 케냐 AA,원두커피/파우치형/홀빈/분쇄여부: 선택/로스팅정도: 중간/원산지: 케냐 로스팅 단계: 시티 로스팅
브라운하우스 프라넬 콜롬비아 파티오 보니토 슈프리모,원두커피/파우치형/홀빈/분쇄여부: 선택/로스팅정도: 중간/원산지: 콜롬비아 로스팅 단계: 하이 로스팅~시티 로스팅
브라운하우스 프라넬 트레디셔널 다크,"원두커피/원물(잎차)/파우치형/홀빈/분쇄여부: X/원산지: 브라질, 콜롬비아 외"
브라운하우스 프라넬 포레스트 홀론,"원두커피/파우치형/홀빈/분쇄여부: 선택/로스팅정도: 강함/원산지: 브라질, 인도네시아 외 로스팅 단계: 풀시티 로스팅"
블랙메디슨 원두커피,원두커피/드립백
블랙빈스 과테말라 안티구아,원두커피/홀빈/분쇄여부: 선택/로스팅정도: 중간/원산지: 과테말라 로스팅 단계: 시티 로스팅
블랙빈스 베트남 블루드래곤 로부스타 워시드 G1,원두커피/파우치형/홀빈/분쇄여부: 선택/로스팅정도: 중간/원산지: 베트남 로스팅 단계: 시티 로스팅~풀시티 로스팅
블랙빈스 에디오피아 예가체프 G2,원두커피/드립백
블랙빈스 인도네시아 만델링,원두커피/홀빈/분쇄여부: 선택/로스팅정도: 강함/원산지: 인도네시아 로스팅 단계: 풀시티 로스팅
블랙빈스 케냐 AA,원두커피/홀빈/분쇄여부: 선택/로스팅정도: 중간/원산지: 케냐 로스팅 단계: 시티 로스팅~풀시티 로스팅
블랙빈스 코스타리카 따라주,원두커피/홀빈/분쇄여부: 선택/로스팅정도: 중간/원산지: 코스타리카 로스팅 단계: 하이 로스팅~시티 로스팅
블루보틀커피 나이트 라이트 디카페인,"원두커피/원물(잎차)/파우치형/홀빈/분쇄여부: X/
[맛집] 블루보틀커피/원산지: 페루"
블루보틀커피 벨라 도노반,"원두커피/원물(잎차)/파우치형/홀빈/분쇄여부: X/
[맛집] 블루보틀커피/원산지: 에티오피아 60%, 과테말라 20% 외 20%"
블루보틀커피 벨라 도노반 홀빈,원두커피/드립백
블루보틀커피 쓰리 아프리카 홀빈,원두커피/드립백
블루커피코리아 PNG 블루마운틴 100%,원두커피/파우치형/홀빈/분쇄여부: 선택/로스팅정도: 중간/원산지: 자메이카 로스팅 단계: 시티 로스팅
블루커피코리아 원두커피,원두커피/드립백
빈스월드커피 갓 볶은 명품 브라질 세라도 원두커피,원두커피/드립백
빈스월드커피 디카페인 과테말라 우에우에테낭고,원두커피/파우치형/홀빈/분쇄여부: 선택/원산지: 과테말라
빈스월드커피 디카페인 에디오피아 시다모,원두커피/파우치형/홀빈/분쇄여부: 선택/원산지: 에티오피아
빈스월드커피 디카페인 콜롬비아,원두커피/파우치형/홀빈/분쇄여부: 선택/원산지: 콜롬비아
빈스월드커피 멕시코 알투라 원두커피,원두커피/드립백/파우치형/홀빈
빈스월드커피 볼리비아 원두커피,원두커피/드립백/파우치형/홀빈
빈스월드커피 브라질 산토스 원두커피,원두커피/파우치형/홀빈/분쇄여부: 선택/원산지: 브라질
빈스월드커피 블랜딩 스윗드림,"원두커피/파우치형/홀빈/분쇄여부: 선택/원산지: 콜롬비아, 쿠바"
빈스월드커피 블렌딩/부드러운풍미와 구수한 향가 조화로운 클래식원두커피,원두커피/드립백
빈스월드커피 블렌딩/진한 향미 묵직한 바디감 고소한 맛이 느껴지는 오리지널원두커피,원두커피/드립백
빈스월드커피 빈스월드 블렌딩 원두커피,원두커피
빈스월드커피 에디오피아 시다모 G2 원두커피,원두커피/홀빈
빈스월드커피 에디오피아 예가체프 원두커피,원두커피
빈스월드커피 온두라스 SHG 원두커피,원두커피/드립백/파우치형/홀빈
빈스월드커피 인도네시아 만델링 G1 원두커피,원두커피
빈스월드커피 자메이카 블루마운틴 G1,원두커피/드립백/파우치형/홀빈
빈스월드커피 초콜릿향과 산뜻한 아로마가 있는 시그니처원두커피,원두커피/드립백
빈스월드커피 케냐 AA 원두커피,원두커피/드립백/파우치형/홀빈
빈스월드커피 코스타리카 따라주 원두커피,원두커피
빈스월드커피 탄자니아 AA 더치커피,원두커피
빈스월드커피 탄자니아 AA 원두커피,원두커피
빈스월드커피 파나마 SHB 원두커피,원두커피/리필형/드립백/파우치형/홀빈
빈스월드커피 파나마 게이샤,원두커피/드립백
빈스월드커피 파푸아 뉴기니 AA,원두커피
빈스프레소 온두라스 SHG,원두커피/파우치형/홀빈/분쇄여부: 선택/원산지: 온두라스
빈스프레소 인디아 몬순드 말라바 AA,원두커피/파우치형/홀빈/분쇄여부: 선택/원산지: 인도
빈스프레소 탄자니아 AA,원두커피/파우치형/홀빈/분쇄여부: 선택/원산지: 탄자니아
빈이지 커피 원두,원두커피/리필형/드립백/분쇄여부: 선택
사라리커피 모코나 모코나 에스프레소 커피,원두커피/분쇄여부: O
사와이커피 사와이 커피 모카 블렌드 드립백 10P,원두커피/드립백
세일즈카페 과테말라 안티구아 SHB,원두커피/파우치형/홀빈/분쇄여부: 선택/로스팅정도: 강함/원산지: 과테말라 로스팅 단계: 풀시티 로스팅
세일즈카페 멕시코 알투라 SHB 원두커피,원두커피/리필형/홀빈/원산지: 외국산
세일즈카페 모카블렌드 원두커피,원두커피/리필형/홀빈/원산지: 외국산
세일즈카페 블루마운틴 스타일 블렌드,"원두커피/파우치형/홀빈/분쇄여부: 선택/로스팅정도: 중간/원산지: 브라질, 에티오피아, 과테말라, 자메이카 로스팅 단계: 시티 로스팅"
세일즈카페 아이스 블렌드,"원두커피/파우치형/홀빈/분쇄여부: 선택/로스팅정도: 강함/원산지: 브라질, 과테말라, 콜롬비아, 파푸아뉴기니 로스팅 단계: 풀시티 로스팅"
세일즈카페 에스프레소 에시디 블렌드,"원두커피/파우치형/홀빈/분쇄여부: 선택/로스팅정도: 강함/원산지: 콜롬비아, 브라질, 인도네시아, 에티오피아 로스팅 단계: 풀시티 로스팅"
세일즈카페 에티오피아 모카 하라 원두커피,원두커피/리필형/드립백/파우치형
세일즈카페 에티오피아 시다모 G2 원두커피,원두커피/리필형/드립백/파우치형
세일즈카페 에티오피아 예가체프,원두커피/파우치형/홀빈/분쇄여부: 선택/로스팅정도: 중간/원산지: 에티오피아 로스팅 단계: 시티 로스팅
세일즈카페 에티오피아 예가체프 선드라이 원두커피,원두커피/리필형/드립백/파우치형
세일즈카페 에티오피아 예가체프 원두커피,원두커피/리필형
세일즈카페 온두라스 SHG 원두커피,원두커피/리필형/드립백/파우치형/홀빈
세일즈카페 우간다 카갈라니 AA,원두커피/파우치형/홀빈/분쇄여부: 선택/로스팅정도: 강함/원산지: 우간다 로스팅 단계: 풀시티 로스팅
세일즈카페 원두 커피,원두커피/드립백/파우치형/분쇄여부: 선택
세일즈카페 원두커피,원두커피/분쇄여부: 선택
세일즈카페 인도네시아 수마트라 만델링 분쇄안함원두,원두커피/리필형/홀빈/원산지: 외국산
세일즈카페 자몽 향 원두커피,원두커피/파우치형/홀빈/분쇄여부: 선택/원산지: 브라질 외 로스팅 단계: 시티 로스팅
세일즈카페 코스타리카 SHB 따라주 원두커피,원두커피/리필형/홀빈/원산지: 외국산
세일즈카페 코코넛 향 원두커피,원두커피/파우치형/홀빈/분쇄여부: 선택/로스팅정도: 중간/원산지: 브라질 외 로스팅 단계: 시티 로스팅
세일즈카페 코피루왁 수마트라 아라비카,원두커피/파우치형/홀빈/분쇄여부: 선택/로스팅정도: 중간/원산지: 인도네시아 로스팅 단계: 시티 로스팅
세일즈카페 콜롬비아 수프리모,원두커피/파우치형/홀빈/분쇄여부: 선택/원산지: 콜롬비아 로스팅 단계: 시티 로스팅
세일즈카페 탄자니아 AA 원두커피,원두커피/리필형/홀빈/원산지: 외국산
세일즈카페 파나마 SHB 원두커피,원두커피/리필형/홀빈/원산지: 외국산
세일즈카페 파푸아뉴기니 원두커피,원두커피/리필형/홀빈/원산지: 외국산
세일즈카페 프렌치바닐라,원두커피/파우치형/홀빈/분쇄여부: 선택/로스팅정도: 중간/원산지: 브라질 외 로스팅 단계: 시티 로스팅
세일즈카페 하와이안 코나 엑스트라 팬시,원두커피/파우치형/홀빈/분쇄여부: 선택/로스팅정도: 약함/원산지: 하와이 로스팅 단계: 시티 로스팅
세일즈카페 하우스 블렌드,"원두커피/파우치형/홀빈/분쇄여부: 선택/로스팅정도: 중간/원산지: 과테말라, 콜롬비아, 브라질, 에티오피아 로스팅 단계: 시티 로스팅"
세일즈카페 허니버터 향 원두커피,원두커피/파우치형/홀빈/분쇄여부: 선택/원산지: 브라질 외 로스팅 단계: 시티 로스팅
세일즈카페 헤이즐넛 마일드,원두커피/파우치형/홀빈/분쇄여부: 선택/원산지: 브라질 외 로스팅 단계: 시티 로스팅
소르방커피 베트남 루브스타 G1 원두커피,원두커피
소르방커피 원두커피,원두커피/드립백/분쇄여부: 선택
손맛커피 원두커피,원두커피/드립백
손맛커피 콜롬비아 디카페인 싱글오리진,원두커피/드립백
솔투스인터테셔널 달로쯔 달로쯔 사이코바리스타 옵세션 원두커피,원두커피/드립백/파우치형/홀빈
솔투스인터테셔널 달로쯔 딜라이트 로스트 오리지널 블렌드,"원두커피/홀빈/분쇄여부: 선택/원산지: 콜롬비아, 에티오피아, 베트남, 인도"
스나인 쁘띠 다크,원두커피/드립백
스타루빈 루왁 발효커피 원두커피 강릉 루와,원두커피/드립백
스타벅스 Starbucks Dark Caffe Verona Ground Coffee,원두커피/드립백
스타벅스 Starbucks Dark French Roast Ground Coffee,원두커피/드립백
스타벅스 Starbucks Italian Roast Dark Ground Coffee,원두커피/드립백
스타벅스 Starbucks Medium House Blend Ground Coffee,원두커피/드립백
스타벅스 Starbucks Mocha Coffee Luscious Chocolaty,원두커피/드립백
스타벅스 Starbucks VIA Decaf Italian Roast Coffee입,인스턴트커피/원두커피/스틱형
스타벅스 골든 터메릭 그라운드 커피,원두커피/분말/파우치형/홀빈/분쇄여부: O
스타벅스 다크 에스프레소 로스트 원두커피,원두커피/리필형/드립백/파우치형/홀빈/로스팅정도: 강함
스타벅스 다크 프렌치 로스트 그라운드 커피,원두커피/리필형/홀빈/로스팅정도: 강함/원산지: 외국산/개당중량: 340g
스타벅스 돌체구스토 토피넛향 라테입,원두커피
스타벅스 디카페인 하우스 블렌드,원두커피/원물(잎차)/파우치형/홀빈/분쇄여부: X/로스팅정도: 중간/로스팅단계: 미디엄 로스팅
스타벅스 디카페인 하우스 블렌드 그라운드,원두커피/분말/파우치형/홀빈/분쇄여부: O/로스팅정도: 중간/로스팅 단계: 미디엄 로스팅
스타벅스 디카프 카페 베로나 다크로스트 그라운드 분쇄원두,원두커피/분말/드립백/파우치형/로스팅정도: 강함
스타벅스 디카프 파이크 플레이스 그라운드 커피,원두커피/드립백/파우치형/홀빈
스타벅스 바닐라 플레이버 그라운드,원두커피/분말/파우치형/홀빈/분쇄여부: O
스타벅스 베란다 블렌드 그라운드 커피,원두커피/리필형/홀빈/원산지: 외국산/개당중량: 340g
스타벅스 베란다 블렌드 분쇄원두,원두커피
스타벅스 베란다 블렌드 블론드 로스트,원두커피/분말/분쇄여부: O
스타벅스 베란다 블렌드 홀빈,원두커피/원물(잎차)/파우치형/홀빈/분쇄여부: X
스타벅스 브렉퍼스트 블렌드 그라운드 커피,원두커피/드립백
스타벅스 브렉퍼스트 블렌드 미디엄 그라운드,원두커피/리필형/파우치형/홀빈/분쇄여부: O/로스팅정도: 중간
스타벅스 브렉퍼스트 블렌드 미디엄 로스트,원두커피/원물(잎차)/파우치형/홀빈/분쇄여부: X/로스팅정도: 중간/로스팅 단계: 미디엄 로스팅
스타벅스 브렉퍼스트 블렌드 미디엄 홀빈원두,원두커피/드립백/로스팅정도: 중간
스타벅스 블랙퍼스트 블렌드 그라운드 커피,원두커피/드립백
스타벅스 선라이즈 블렌드 그라운드,원두커피/분말/파우치형/홀빈/분쇄여부: O
스타벅스 수마트라 다크 그라운드,원두커피/분말/파우치형/홀빈/분쇄여부: O
스타벅스 수마트라 다크 로스트 홀빈,원두커피/원물(잎차)/파우치형/홀빈/분쇄여부: X
스타벅스 수마트라 다크 홀빈 커피,원두커피
스타벅스 스프링 데이 블렌드 그라운드,원두커피/분말/파우치형/홀빈/분쇄여부: O
스타벅스 스프링 블렌드 홀빈 커피,원두커피/드립백
스타벅스 시그니춰 에스프레소 블렌드,원두커피/홀빈
스타벅스 시나몬 돌체 그라운드 커피,원두커피/홀빈
스타벅스 시나몬 돌체 플레이버 그라운드,원두커피/분말/파우치형/홀빈/분쇄여부: O
스타벅스 싱글 오리진 콜롬비아 분쇄,원두커피/리필형/드립백/파우치형/홀빈
스타벅스 에스프레소 다크 로스트,원두커피/파우치형/홀빈/로스팅정도: 강함
스타벅스 에스프레소 로스트 홀빈,원두커피/원물(잎차)/파우치형/홀빈/분쇄여부: X/로스팅정도: 강함/원산지: 미국 로스팅단계: 다크 로스팅
스타벅스 에스프레소 블렌드,원두커피/원물(잎차)/파우치형/홀빈/분쇄여부: X/로스팅정도: 강함/로스팅 단계: 다크 로스팅
스타벅스 원두커피 선물세트,원두커피/커피세트
스타벅스 윈터 블렌드 원두커피,원두커피/드립백
스타벅스 이탈리안 다크 로스트 그라운드,원두커피/분말/파우치형/홀빈/분쇄여부: O
스타벅스 카라멜 크림 그라운드 커피,원두커피/분말/파우치형/홀빈/분쇄여부: O
스타벅스 카라멜 플레이버 그라운드,원두커피/분말/파우치형/홀빈/분쇄여부: O
스타벅스 카페 베로나,"원두커피/원물(잎차)/파우치형/홀빈/분쇄여부: X/로스팅정도: 강함/원산지: 라틴아메리카, 인도네시아 로스팅 단계: 프렌치 로스팅"
스타벅스 카페 베로나 다크 큐리그 K컵 커피,원두커피/드립백
스타벅스 카페 베로나 다크로스트 그라운드 분쇄원두,원두커피/분말/리필형/드립백/파우치형/홀빈/분쇄여부: O/로스팅정도: 강함
스타벅스 카페 베로나 홀빈원두,원두커피/파우치형/홀빈
스타벅스 케냐 홀빈원두,원두커피/드립백
스타벅스 파이크 플레이스 그라운드 커피,원두커피/드립백/파우치형
스타벅스 파이크 플레이스 로스트,원두커피/리필형/홀빈/원산지: 외국산/개당중량: 340g
스타벅스 파이크 플레이스 미디엄 로스트 그라운드,원두커피/분말/파우치형/홀빈/분쇄여부: O/로스팅정도: 중간/로스팅 단계: 미디엄 로스팅
스타벅스 파이크 플레이스 미디엄 원두 홀빈,원두커피/드립백/파우치형/홀빈
스타벅스 파이크 플레이스 홀빈 커피,원두커피/드립백/파우치형
스타벅스 파이크플레이스 로스트블랙커피캔커피 캔음료,원두커피/그린빈
스타벅스 프렌치 로스트 그라운드 커피,원두커피/분말/리필형/드립백/파우치형/로스팅정도: 강함
스타벅스 프렌치 로스트 다크,원두커피/원물(잎차)/파우치형/홀빈/분쇄여부: X/로스팅정도: 강함/로스팅 단계: 프렌치 로스팅
스타벅스 프렌치 로스트 홀빈원두,원두커피/드립백/파우치형
스타벅스 하우스 블렌드,원두커피/원물(잎차)/파우치형/홀빈/분쇄여부: X/로스팅정도: 중간/로스팅 단계: 미디엄
스타벅스 하우스 블렌드 홀빈,원두커피/원물(잎차)/파우치형/홀빈/분쇄여부: X/로스팅정도: 중간/로스팅 단계: 미디엄 로스팅
스타벅스 홀리데이 블렌드 그라운드 커피,원두커피/분말/드립백/파우치형/홀빈/분쇄여부: O/로스팅정도: 중간
스타벅스 홀리데이 블렌드 홀빈원두,원두커피/리필형/드립백/파우치형/홀빈/원산지: 외국산/개당중량: 190g
슬렁커피 로스팅 원두커피 브라질 세하도,원두커피/드립백
시골커피 시골커피 갓볶은 원두,원두커피/드립백
시골커피 원두,원두커피/드립백/분쇄여부: 선택
시골커피 이디오피아 예가체프 G1 코케허니,원두커피/드립백
시그니처 유기농 원두커피,원두커피/드립백
씨앤푸드 베누스타 카페에스프레소 원두커피,원두커피/드립백
씨케이코퍼레이션즈 어라운지 과테말라 블렌드,원두커피/드립백
아로마빌커피 핸드립 에티오피아 예가체프 G2 10T,원두커피/드립백/총량: 10T/중량: 10g
아로마빌커피 핸드립 에티오피아 예가체프 G2 30T,원두커피/드립백/총량: 30T/중량: 10g
아로마빌커피 핸드립 케냐 바링고 50T,원두커피/드립백/총량: 50T/중량: 6.3g
아로스티레 에티오피아 예가체프 G2,원두커피/홀빈
아름다운커피 공정무역 드립백커피 3종 선물세트,원두커피/드립백
아름다운커피 수마트라의 선물 커피공정무역커피,원두커피/드립백
아름다운커피 아름다운커피 공정무역 안데스의선물 홀빈커피,원두커피/드립백
아름다운커피 안데스의 선물 분쇄형,원두커피/드립백
아름다운커피 킬리만자로의 선물 커피,원두커피/드립백
아지노모도 AGF 인스턴트커피,원두커피/드립백
아키타이프 베트남 로부스타 G1,원두커피
알비코퍼레이션 로스터빈 로스터스빈 갓볶은 원두커피,원두커피/드립백/분쇄여부: 선택
애터미 애터미 카페 100% 아라비카 블랙미니커피 70T,원두커피/드립백
애터미 애터미 카페 100% 아라비카 블랙커피 80T,원두커피/드립백
앤드류 더코나빈 자메이카 블루마운틴 엑스트라 팬시 10,원두커피
앤드류 앤드류커피 에티오피아 시다모,원두커피/드립백
앤드류 앤드류커피 코스타리카 타라주,원두커피/드립백
앤드류 자메이카 블루마운틴 스페셜티,원두커피/드립백
앤드류 자메이카 블루마운틴 엑스트라 팬시 100,원두커피/드립백
앤드류 코스타리카 타라주,원두커피/드립백
앤드류 코코비아 앤드류커피 과테말라 안티구아,원두커피/드립백
앤드류 코코비아 앤드류커피팩토리 갓볶은 앤드류커피 에티오피아 예가체프 미디엄,원두커피/드립백
앤드류 행복을 주는 커피 자메이카 블루마운틴 블렌드,원두커피/드립백
앤드류커피팩토리 원두,원두커피/드립백/파우치형/홀빈/분쇄여부: 선택
앤트러사이트 버터 팻 트리오,"원두커피/원물(잎차)/파우치형/홀빈/분쇄여부: X/
[맛집] 앤트러사이트/원산지: 브라질, 에티오피아, 콜롬비아, 과테말라, 인도네시아"
야콥스 타시모 야콥스 에스프레소,원두커피/드립백
어라운지 돌체 블렌드 커피,원두커피/드립백/파우치형/홀빈
어라운지 에티오피아 초이스 커피,원두커피/드립백
언노운로스터스 콜롬비아 후일라,원두커피/원물(잎차)/파우치형/홀빈/분쇄여부: X/원산지: 콜롬비아 100%
에센티아이팩토리 베트남 로부스타 G1,원두커피/드립백
에티오피아 예가체프 아리차,원두커피/드립백
엑스데일리커피 과테말라 SHB,원두커피/드립백
엑스데일리커피 에디오피아 예가체프,원두커피/드립백/파우치형/홀빈
엑스데일리커피 엑스커피 콜롬비아 슈프리모,원두커피/드립백
엑스데일리커피 콜롬비아 슈프리모 원두커피,원두커피/드립백/홀빈
엑스팩토리 갓볶은 원두커피,원두커피/파우치형/홀빈/분쇄여부: 선택/로스팅정도: 중간/원산지: 브라질 로스팅 단계: 시티 로스팅
엑스팩토리 브라질 산토스,원두커피/파우치형/홀빈/분쇄여부: 선택/로스팅정도: 중간/원산지: 브라질 로스팅 단계: 시티 로스팅
엑스팩토리 엑스데일리커피 예멘 모카 마타리,원두커피/드립백
엑스팩토리 웰던커피 웰던커피 핸드드립커피 인도네시아만델링,원두커피/드립백
엑스팩토리 웰던커피 웰던커피 핸드드립커피 케냐AA,원두커피/드립백
엑스팩토리 웰던커피 웰던커피 핸드드립커피 콜롬비아슈프리모,원두커피/드립백
엑스팩토리 웰던커피 핸드드립 커피 에디오피아 예가체프 36T,원두커피/드립백/1T당: 8g
엑스팩토리 콜롬비아 슈프리모,원두커피/파우치형/홀빈/분쇄여부: 선택/로스팅정도: 강함/원산지: 콜롬비아 로스팅 단계: 풀시티 로스팅
엔젤보나 스위트 내츄럴,"원두커피/파우치형/홀빈/분쇄여부: 선택/로스팅정도: 강함/원산지: 에티오피아, 브라질 로스팅 단계: 풀시티 로스팅"
엔젤보나 에티오피아 예가체프 워시드 G2,원두커피/드립백
엔젤보나 엔젤보나 문브랜딩,원두커피/드립백
엔젤보나 엔젤보나 에티오피아 예가체프 원두,원두커피/드립백
엔젤보나 원두 커피,원두커피/드립백/파우치형/홀빈/분쇄여부: 선택
엠즈씨드 폴바셋 브라질 세라베르데,원두커피/원물(잎차)/파우치형/홀빈/분쇄여부: X/원산지: 브라질 100%
엠즈씨드 폴바셋 시그니처 블렌드 원두,원두커피/리필형/홀빈/원산지: 외국산
엠즈씨드 폴바셋 시그니처 블렌드 풀 포텐셜,"원두커피/원물(잎차)/파우치형/홀빈/분쇄여부: X/원산지: 브라질, 에티오피아"
엠즈씨드 폴바셋 에티오피아 시다모,원두커피/원물(잎차)/파우치형/홀빈/분쇄여부: X/원산지: 에티오피아 100%
엠즈씨드 폴바셋 폴바셋 원두커피/603301,원두커피/드립백
오늘 좋은 마일드 블렌드 홀빈,원두커피/드립백
오렌지피플 CUPFUL STALK 원두커피컵풀,원두커피/드립백
오피스네오/커피휠터 모음 여과지,원두커피/드립백
우도상역 코맥 코맥 커피3종세트B형-C2/C3/C4,원두커피/드립백
우도상역 코맥 콜롬비아 수프리모,원두커피/리필형/홀빈/원산지: 콜롬비아
워너빈 베트남 로부스타 G1 원두커피,원두커피/원물(잎차)/파우치형/홀빈/분쇄여부: X/로스팅정도: 강함/로스팅 단계: 시티 로스팅~풀시티 로스팅
워너빈 에티오피아 시다모 G4 원두커피 홀빈,원두커피/드립백
워너빈 워너빈 에티오피아 예가체프 원두커피 홀빈,원두커피/드립백
워너빈 워너빈 인도네시아 만델링 G1,원두커피/드립백
워너빈 워너빈 콜롬비아 수프리모 후일라 원두커피 홀빈,원두커피/드립백
워너빈 워너빈 콜롬비아 수프리모 후일라 홀빈,원두커피/드립백/파우치형/홀빈
워너빈 원두커피,원두커피/파우치형/홀빈/분쇄여부: 선택//상세페이지 참조
워너빈 코스타리카 따라주 SHB,원두커피/파우치형/홀빈/분쇄여부: 선택/로스팅정도: 중간/로스팅 레벨: 시티~풀시티
워너빈 콜롬비아 수프리모 후일라,원두커피/파우치형/홀빈/분쇄여부: 선택/로스팅정도: 중간/로스팅단계: 시티~풀시티로스팅
원당커피 디카페인 콜롬비아 수프리모,원두커피/홀빈
웨이브온 문라이트 블랜드,원두커피/드립백
